,Title,Link,Content(RAW)
50,"Sama-sama Melibatkan Penyimpangan Realitas, Ini Perbedaan …",https://www.kompas.com/tren/read/2023/12/13/183000065/sama-sama-melibatkan-penyimpangan-realitas-ini-perbedaan-halusinasi-dan?page=all,"KOMPAS.com - Halusinasi dan delusi adalah kondisi yang dialami seseorang yang melibatkan distorsi realitas.

Artinya, apa yang orang tersebut persepsikan, rasakan, maupun yang ia yakini sebenarnya bersifat tidak nyata.

Meski halusinasi dan delusi melibatkan penyimpangan terhadap realitas, namun keduanya adalah dua hal yang sangat berbeda.

Baca juga: Alasan Seseorang Mengalami Halusinasi, Berikut Faktor-faktor Penyebabnya

Simak penjelasan berikut ini untuk mengetahui perbedaannya.

Pengertian halusinasi

Halusinasi adalah persepsi terhadap suatu obyek atau peristiwa yang tidak nyata yang melibatkan indra, baik penglihatan, suara, penciuman, sentuhan, maupun rasa.

Dilansir dari laman Mediline Plus NIH, halusinasi melibatkan penginderaan terhadap hal-hal yang terasa nyata namun sebenarnya tidak. Hal-hal tersebut diciptakan oleh pikiran.

Halusinasi tampak nyata, namun sebenarnya hal tersebut tidak ada. Reaksi kimia dan/atau kelainan di otak menjadi faktor utama yang menyebabkan halusinasi.

Baca juga: Kecubung Picu Halusinasi, Kenapa Tidak Masuk Golongan Narkotika?





Halusinasi biasanya merupakan gejala gangguan yang berhubungan dengan psikosis, khususnya skizofrenia.

Namun halusinasi juga dapat disebabkan oleh efek dari penggunaan narkoba, kondisi neurologis, dan beberapa situasi sementara.

Seseorang mungkin mengalami halusinasi dengan atau tanpa kesadaran bahwa apa yang dialaminya tidak nyata.

Dan ketika seseorang mengira halusinasinya nyata, maka itu bisa dianggap sebagai gejala psikotik.

Baca juga: Menonton TikTok dan Reels Berlebihan Sebabkan Halusinasi, Kok Bisa?

Pengertian delusi

iStockphoto/PeopleImages Ilustrasi perbedaan delusi dan halusinasi. Ilustrasi perbedaan delusi dan halusinasi.

Delusi adalah keyakinan salah yang bertentangan dengan kenyataan. Seseorang tidak bisa melepaskan keyakinannya yang tidak benar, meskipun ada bukti yang bertentangan.

Dilansir dari laman Verywell Mind, delusi sering kali diperkuat oleh salah tafsir atas suatu peristiwa, dan banyak juga yang melibatkan paranoia pada tingkat tertentu.

Delusi adalah gejala umum dari beberapa gangguan psikotik. Hal ini mungkin terjadi bersamaan dengan halusinasi, yang melibatkan persepsi sesuatu yang sebenarnya tidak ada.

Baca juga: Apa Itu Halusinasi? Berikut Pengertian, Gejala, dan Jenisnya

Delusi ditandai dengan keyakinan yang tak tergoyahkan pada hal-hal yang tidak benar, dan dalam banyak kasus, masih ada keyakinan terhadap khayalan tersebut meskipun ada bukti yang menyatakan sebaliknya.

Beberapa delusi mungkin melibatkan keyakinan normal yang secara teoretis dapat terjadi dalam kehidupan nyata, seperti percaya bahwa pasangan Anda selingkuh.

Delusi lainnya bahkan bersifat aneh, fantastik, atau mustahil, seperti berpikir bahwa pemerintahan mengontrol masyarakat melalui gelombang radio.

Baca juga: Apakah Hewan juga Berhalusinasi seperti Manusia?

Perbedaan halusinasi dan delusi

iStockphoto/Gremlin Ilustrasi penyebab seseorang mengalami halusinasi. Ilustrasi penyebab seseorang mengalami halusinasi.

Sebagaimana telah disebutkan sebelumnya, meskipun halusinasi dan delusi melibatkan distorsi atau penyimpangan realitas, ada perbedaan mencolok antara keduanya.

Misalnya, pemikiran delusi berarti proses kognitif seseorang terdistorsi, atau dalam hal ini pikiran orang tersebut terdistorsi.

Sedangkan pada halusinasi, distorsi ada pada indra orang yang mengalaminya, misalnya pada indra pendengaran atau peraba.

Baca juga: Mengenal Magic Mushroom, Jamur Penyebab Halusinasi yang Masuk dalam Narkotika Golongan I

Secara sederhana, halusinasi melibatkan indera dan perasaan nyata tetapi sebenarnya tidak, dan delusi adalah keyakinan yang salah dan tetap meskipun ada bukti sebaliknya.

Pada dasarnya, kedua kondisi tersebut tidak selalu menimbulkan masalah dan kekhawatiran.

Namun bila sering dialami, perlu melakukan konsultasi atau pemeriksaan kesehatan medis dan mental."
52,"Ammar Zoni Kembali Terjerat Kasus Narkoba, Pihak Irish Bella …",https://www.kompas.com/hype/read/2023/12/14/114847466/ammar-zoni-kembali-terjerat-kasus-narkoba-pihak-irish-bella-buka-suara?page=all,"JAKARTA, KOMPAS.com - Artis peran Ammar Zoni ditangkap karena kasus dugaan penyalahgunaan narkoba pada Selasa (12/12/2023) malam.

Ammar Zoni ditangkap di sebuah apartemen di daerah Serpong, Tangerang Selatan.

Kuasa hukum Irish Bella, Nurul Amalia, mengatakan, kliennya tidak tahu menahu mengenai penangkapan Irish Bella itu.

“Mbak Irish enggak tahu apa-apa (mengenai penangkapan Ammar Zoni),” ujar Nurul Amalia melalui pesan singkat kepada Kompas.com, Kamis (14/12/2023).

Baca juga: Sidang Cerai Irish Bella dan Ammar Zoni Digelar Secara E-Court Hari Ini

Kata Nurul, Irish Bella dan Ammar Zoni kini tidak tinggal satu atap.

Sehingga Irish pun tidak tahu aktivitas yang dilakukan Ammar Zoni saat ini.

“Karena sudah tidak tahu lagi aktivitas suaminya sejak pisah rumah,” kata Nurul.

Nurul Amalia tak lagi menjawab ketika Kompas.com kembali bertanya mengenai reaksi Irish Bella mendengar kabar penangkapan Ammar Zoni.

Baca juga: 5 Fakta Penangkapan Ammar Zoni untuk Ketiga Kalinya karena Narkoba

Irish Bella juga belum memberikan pernyataan apa pun mengenai Ammar Zoni yang kembali terjerat kasus narkoba.

Sebelumnya, kuasa hukum Ammar Zoni, Jon Mathias mengatakan, selama pisah rumah dengan Irish, kliennya kini tinggal di rumah orangtuanya.

“Tidak (serumah). Yang setahu saya dia, Ammar, itu selalu dengan orangtuanya, ayahnya. Dan ada juga tempat latihannya di sekitaran BSD,” kata Jon saat ditemui di Pengadilan Agama Depok, Kamis (30/11/2023).

Sidang perceraian Ammar Zoni dan Irish Bella masih berlanjut di Pengadilan Agama Depok.

Baca juga: Kondisi Terkini Ammar Zoni Setelah Ditangkap Lagi atas Kasus Narkoba

Sidang cerai hari ini adalah jawaban dari pihak tergugat alias Ammar Zoni.

Namun, sidang perceraian kali ini digelar secara daring atau e-court.

Sehingga kedua belah pihak, dari Ammar dan juga Irish tidak hadir dalam sidang perceraian ini.

Sebagai informasi, sebelumnya mediasi antara Irish Bella dan juga Ammar Zoni batal dilakukan di Pengadilan Agama Depok pada Kamis (30/11/2023).

Mediasi dinyatakan gagal karena Ammar Zoni sebagai pihak tergugat tak menghadiri persidangan.

Baca juga: Kuasa Hukum Sebut Ammar Zoni Menangis Kembali Ditangkap karena Narkoba

Sementara, Irish Bella sudah mantap untuk bercerai dari Ammar Zoni.

Diberitakan sebelumnya, Irish Bella mengajukan gugatannya ke Pengadilan Agama Depok pada 6 November 2023 dan sidang pertama sudah dilakukan pada 17 November 2023.

Ammar dan Irish menikah pada 28 April 2019 setelah beberapa bulan berpacaran.

Dari pernikahan ini Ammar Zoni dan Irish Bella dikaruniai sepasang anak, laki-laki dan perempuan."
53,"Fakta Temuan 5 Jenazah di Gedung Kampus Unpri, …",https://www.kompas.com/tren/read/2023/12/13/190000665/fakta-temuan-5-jenazah-di-gedung-kampus-unpri-penggeledahan-dilakukan-2?page=all,"KOMPAS.com - Jajaran kepolisian setempat menemukan 5 mayat di Kampus Unpri Medan pada Selasa (12/12/2023).

Kasat Reskrim Polrestabes Medan, Kompol Teuku Fathir Mustafa mengatakan, pihaknya menemukan 4 mayat pria dan 1 mayat wanita.

""Sementara ini ada 5 mayat, kami temukan di lantai 15. Ada 4 mayat pria dan 1 mayat wanita,"" ujarnya, dilansir dari Kompas.com, Senin (11/12/2023).

Belum diketahui asal mula 5 mayat yang ditemukan di kampus Unpri Medan itu. Pihak kepolisian mengaku masih meminta keterangan dari pihak kampus.

Namun, pihak kepolisian mengaku telah mengantongi sejumlah barang bukti terkait temuan jenazah tersebut.

Baca juga: 5 Fakta Temuan Mayat Dicor di Semarang

Baca juga: Misteri Temuan Mayat-mayat di Sungai Gangga, Apa Penyebabnya?

Fakta temuan 5 mayat di Unpri Medan

Berikut Kompas.com merangkat beberapa fakta terkait temuan 5 mayat di gedung kampus Unpri Medan:

1. Temuan berawal dari video viral

Informasi mengenai keberadaan mayat di kampus Unpri bermula dari beredarnya video yang viral di media sosial X, dulunya Twitter dan grup WhatsApp.

Dalam video yang beredar, disebutkan ada dua mayat tergeletak di lantai 9 salah satu gedung Unpri Medan.

Menanggapi hal tersebut, polisi segera datang ke lokasi untuk melakukan penggeledahan di lantai 9 pada Senin (11/12/2023) malam.

Polisi menyisir beberapa ruangan lainnya. Namun, kondisi ruangan dalam keadaan terkunci.

Pada penggeledahan pertama, polisi tidak menemukan jenazah yang dimaksud dalam video.

Baca juga: Kronologi Ditemukannya 5 Mayat di Unpri Medan, Berawal dari Video 2 Jenazah di Lantai 9

2. TKP sudah dibersihkan pihak kampus

TRIBUN MEDAN/ALFIANSYAH Polisi melakukan penyelidikan di lokasi dugaan temuan dua mayat di lantai 9 kampus UNPRI Medan, Senin (11/12/2023) malam. Polisi melakukan penyelidikan di lokasi dugaan temuan dua mayat di lantai 9 kampus UNPRI Medan, Senin (11/12/2023) malam.

Diberitakan Kompas.com, Rabu (13/12/2023), saat melakukan penggeledahan di lantai 9, lokasi tempat kejadian perkara (TKP) sudah bersih.

Bak air yang diduga tempat dua jenazah ditemukan juga tidak ada.

""Kami mendapati TKP sudah dibersihkan oleh pihak kampus,"" kata Fathir, dikutip dari Tribun, Rabu.

3. Mayat ditemukan di lantai 15

Tak mendapat hasil, kepolisian kembali melakukan penyelidikan pada Selasa (12/12/2023) pagi.

Pada penggeledahan kedua kalinya itu, polisi menemukan 5 jenazah yang tergeletak di lantai 15 salah satu gedung kampus Unpri Medan.

""Iya, kita temukan di lantai 15 setelah semuanya kita geledah,"" kata Fahir, dilansir dari Kompas.com, Selasa (12/12/2023).

Baca juga: Bukan 2, Polisi Temukan 5 Mayat di Lantai 15 Gedung Unpri Medan

4. Tidak ada identitas

Lima mayat yang ditemukan di lantai 15 salah satu gedung Unpri Medan itu tidak memiliki identitas.

""Kita masih minta kejelasan dari pihak kampus. Asal jenazah ini dari mana, siapa identitasnya, kenapa bisa ada di dalam kampus,"" ungkap Fathir, masih dari sumber yang sama.

Selain menemukan 5 mayat, petugas juga melakukan penggeledehan di area kampus untuk mengumpulkan data-data terkait temuan jenazah.

Setelah melakukan pemeriksaan untuk sementara, petugas menemukan beberapa barang bukti di dalam gedung, yang berkaitan dengan dugaan mayat tersebut.

Namun, pihak kepolisian tidak membeberkan barang bukti apa saja yang ditemukan.

""Dari hasil penyelidikan kami, ada beberapa temuan yang selanjutnya temuan itu akan kami coba dalami, nanti hasilnya akan kita sampaikan,"" kata Fathir.

Baca juga: Polisi Temukan 4 Mayat Pria dan 1 Wanita Saat Geledah Kampus Unpri Medan

5. Kampus sempat tak kooperatif

Saat melakukan penggeledahan pertama kali, polisi mengaku mendapat penolakan dari pihak kampus Unpri.

Kuasa hukum UNPRI, Herman Brahmana mengatakan, pihak kampus tidak memberikan izin penggeledahan kepada petugas karena terdapat beberapa prosedur yang masih harus dilengkapi.

""Iya, memang benar polisi datang terkait video itu. Cuma saya minta harus sesuai prosedur. Prosedurnya itu izin dari ketua Pengadilan Negeri Medan,"" kata Herman, dilansir dari Kompas.com, Selasa.

Herman sendiri mengaku tidak tahu menahu terkait keberadaan 5 jenazah di kampus Unpri.

""Saya juga enggak tahu, bapak (polisi) itu yang nunjukan tadi,"" ujar Herman.

Meskipun sempat ditolak, pihak kepolisian tetap melakukan penggeledahan pada Senin (11/12/2023) malam.

Baca juga: Kronologi Temuan Mayat Ibu dan Anak di Depok, Warga Curiga Keduanya Lama Tak Terlihat

(Sumber: Kompas.com/ Rahmat Utomo, David Oliver Purba, Reza Kurnia Darmawan | Editor: Reni Susanti, David Oliver Purba, Reza Kurnia Darmawan)."
54,"Jadwal BWF World Tour Finals 2023, Kamis 14 Desember 2023",https://www.kompas.com/badminton/read/2023/12/13/23244938/jadwal-bwf-world-tour-finals-2023-kamis-14-desember-2023?page=all,"KOMPAS.com - BWF World Tour Finals 2023 akan memasuki hari kedua pada Kamis, 14 Desember 2023. Turnamen di Hangzhou Olympic Sports Expo Center, Hangzhou, China ini akan menutup musim BWF World Tour 2023.

Keenam wakil Indonesia akan melanjutkan perjuangan mereka di turnamen yang berhadiah total 2,5 juta dolar AS atau setara 39 miliar rupiah tersebut.

Indonesia mengirimkan jumlah wakil ketiga terbanyak dari kedelapan negara peserta setelah China (10) dan Korea Selatan (7).

Empat dari enam wakil Indonesia yang berlaga pada hari pertama berhasil memenangkan laga-laga mereka.

Anthony Sinisuka Ginting, Jonatan Christie, Fajar Alfian/Muhammad Rian Ardianto, dan Apriyani Rahayu/Siti Fadia Ramadhanti adalah kuartet yang berhasil mencatatkan hasil positif tersebut.

Baca juga: Hasil BWF World Tour Finals: Ginting Menang Comeback atas Naraoka

Hari kedua BWF World Tour Finals 2023 akan diawali dengan perjuangan Gregoria Mariska Tunjung, salah satu wakil yang masih belum berhasil menang pada hari pertama, menghadapi wakil Korea Selatan, An Se-young.

An, tunggal putri nomor satu di dunia, menjalani tahun luar biasa sepanjang 2023.

Ia memenangi delapan turnamen BWF World Tour, termasuk dua turnamen Super 1000 (All England dan China Open). serta tiga Super 750 (India Open, Singapore Open, dan Japan Open).

Apriyani Rahayu/Siti Fadia Ramadhanti akan menghadapi pasangan ganda putri nomor satu dunia, Chen Qing Chen/Jia Yi Fan, yang mengoleksi tujuh gelar sepanjang 2023.

Muhammad Shohibul Fikri/Bagas Maulana bakal meladeni perlawanan Kang Min-hyuk/Seo Seung-jae (Korsel) yang juara di Malaysia Masters dan Australian Open serta menjadi semifinalis antara lain di Indonesia Open dan Malaysia Open 2023.

Baca juga: Hasil Lengkap BWF World Tour Finals: Ginting dan Jojo Perkasa di Hari Pertama

Pasangan ganda putra nomor dua dunia, Fajar Alfian/Muhammad Rian Ardianto, bakal menghadapi pemenang French Open 2023, Kim Astrup/Anders Skaarup Rasmussen (Denmark).

Dari sektor tunggal putra, Anthony Sinisuka Ginting sang juara Singapore Open kemudian akan menjajal pebulu tangkis nomor 7 dunia, Shi Yuqi (China).

Perjuangan wakil Indonesia akan ditutup oleh aksi Jonatan Christie yang akan turun pada laga ke-10 di Lapangan 2 menghadapi Anders Antonsen.

Jojo memenangi tiga turnamen sepanjang 2023, termasuk French Open (Super 750) dan Indonesia Masters (Super 500).

Antonsen sendiri hanya bisa menjadi juara Korea Open (Super 500) sepanjang tahun lalu.

Jadwal BWF World Tour Finals 2023

14 Desember 2023

Lapangan 1

Match 1 mulai pukul 09.00 WIB

Match 3 Chen Qing Chen/Jia Yi Fan (China) vs Apriyani Rahayu/Siti Fadia Ramadhanti

Lapangan 2

Match 1 mulai pukul 09.00 WIB

Match 2 An Se-young (Korsel) vs Gregoria Mariska Tunjung

Match 5 Kang Min-hyuk/Seo Seung-jae (Korsel) vs Muhammad Shohibul Fikri/Bagas Maulana

Match 6 mulai pukul 16.00 WIB"
56,Cara Menanam Anggrek Vanda agar Tumbuh Subur dan Cantik,https://www.kompas.com/homey/read/2023/12/13/120000676/cara-menanam-anggrek-vanda-agar-tumbuh-subur-dan-cantik?page=all,"

JAKARTA, KOMPAS.com – Anggrek vanda merupakan salah satu jenis bunga anggrek yang banyak disukai. Bunga anggrek ini terkenal dengan kelopaknya yang rata dan akarnya yang panjang berkelok-kelok.

Anggrek vanda bersifat epifit, artinya tanaman ini hidup dengan cara menempelkan akarnya ke permukaan tanaman yang ada didekatnya untuk memperoleh kelembapan dan nutrisi yang dibutuhkan.

Baca juga: Cara Menanam Anggrek di Air

Tanaman anggrek vanda akan tumbuh dengan baik di lingkungan dengan kelembapan tinggi, suhu tinggi, cahaya terang, dan aliran udara yang baik.

Untuk mendapatkan bunga anggrek vanda yang cantik, perlu teknik penanaman dan perawatan yang benar. Dikutip dari The Spruce, Rabu (13/12/2023), berikut ini cara menanam anggrek vanda dengan benar.

Memperbanyak tanaman anggrek vanda

PIXABAY/JITKA KRASOVA Ilustrasi bunga anggrek vanda (Vanda coerulea). Ilustrasi bunga anggrek vanda (Vanda coerulea).

Anggrek vanda jarang diperbanyak dengan biji karena bibitnya mudah rusak dan pembibitan dari biji membutuhkan waktu yang lama. Maka dari itu, anggrek vanda biasanya diperbanyak dengan stek.

Baca juga: 5 Pilihan Media Tanam untuk Anggrek

Tanaman anggrek vanda memiliki cabang kecil dan biasanya berada di atas struktur akar utama.

Jika salah satu cabang ini memiliki dua atau tiga daun dan akar udara, maka bagian ini bisa digunakan sebagai bibit baru. Adapun cara stek anggrek vanda, seperti berikut:

Potong cabang anggrek vanda dengan hati-hati. Pastikan alat pemotong steril agar bibit tetap sehari. Setelah itu, tanam kembali pucuk tersebut di dalam media tanam yang subur dalam wadah yang berdrainase baik, seperti keranjang atau pot tanah liat. Jaga agar selalu lembap karena akarnya menempel pada media tanam. Siram dan beri pupuk dengan rutin.

Baca juga: 5 Media Tanam yang Cocok untuk Tanaman Anggrek

Cara menanam anggrek vanda

Selain cahaya matahari, kondisi media tanam juga penting untuk diperhatikan. Secara alami, tanaman ini tumbuh di daerah berbatu dengan sedikit atau tanpa tanah.

Akarnya yang besar akan tumbuh berkelok di udara dan menempelkan di pohon atau benda lain yang ada di dekatnya. Maka dari itu, menanamnya di pot biasa akan membuat anggrek vanda mati.

Sebaiknya, pilih keranjang yang memungkinkan aliran udara mengalir ke akar. Untuk menjaga tanaman tetap di tempatnya, tambahkan kulit kayu, lumut gambut, dan media tanam lain di dalam keranjang seperti media pot khusus untuk anggrek.

Cara ini akan membuat akar tanaman anggrek menempel di keranjang untuk menahan anggrek tetap tegak. Selanjutnya, tanam bibit anggrek vanda pada media tanam tersebut dengan hati-hati dan lakukan perawatan agar tumbuh dengan subur dan sehat.

Baca juga: Ketahui, Bahan Pot Terbaik untuk Menanam Anggrek

Setelah menanam anggrek, langkah selanjutnya yaitu melakukan perawatan. Berikut cara merawat tanaman anggrek vanda dengan benar.

Memperhatikan penyinaran matahari

Tanaman anggrek vanda memerlukan cahaya terang, namun umumnya tidak tumbuh dubur di bawah sinar matahari penuh.

Tanaman anggrek vanda sebenarnya bisa beradaptasi di lingkungan dengan sinar matahari penuh, namun pertumbuhan tidak sesehat tanaman anggrek vanda yang tumbuh di bawah naungan.

Oleh karena itu, untuk menjaga agar tanaman anggrek vanda tumbuh dengan baik, sebaiknya hindari sinar matahari yang terlalu terik.

Akan tetapi, perhatikan juga spesies yang ditanam karena ada beberapa spesies yang memerlukan lebih banyak sinar matahari dibandingkan yang lain.

Baca juga: 4 Cara Membuat Baki Kelembapan untuk Anggrek agar Tetap Segar

Menyiram tanaman

Saat cuaca panas, penyiraman perlu dilakukan dua kali sehari. Sementara itu, pada musim hujan, penyiraman bisa dilakukan cukup seminggu sekali.

Penyiraman dilakukan untuk menjaga agar wadah tanam tetap lembap namun tidak terlalu basah. Selain melakukan penyiraman, cara lain untuk menjaga kelembapan juga bisa dengan meletakkan tanaman di atas nampan berisi kerikil dan air. Namun, pastikan akar tanaman tidak langsung terendam air.

Pemupukan

Tanaman anggrek vanda memerlukan pupuk dalam jumlah yang cukup banyak. Pemupukan perlu dilakukan setiap minggu.

Pada setiap aplikasi ketiga, berikan pupuk tinggi fosfor agar tanaman bisa menghasilkan bunga yang cantik dan berkualitas. Saat musim hujan atau cuaca sedang dingin, kurangi pemupukan menjadi dua hingga empat minggu sekali.

Baca juga: Catat, Ini Jenis Pupuk yang Dibutuhkan Bunga Anggrek

Repotting tanaman

Shutterstock/Dusya Kan Ilustrasi merepotting tanaman anggrek. Ilustrasi merepotting tanaman anggrek.

Bunga anggrek vanda sebenarnya tidak perlu sering dipindah tanam. Cukup lakukan repotting atau pindah tanam dua hingga tiga tahun sekali saat tanaman sudah tumbuh besar melebihi wadah tanamnya.

Jika tidak ingin melakukan reporting secara keseluruh, cukup tempatkan bersama kelanjang laam ke dalam keranjang baru yang lebih besar.

Tambahkan juga media tanam baru yang subur dan gembur. Pastikan tidak mengganggu akar tanaman saat menambahkan media tanam.

Namun, jika ingin memindahkan tanaman secara keseluruhan, berikut langkah-langkah yang bisa dilakukan:

Baca juga: Jangan Asal, Ini 5 Cara Repotting Tanaman Anggrek

Pilih keranjang atau pot yang ukurannya lebih besar dari wadah tanam lama. Tarik tanaman dengan kuat dan lembut pada bagian pangkal wadah lama. Jika mencabut anggrek dari pot tanah liat, ada baiknya untuk memecahkan pot menggunakan palu agar tanaman bisa terlepas dan tidak rusak. Selanjutnya, bilas akar dengan air bersih dan buang akar yang mati atau busuk. Jika menggunakan pot tanah liat, isilah sepertiga bagian atas pot dengan kerikil agar drainasenya lancar. Sementara itu, pada pot dari keranjang langkah ini tidak diperlukan. Masukkan tanaman anggrek vanda ke dalam wadah baru dengan hati-hati dan sebarkan akarnya. Jika menggunakan keranjang, masukkan akar melalui slot keranjang dan ikat pangkal batang dengan kawat tanaman. Gunakan media tanam yang steril dan gembur untuk menahan tanaman di tempatnya. Terakhir, tanaman media tanaman steril ke dalam keranjang atau pot untuk memperkuat tanaman.

Pengendalian hama

Kutu putih menjadi salah satu hama yang sering menyerang tanaman anggrek vanda. Untuk mengendalikan hama ini, bisa dengan menyemprotkan insektisida sesuai dengan dosis yang dianjurkan."
57,Cerita dari Proses Syuting Film Agak Laen - Kompas.com,https://www.kompas.com/hype/read/2023/12/13/084637066/cerita-dari-proses-syuting-film-agak-laen?page=all,"JAKARTA, KOMPAS.com - Film komedi Agak Laen dari rumah produksi Imajinari Subaru saja menyelesaikan proses syutingnya.

Film garapan sutradara Muhadkly Acho ini sedang dalam tahap post-production.

Film ini menampilkan empat komika yang tergabung dalam siniar (podcast) Agak Laen, yakni Bene Dion, Boris Bokir, Indra Jegel, dan Oki Rengga.

Setelah menghadirkan teaser trailer di film Jatuh Cinta Seperti di Film-film, Agak Laen akhirnya meluncurkan video trailer perdana mereka.

Trailer perdana ini menampilkan sedikit gambaran bagaimana cerita Agak Laen akan berjalan.

Berikut rangkuman cerita dari proses syuting film Agak Laen.

1. Umumkan jadwal penayangan

Ernest Prakasa selaku produser mengumumkan film Agak Laen akan tayang pada 1 Februari 2024.

Ernest memilih penayangan sebelum Pemilihan Presiden (Pilpres) 2024 agar filmnya bisa memberikan hiburan di tengah sengitnya persaingan politik.

Baca juga: Film Agak Laen Akan Tayang di Bioskop Jelang Pilpres 2024

""Kami berharap bisa memberikan kesegaran buat penonton. Siapa pun elu, gue janji, Imajinari janji, film ini lucu banget!"" seru Ernest.

2. Banyak komedi

Ernest Prakasa menjanjikan film Agak Laen akan lucu dan sangat menghibur.

Semua itu tak lepas dari komedi yang muncul merupakan gabungan dari berbagai elemen.

""Sebenarnya kita try to keep it simple aja sih komedi di sini. Artinya guyonan verbal ala stand up iya, slapstick iya, situasi juga iya,"" kata Ernest.

Dengan tak membeda-bedakan jenis komedi, Ernest Prakasa berharap film Agak Laen justru bisa mengambil pasar yang lebih luas.

Baca juga: Ernest Prakasa Janjikan Film Agak Laen Mampu Mengocok Perut

3. Kesulitan Bene Dion

Sutradara Muhadkly Acho secara khusus berbicara tentang akting Bene Dion. Menurut Acho, akting sutradara film Ngeri-Ngeri Sedap itu kaku.

Tak jarang Acho harus melakukan retake gara-gara akting Bene.

""Saya memang punya RAM kecil, processor tinggi tapi RAM kecil jadi akhirnya berusaha untuk menikmati,"" kata Bene.

Baca juga: Biasa Jadi Sutradara, Bene Dion Kesulitan Akting di Film Agak Laen

4. Mamat Alkatiri jadi polisi

Mamat Alkatiri tampak menjadi seorang polisi dalam trailer film Agak Laen.

""Dan kita lihat citranya Mamat sudah sangat militer, dekat dengan senjata. Sepertinya (dia) tidak sulit untuk menjadi polisi,"" kata Acho.

Selain Mamat Alkatiri, ada banyak wajah komika lain yang menghiasi film Agak Laen seperti Nopek Novian, Aci Resti, Yono Bakrie, Arie Kriting, dan lain-lain.

Film Agak Laen juga menghadirkan Indah Permatasari, Tissa Biani, dan penyanyi Anggi Marito.

Baca juga: Alasan Muhadkly Acho Pilih Mamat Alkatiri Jadi Polisi di Film Agak Laen"
