,Company,Title,Link,Content(RAW),Content(EN)
0,SK,"Dituding Melakukan Kekerasan Seksual, Ini Bantahan Ketua …",https://www.kompas.com/tren/read/2023/12/20/063000365/dituding-melakukan-kekerasan-seksual-ini-bantahan-ketua-bem-ui-melki-sedek,"KOMPAS.com - Media sosial X diramaikan dengan cuitan dengan narasi Ketua Badan Eksekutif Mahasiswa (BEM) Universitas Indonesia (UI) Melki Sedek Huang diduga melakukan kekerasan seksual.

Narasi tersebut menjadi perbincangan warganet setelah diunggah oleh akun @BulanPemalu pada Senin (18/12/2023).

Dalam cuitannya, pengunggah mengatakan bahwa Melki disebut melanggar Peraturan BEM UI Nomor 1 Tahun 2023 tentang pelarangan atas kekerasan seksual.

Terkait dugaan tersebut, ia dinonaktifkan sementara dari jabatannya sebagai Ketua BEM UI berdasarkan SK 1822 yang dikeluarkan Wakil Ketua BEM UI Shifya Anindya.

Berdasarkan SK yang dimuat pengunggah, Melki dinonaktifkan sementara dari jabatan Ketua BEM UI per 17 Desember 2023.

""Apakah dapat diindikasikan bahwa MELKI SEDEK HUANG melakukan KS?"" cuit pengunggah.

Baca juga: Raditya Dika Jadi Dosen di Universitas Indonesia, UI: Mengajar Mata Kuliah Konten Audio





Tanggapan Ketua BEM UI nonaktif

Melki angkat bicara mengenai unggahan di X yang menyebutkan dirinya dinonaktifkan akibat diduga melakukan kekerasan seksual.

Ia mengatakan, dirinya tidak pernah melakukan kekerasan seksual sebagaimana tuduhan yang beredar di media sosial.

Melki juga mengaku, ia tidak pernah mendapat surat pemanggilan atau penjelasan dari pihak-pihak terkait mengenai tuduhan yang diarahkan kepadanya.

""Bahkan, saya belum mengetahui kronologi dan yang melaporkan,"" ujar Melki kepada Kompas.com, Selasa (19/12/2023).

Melki menyampaikan, meski ia belum mendapat surat pemanggilan dan mendapat penjelasan, Wakil Ketua BEM UI menyatakan bahwa penonaktifan tersebut dibuat sebagai prosedur resmi untuk penanganan kasus.

Ia juga menuturkan, dirinya akan menghargai dan menghormati proses pengusutan dugaan kekerasan seksual yang menyeret namanya.

""Dengan kepala tegak saya akan menjalani semua proses yang diperlukan,"" tandas Melki.

Baca juga: 5 Fakta Mahasiswa UI Dibunuh Senior, Motif Diduga Iri dengan Korban

Melki akan patuhi aturan

Lebih lanjut, Melki menuturkan, ia punya keinginan menciptakan lingkungan BEM UI yang memproses kekerasan seksual secara adil dan taat hukum ketika dirinya awal menjabat sebagai Ketua BEM UI.

Keinginan itu kemudian dilakukan Melki dengan merevisi Peraturan BEM UI Nomor 1 Tahun 2023 yang membuat semua yang terlapor ataupun diduga melakukan harus dinonaktifkan sementara demi kepastian proses hukum.

""Hari ini, saya memutuskan untuk menjalani aturan yang saya buat sendiri,"" ungkapnya.

Baca juga: Warganet Sebut Biaya Daftar Kuliah di UI Mahal, Apa Kata Pihak Kampus?","KOMPAS.com - Social media X was abuzz with tweets with the narrative that the head of the Student Executive Body (BEM) of the University of Indonesia (UI), Melki Sedek Huang, was allegedly involved in sexual violence. 

The narrative sparked discussions from netizens after it was uploaded by the @BulanPemalu account on Monday (18/12/2023).

In the tweet, the uploader mentioned that Melki was allegedly violating the BEM UI Regulation Number 1 of 2023, which prohibits sexual violence. 

Related to the suspicion, he was temporarily deactivated. nonaktifkan sebagai Ketua BEM UI berdasarkan SK 1822 yang dikeluarkan Wakil Ketua BEM UI, Shifya Anindya, per 17 Desember 2023. Jawabannya adalah bahwa tidak ada hubungan dengan tuduhan KS dan saat ini dia sedang berjuang untuk mempertahankan posisinya. atu penjelasan, ia telah disetujui untuk dinonaktifkan sebagai korban diduga pelaku kekerasan seksual.

Melki said that he had never committed sexual violence as suggested in the circulating rumors on social media.

Melki also claimed that he had never received any summons or explanation from the relevant parties regarding the accusations leveled at him.

""I even don't know the chronology and who reported,"" Melki said to Kompas.com on Tuesday (19/12/2023).

Melki stated that, although he had not received any explanation, he had been approved to be deactivated as a suspected victim of sexual violence. Melki, the Vice Chairman of the Student Executive Board of UI, stated that the deactivation process is a formal part of the procedure to handle the case. He also stated that he will respect and appreciate any investigation that implicates him in the allegation of sexual violence. ""I will go through all the necessary process with my head held high,"" Melki said. Further, Melki expressed his intention to obey the rules. Melki had the desire to create a safe environment at BEM UI, which would process sexual abuse fairly and legally when she first took office as Chairperson of BEM UI. This desire was then realized by Melki by revising the BEM UI Regulation No. 1 of 2023 which made it clear that anyone who is implicated or suspected of committing any offence must be suspended temporarily for legal proceedings to be held.

""Today, I have decided to take the rule that I have created myself,"" she said. What does the University say about studying at UI?"
1,SK,Harga Rokok per 1 Januari 2024 Usai Cukai Ditetapkan 10-15 …,https://www.kompas.com/tren/read/2023/12/19/170000465/harga-rokok-per-1-januari-2024-usai-cukai-ditetapkan-10-15-persen,"KOMPAS.com - Pemerintah telah menetapkan tarif cukai hasil tembakau (CHT) atau cukai rokok sebesar 10 persen pada 2024.

Penetapan tersebut diatur dalam Peraturan Menteri Keuangan (PMK) Nomor 191 Tahun 2022 tentang Perubahan Kedua Atas PMK Nomor 192/PMK.010/2021 tentang Tarif Cukai Hasil Tembakau Berupa Sigaret, Cerutu, Rokok Daun atau Klobot, dan Tembakau Iris.

Selain itu, pemerintah juga menetapkan cukai rokok elektrik (REL) dan hasil pengolahan tembakau lainnya (HPTL) sebesar 15 persen pada 2024.

""(Diatur dalam) PMK 192/2022 untuk jenis REL dan HPTL,"" kata Direktur Komunikasi dan Bimbingan Pengguna Jasa Bea Cukai, Nirwala Dwi Heryanto kepada Kompas.com, Selasa (19/12/2023).

Baca juga: Ada di Gadis Kretek, Ini Makna Meniup Asap Rokok ke Pengantin Wanita

Dasar penetapan cukai rokok

Nirwala mengatakan, kebijakan cukai rokok pada tahun 2024 masih menggunakan kebijakan multiyears.

Kebijakan tersebut sesuai dengan PMK Nomor 191 Tahun 2022 dan PMK Nomor 192 Tahun 2022.

""Secara umum tarif cukai untuk sigaret rata-rata naik 10 persen dan untuk REL naik 15 persen,"" jelas Nirwala.

Nirwala menerangkan, kebijakan tarif cukai pada 2024 mempertimbangkan empat pilar kebijakan CHT, terdiri dari pengendalian konsumsi, keberlangsungan industri, target penerimaan, dan pemberantasan rokok ilegal.

Baca juga: Kenapa Rokok Bisa Menyebabkan Ketagihan dan Apa Bahayanya?

Harga rokok 2024

Merujuk PMK Nomor 191 Tahun 2022, berikut harga rokok terbaru yang berlaku mulai 1 Januari 2024:

1. Sigaret Kretek Mesin (SKM)

Golongan I harga jual eceran paling rendah Rp 2.260 per batang, naik dari Rp 2.055 pada 2023

Golongan II harga jual eceran paling rendah Rp 1.380 per batang, naik dari Rp 1.255 pada 2023.

Baca juga: Ini yang Terjadi Saat Tubuh Mengisap Satu Batang Rokok Setiap Hari

2. Sigaret Putih Mesin (SPM)

Golongan I harga jual eceran paling rendah Rp 2.380 per batang

Golongan II harga jual eceran paling rendah Rp 1.465 per batang.

3. Sigaret Kretek Tangan (SKT) atau SPT

Golongan I harga jual eceran paling rendah Rp 1.375-Rp 1.980 per batang

Golongan II harga jual eceran Rp 865 per batang

Golongan III harga jual eceran Rp 725 per batang.

Baca juga: Rokok Kretek Filter, Penyumbang Terbesar Kedua Garis Kemiskinan di Indonesia

4. Sigaret Kretek Tangan Filter (SKTF) atau Sigaret Putih Tangan Filter (SPTF)

Harga jual eceran paling rendah Rp 2.260 per batang

5. Sigaret Kelembak Kemenyan (KLM)

Golongan I harga jual eceran paling rendah Rp 950 per batang

Golongan II harga jual eceran paling rendah Rp 200 per batang.

6. Jenis Tembakau Iris (TIS)

Harga jual eceran Rp 55-Rp 180 per batang

Baca juga: Beredar Unggahan Rokok Ilegal Dijual Rp 10.000 Per Bungkus, Bea Cukai: Konsekuensinya Tidak Main-main

7. Jenis Rokok Daun atau Klobot (KLB)

Harga jual eceran Rp 290 per batang

8. Jenis Cerutu (CRT)

Harga jual eceran Rp 495-Rp 5.500 per batang.

Baca juga: 10 Bahaya Rokok bagi Kesehatan Kulit, dari Penuaan Dini hingga Kanker","The government has set the rate of tobacco excise (CHT) or cigarette tax at 10 percent in 2024. This determination is regulated in Minister of Finance Regulation (PMK) Number 191 of 2022 concerning the Second Amendment to PMK Number 192/PMK.010/2021 concerning the Excise Tariff on Cigarettes, Cigarillos, Loose Leaf Cigarettes or Klobot, and Cut Tobacco. In addition, the government has also set the excise tax on electronic cigarettes (REL) and other tobacco products (HPTL) at 15 percent. multiyears' untuk jenis REL dan HPTL diatur dalam PMK 192/2022, yang berlaku mulai 1 Januari 2024,"" jelas Nirwala.

In accordance with PMK 192/2022 for types REL and HPTL,"" said Director of Communication and User Services of Customs, Nirwala Dwi Heryanto, to Kompas.com, Tuesday (19/12/2023).

Basis for determination of tobacco taxes

Nirwala said, the policy on tobacco taxes in 2024 still uses multiyear policy.

The policy is in accordance with PMK Number 191 of 2022 and PMK Number 192 of 2022.

""Generally 'multiyears' for types REL and HPTL is regulated in PMK 192/2022, which is valid from 1st of January 2024,"" explained Nirwala. garet: tarif cukai rata-rata naik 10 persen.

2. REL: tarif cukai naik 15 persen.

Nirwala stated that the 2024 taxation tariff policy takes into consideration four pillars of CHT policy, which consists of consumption control, industry continuity, revenue target, and elimination of illegal cigarettes.

Also read: Why Can Cigarettes be Addictive and What are the Risks?

Cigarette Prices in 2024

Referring to PMK Number 191 of 2022, the following are the latest applicable cigarette prices effective on 1 January 2024:

1. Cigarettes: the average excise tax rate will increase by 10 percent.

2. REL: excise tax rate will increase by 15 percent. Cigarette Kretek Machine (SKM)

Group I lowest retail selling price Rp 2,260 per stick, up from Rp 2,055 in 2023

Group II lowest retail selling price Rp 1,380 per stick, up from Rp 1,255 in 2023.

Read Also: This is What Happens to Your Body When You Smoke One Cigarette Stick Every Day

2. White Cigarette Machine (SPM)

Group I lowest retail selling price Rp 2,380 per stick

Group II lowest retail selling price Rp 1,465 per stick.

3. Hand-rolled Cigarette Kretek (SKT) or SPT

Group harga jual eceran Rp 1,375 to Rp 1,980 per stick. Golongan II harga jual eceran Rp 865 per stick. Golongan III harga jual eceran Rp 725 per stick. Filter Kretek Clove Cigarettes (SKTF) or White Hand Filter Cigarettes (SPTF) retail sale price, lowest Rp 2,260 per stick. Clove Kemenyan (KLM) Cigarettes, Golongan I retail sale price, lowest Rp 950 per stick. The lowest retail selling price is Rp 200 per stick.

6. Type of Slited Tobacco (TIS)

Retail selling price is between Rp 55 to Rp 180 per stick. 

Read also: Illegal Cigarettes Circulate Selling Rs 10,000 per Pack, Customs: The Consequences Are Not A Joke

7. Kind of Leaves Cigarettes or Klobot (KLB)

Retail selling price Rp 290 per stick.

8. Type of Snuff (CRT)

Retail selling price is between Rp 495-Rp 5.500 per stick.

Read also: 10 Dangers of Cigarettes for Skin Health, from Premature Aging to Cancer."
2,SK,"Kemarin, ekonomi Indonesia resilien hingga penemuan cadangan …",https://www.antaranews.com/berita/3879204/kemarin-ekonomi-indonesia-resilien-hingga-penemuan-cadangan-gas,"Kemarin, ekonomi Indonesia resilien hingga penemuan cadangan gas

Jakarta (ANTARA) - Sejumlah informasi penting dan menarik mewarnai pemberitaan bidang ekonomi pada Selasa (19/12/2023) kemarin, mulai dari ekonomi RI resilien, penemuan cadangan gas di Andaman, peresmian Jembatan Otista hingga maskapai penerbangan melanggar ketentuan menjual tiket dengan harga di atas ambang batas pada momentum Natal 2023 dan Tahun Baru 2024.Berikut berita selengkapnya.Bank Mandiri: Ekonomi Indonesia resilien hadapi volatilitas di 2023Direktur Treasury and International Banking Bank Mandiri Eka Fitria mengatakan perekonomian Indonesia tetap resilien meski menghadapi volatilitas pada 2023.Baca selengkapnya di sini SKK Migas & Mubadala Energy umumkan penemuan cadangan gas di AndamanSatuan Kerja Khusus Pelaksana Kegiatan Usaha Hulu Minyak dan Gas Bumi (SKK Migas) dan perusahaan energi dari Uni Emirat Arab, Mubadala Energy mengumumkan penemuan cadangan gas dari sumur eksplorasi Layaran-1 Kontrak Kerja Sama (KKS) South Andaman.Baca selengkapnya di sini Ekonom perkirakan BI pertahankan suku bunga acuan di level enam persenKepala Ekonom Bank Mandiri Andry Asmoro memperkirakan Bank Indonesia (BI) akan mempertahankan suku bunga acuan di level enam persen dalam Rapat Dewan Gubernur (RDG) Bank Indonesia (BI) pada 20-21 Desember 2023.Baca selengkapnya di sini Kemenhub temukan 3 maskapai langgar batas atas harga tiketKementerian Perhubungan (Kemenhub) menemukan tiga maskapai penerbangan melanggar ketentuan menjual tiket dengan harga di atas ambang batas pada momentum Natal 2023 dan Tahun Baru 2024.Baca selengkapnya di sini di sini Presiden Jokowi resmikan Jembatan Otista Kota BogorPresiden RI Joko Widodo meresmikan bangunan baru Jembatan Otto Iskandar Dinata (Otista) selebar 22 meter dengan anggaran Rp101 miliar di jalur sistem satu arah (SSA) yang mengelilingi Istana Bogor, pusat pemerintahan, dan kawasan bisnis Kota Bogor, Jawa Barat, Senin.Baca selengkapnya di sini Pertamina sediakan 359 SPBU Siaga di Sumbagut pada Natal-tahun baruPT Pertamina Patra Niaga Regional Sumatera Bagian Utara (Sumbagut) menyediakan 359 SPBU Siaga di Sumbagut yakni Aceh, Sumatera Utara, Sumatera Barat, Riau, dan Kepri sebagai layanan khusus selama masa libur Natal 2023 dan Tahun Baru 2024.Baca selengkapnya di sini

Pewarta: Martha Herlinawati Simanjuntak

Editor: Kelik Dewanto

Copyright © ANTARA 2023","Yesterday, Indonesia's economy was resilient to the discovery of gas reserves

Jakarta (ANTARA) - A range of important and interesting economic news marked Tuesday (19/12/2023) yesterday, ranging from the resilience of the Indonesian economy, the discovery of gas reserves in the Andaman Sea, the inauguration of the Otista Bridge, and airlines violating regulations by selling tickets above the threshold price during the Christmas 2023 and New Year 2024. Here are the latest news. Bank Mandiri: The Indonesian economy remains resilient. KKS') di wilayah Kerangka Kerja Kontrak Kerja Sama ('RKKS') Laut Andaman.

The Director of Treasury and International Banking at Bank Mandiri, Eka Fitria, said that Indonesia's economy remains resilient despite facing volatility in 2023. Read more here SKK Migas & Mubadala Energy announce discovery of gas reserves in the Andaman Sea. The Special Task Force for Upstream Oil and Gas Business Activities (SKK Migas) and an energy company from the United Arab Emirates, Mubadala Energy, have announced the discovery of gas reserves from the Layaran-1 exploration well in the Andaman Sea Contract Area. Economists predict that BI will maintain the benchmark interest rate at six percent. The Chief Economist of Bank Mandiri, Andry Asmoro, predicted that Bank Indonesia (BI) will maintain the benchmark interest rate at six percent during the Bank Indonesia (BI) Governor's Board Meeting (RDG) on December 20-21, 2023.Read more here. The Ministry of Transportation (Kemenhub) has found three airlines that exceed the price limit for tickets. Selling tickets at above-limit prices for Christmas 2023 and New Year 2024. Read more here President Jokowi inaugurates Otista Bridge in Bogor CityPresident of the Republic of Indonesia Joko Widodo inaugurated a new 22-meter-wide building of Otto Iskandar Dinata (Otista) Bridge with a budget of Rp101 billion on the one-way system (SSA) that surrounds the Bogor Palace, the governmental center, and the business area of Bogor City, West Java, on Monday.Read more here Pertamina provides 359 SPBU's. Pertamina Patra Niaga Regional Sumatera Bagian Utara (Sumbagut) is providing 359 standby gas stations in Sumbagut, including Aceh, North Sumatra, West Sumatra, Riau, and Kepri, as a special service during the Christmas 2023 and New Year 2024 holidays. Read the full article here.
Reporter: Martha Herlinawati Simanjuntak Editor: Kelik Dewanto Copyright © ANTARA 2023"
