,Title,Link,Content(RAW)
151,Kerja sama IPB University-CJI fasilitasi lulusan bekerja di Jepang,https://www.antaranews.com/berita/3871032/kerja-sama-ipb-university-cji-fasilitasi-lulusan-bekerja-di-jepang,"Kerja sama IPB University-CJI fasilitasi lulusan bekerja di Jepang

Tokyo (ANTARA) - IPB University dan Chuo Joho Institute Technology (CJI) menyepakati kerja sama program “3+2” yang dirancang agar lulusan langsung bisa memasuki pasar kerja di Jepang.“Saya yakin kerja sama pendidikan vokasi ini dapat menghasilkan kualitas sumber daya manusia terbaik yang diperlukan Indonesia dan Jepang. Namun, kuantitas juga harus ditargetkan agar kebutuhan tenaga kerja kedua negara terpenuhi,” kata Duta Besar RI untuk Jepang Heri Akhmadi di Tokyo, Kamis.Kerja sama tersebut tertuang dalam nota kesepahaman yang ditandatangani oleh Rektor IPB University Arif Satria dan Presiden CJI Hiroshi Okamoto.Rektor Arif Satria menganggap bahwa kerja sama dengan CJI ini sangat strategis dan merupakan bagian upaya IPB University dalam mengukuhkan komitmen untuk membangun ekosistem pendidikan, program penelitian dan pengabdian masyarakat yang mampu meningkatkan resiliensi, perubahan cara berpikir, mendisain masa depan dan mencapai keberlanjutan.“Kami meyakini kerja sama ini akan ikut menyumbangkan dukungan pada keberlanjutan lingkungan dan masyarakat melalui teknologi informasi dan pengembangan pertanian sehingga memiliki dampak terhadap masyarakat global,” katanya.Presiden CJI Hiroshi Okamoto menyampaikan kerja sama tersebut adalah sebuah kehormatan yang sejalan dengan visi CJI, yakni ""Menciptakan Masa Depan"".Institusi tersebut telah mendidik lebih dari 1.000 mahasiswa di bidang TI, AI, bisnis, dan bahasa Jepang, dengan tingkat penyerapan alumni dalam berbagai industri mencapai dari 95 persen.Kerja sama itu memungkinkan CJI menyediakan pendidikan bahasa Jepang dan vokasi bagi warga Indonesia asal IPB University dan akan membantu cita-cita global mereka.Okamoto meyakini kesepakatan itu akan menguatkan kerja sama pendidikan dan persahabatan antara Jepang dan Indonesia.Melalui Atase Pendidikan KBRI Tokyo dan Sekolah Vokasi IPB, CJI memulai inisiatif tersebut yang bermula dari diskusi sejak Agustus 2023.Program itu mendukung J-Mirai Project, inisiasi pemerintah Jepang yang bertujuan membuka peluang bagi orang asing untuk belajar dan bekerja di Jepang.Menurut Dosen Indonesia yang mengajar di CJI Dewi Ariantini Yudhasari, Kementerian Pendidikan, Budaya, Olahraga, Ilmu Pengetahuan dan Teknologi Jepang mendukung skema itu dan telah menyediakan hibah untuk memastikan kelancaran program.Pada 2024, program itu akan memasuki fase implementasi dengan menerima enam mahasiswa dari Sekolah Vokasi IPB University yang akan diarahkan untuk bekerja di sektor seperti Perhotelan dan Sumber Daya Manusia.Para mahasiswa itu berasal dari program studi Ekowisata, Pertanian, dan Akuntansi.Rencana implementasi program mencakup pembelajaran bahasa Jepang, pengurusan dokumen keberangkatan, persiapan ujian kemampuan bahasa, pembiayaan pendidikan, dan persiapan asrama di Jepang.Program itu juga termasuk konsultasi dan pembinaan berkala, serta penempatan di perusahaan mitra CJI setelah menyelesaikan programselama satu tahun.

Pewarta: Juwita Trisna Rahayu

Editor: Arie Novarina

Copyright © ANTARA 2023"
152,Pakar Berkumpul di Nanning untuk Mendukung Pengembangan …,https://www.antaranews.com/berita/3871140/pakar-berkumpul-di-nanning-untuk-mendukung-pengembangan-berkualitas-tinggi-ekonomi-malam-guangxi,"Pakar Berkumpul di Nanning untuk Mendukung Pengembangan Berkualitas Tinggi Ekonomi Malam Guangxi





Selama acara tersebut, para perwakilan mengunjungi Baiyi - Shanghecheng Creative Block, ""Nanning Night"" Scenic Area, Yongjiang Night Tour, dan destinasi populer lainnya, mengalami sendiri ekonomi malam yang kaya dan berwarna serta budaya Nanning. Para ahli pariwisata dari seluruh negeri melakukan siaran langsung sambil mengunjungi landmark kota Nanning dan menjelajahi pemandangan indah, makanan, produk khas, rekreasi, dan warisan budaya tak benda.





Lai Fuqiang, anggota Komite Partai dan Wakil Direktur Departemen Kebudayaan dan Pariwisata Wilayah Otonomi Zhuang Guangxi, menjelaskan bahwa Guangxi terletak di zona iklim monsun subtropis, dengan iklim hangat dan menyenangkan, lingkungan ekologis yang baik, pemandangan indah, adat istiadat etnis yang unik, budaya yang berwarna, dan atmosfer kehidupan malam yang kuat, yang bersama-sama membentuk keunggulan unik untuk pengembangan ekonomi malam di provinsi ini. Dalam beberapa tahun terakhir, Departemen Kebudayaan dan Pariwisata bersikeras untuk mengembangkan ekonomi malam sebagai langkah penting untuk mendorong konsumsi, menstabilkan pekerjaan, dan memperbaiki kesejahteraan rakyat, dan telah mengenalkan sejumlah kebijakan untuk memperkuat langkah-langkah kebijakan untuk pengembangan ekonomi malam. Langkah-langkah ini termasuk mengorganisir penelitian tentang indeks potensi konsumsi malam di kelompok konsumen baru Cina dan penelitian tentang pengembangan ekonomi malam Guangxi, meningkatkan penghargaan untuk proyek dan merek wisata budaya tingkat fenomenal, dan dengan gigih melaksanakan kegiatan tema konsumsi malam budaya dan pariwisata, sehingga efektif mendorong pengembangan berkualitas tinggi ekonomi malam.





Berbagai kota di Guangxi telah menumbuhkan serangkaian pertunjukan malam, seperti Beihai's Maritime Silk Road First Port dan Millennium Love Guilin, sejumlah blok tur malam, seperti Nanning Night dan Taiping Ancient City Chongzuo, sejumlah tempat wisata malam, seperti Liuzhou's Yueye Dong Village Scenic Area dan Dongxing Guomen Scenic Area, dan sejumlah rute tur malam, seperti Yongjiang Night Tour dan Liujiang Night Tour. Selain itu, 11 area pengumpulan konsumsi malam budaya dan pariwisata tingkat nasional, seperti Three Streets and Two Alleys Nanning, East-West Alley Guilin, dan Huangyao Ancient Town Hezhou, juga telah didirikan.





Nanning, ibu kota Guangxi, adalah kota yang pada dasarnya ""tidak memiliki musim dingin"" dan benar-benar dikenal sebagai ""kota yang tidak pernah tidur di China"". Dalam beberapa tahun terakhir, Nanning bertujuan untuk menjadi pusat pariwisata internasional regional. Untuk mencapai tujuan ini, kota ini telah mengembangkan model pengembangan terpadu ""budaya + pariwisata + perdagangan"", menciptakan berbagai merek konsumsi malam budaya dan pariwisata yang terstandarisasi, terdiversifikasi, dan berbeda yang menawarkan berbagai adegan konsumsi bagi wisatawan dan penduduk. Saat ini, pesona merek Nanning ""A Sleepless City in China, Romantic Nights in Nanning"" semakin menonjol, memberikan dorongan kuat untuk pembangunan metropolis internasional yang dipercepat untuk kerjasama dan pembukaan dengan ASEAN.





Guangxi akan memanfaatkan kesempatan mengadakan konferensi pertukaran ini untuk mengeksplorasi sumber daya budaya dan pariwisata yang kaya dan berwarna, mempercepat inovasi dan pembukaan serta integrasi beragam, menciptakan skenario konsumsi malam baru yang khas, membudidayakan bentuk baru untuk ekonomi malam, dan membangun pola baru untuk pengembangan ekonomi malam. Dengan menyediakan pasokan berkualitas tinggi dan layanan yang baik, tujuannya adalah meningkatkan kenyamanan, vitalitas, dan keamanan konsumsi malam, dan memenuhi tuntutan konsumsi malam yang dipersonalisasi, berlapis, dan berkualitas tinggi dari wisatawan dan penduduk. Fokusnya adalah menciptakan versi terbaru dari ekonomi malam, membentuk merek ""A New World of Charm, Romantic Nights in Guangxi"", dan mendorong lebih lanjut ekonomi malam di Guangxi untuk mendukung pengembangan ekonomi dan sosial berkualitas tinggi.





Ekonomi malam adalah komponen penting dari ekonomi perkotaan dan indikator signifikan dari keterbukaan dan vitalitas ekonomi perkotaan. Data menunjukkan bahwa sekitar 60% konsumsi terjadi di malam hari. Saat ini, ekonomi malam terus meningkat menuju industrialisasi, spesialisasi, dan kualitas yang lebih tinggi, mencerminkan aspirasi masyarakat untuk kehidupan yang lebih kaya, lebih mudah, dan lebih baik.













Sumber: Departemen Kebudayaan dan Pariwisata Wilayah Otonomi Zhuang Guangxi

Nanning, China (ANTARA /Xinhua-AsiaNet)- Dari 4 hingga 5 Desember, serangkaian acara sampingan Konferensi Pertukaran Pengembangan Berkualitas Tinggi Ekonomi Malam Guangxi 2023 diadakan di Nanning, Guangxi. Lebih dari 300 pakar terkemuka, pengusaha, dan perwakilan asosiasi industri dari seluruh negeri berkumpul di Nanning untuk mendiskusikan strategi dan rencana pengembangan berkualitas tinggi ekonomi malam Guangxi melalui pidato pakar, berbagi kasus, promosi merek, kunjungan situs, pengalaman langsung, dan bentuk lainnya.

Pewarta: Irvan Ariyana

Editor: Irvan Ariyana

Copyright © ANTARA 2023"
153,Kemenkominfo akan keluarkan aturan khusus soal AI di Indonesia,https://www.antaranews.com/berita/3869493/kemenkominfo-akan-keluarkan-aturan-khusus-soal-ai-di-indonesia,"Kemenkominfo akan keluarkan aturan khusus soal AI di Indonesia

Baca juga: Wamenkominfo katakan surat edaran panduan AI sudah tahap finalisasi

Jakarta (ANTARA) - Menteri Komunikasi dan Informatika (Menkominfo) Budi Arie Setiadi mengungkap akan segera menerbitkan peraturan tertulis yang ditujukan khusus untuk penggunaan kecerdasan buatan (Artificial Intelligence/AI) di Indonesia.“Kita sedang membuat permen-nya (Peraturan Menteri), namun bisa nanti jadinya surat edaran, bisa juga permanen, nanti kita lihat kebutuhannya, paling tidak sebagai pengantar, itu secepatnya (diluncurkan),” kata dia ditemui di Jakarta, Rabu.Nilai-nilai peraturan mengenai AI itu, lanjut Budi Arie, akan diadopsi dari peraturan serupa yang telah ditetapkan oleh Uni Eropa belum lama ini.Adapun Undang-undang AI tersebut mengambil pendekatan berbasis risiko terhadap produk atau layanan yang menggunakan kecerdasan buatan dan berfokus pada mengatur penggunaan AI dibandingkan mengatur teknologinya sendiri.Undang-undang itu dibuat untuk melindungi demokrasi, aturan hukum dan hak fundamental seperti kebebasan berpendapat, dan di saat yang sama juga mendorong adanya investasi dan inovasi.“Di Eropa sudah mulai muncul, nah kita pelajari bagaimana nanti implementasinya di Indonesia. Karena nilai-nilainya sudah kelihatan, begitu juga tentang pemanfaatan, dan kontrolnya, kita mengadopsi apa yang udah diputuskan negara maju,” ujar Budi Arie.Meski begitu, Menkominfo mengatakan peraturan mengenai AI ini bukan berarti pemerintah menolak kemajuan teknologi, melainkan untuk mengatasi potensi dampak negatif yang bisa muncul dari teknologi tersebut.“Semangatnya itu bukan kita menolak kemajuan teknologi, tapi kita harus tata, kita harus atur bagaimana dampak negatifnya bisa kita minimalisir,” tambahnya.Sebelumnya pada akhir November lalu, Wakil Menteri Kominfo Nezar Patria sempat mengatakan bahwa Kemenkominfo menargetkan untuk bisa meluncurkan aturan terkait kecerdasan buatan pada awal Desember 2023.Sementara Direktur Jenderal Informasi dan Komunikasi Publik (IKP) Kemenkominfo Usman Kansong sempat menjelaskan bahwa pemerintah betul-betul memperhatikan pengembangan AI agar jangan sampai digunakan untuk hal-hal yang buruk, namun tidak kemudian menghentikan perkembangannya.""Kita perlu kritis terhadap pengembangan teknologi, tetapi jangan terlalu khawatir. Khawatir seperlunya saja. Teknologi harus dikembangkan supaya dampak baiknya ditingkatkan, dan dampak buruknya diminimalisir,"" kata dia awal November lalu.

Pewarta: Pamela Sakina

Editor: Maria Rosari Dwi Putri

Copyright © ANTARA 2023"
154,Eks Ketua Komnas: Kasus pelanggaran HAM berat bukan isu …,https://www.antaranews.com/berita/3869646/eks-ketua-komnas-kasus-pelanggaran-ham-berat-bukan-isu-lima-tahunan,"Eks Ketua Komnas: Kasus pelanggaran HAM berat bukan isu lima tahunan

Bukan lima tahun, tapi seumur hidup akan terus dipersoalkan

Baca juga: Mahfud tegaskan PP HAM pulihkan hak korban

Padang (ANTARA) - Ketua Komisi Nasional Hak Asasi Manusia (Komnas HAM) Ke-11 Ahmad Taufan Damanik mengatakan kasus pelanggaran HAM berat masa lalu bukan isu lima tahunan yang kerap muncul setiap pemilihan umum (pemilu).""Bukan lima tahun, tapi seumur hidup akan terus dipersoalkan,"" kata panelis debat calon presiden (capres) 2024 Ahmad Taufan Damanik saat dihubungi di Padang, Rabu.Bahkan, persoalan pelanggaran HAM berat masa lalu akan selalu menjadi topik pembahasan selama peristiwa itu belum diungkap secara jelas, dan transparan termasuk mengadili pihak-pihak yang terlibat.Sebab, kata dia, masyarakat di Tanah Air tidak akan bisa begitu saja melupakan peristiwa kelam seperti hilangnya aktivis yang hingga kini tanpa kabar atau tragedi pembantaian tahun 1965 hingga 1966. Belum lagi kasus kekerasan dan pembunuhan di Tanah Papua maupun Aceh.""Kan tidak mungkin (kasus) itu ditutup begitu saja,"" ujarnya menjelaskan.Oleh karena itu, ia menegaskan persoalan pelanggaran HAM berat masa lalu bukan isu lima tahunan atau setiap pemilu saja. Bahkan, saat Taufan masih menjabat sebagai Ketua Komnas HAM, kasus itu terus dibahas bersama Presiden, Jaksa Agung dan pihak lainnya.Di satu sisi ia mengakui upaya untuk mencari titik terang belasan kasus pelanggaran HAM berat bukan hal yang mudah. Hal itu diperburuk faktor impunitas yang masih begitu kental sehingga menyulitkan pengungkapan fakta.Ia menyebutkan pelanggaran HAM berat yang terjadi lebih dari 12 kasus. Hanya saja, kasus di Bener Meriah, Aceh Tengah tidak dimasukkan karena belum sempat terpublikasi di buku Komnas HAM.""Saya sudah pernah mengingatkan Pak Mahfud karena Komnas HAM sudah menyelesaikan yang ke-13 yakni di Aceh,"" ucapnya.Ia menjelaskan yang terpenting bukan jumlah kasus, namun bagaimana pemerintah atau presiden terpilih serius menyelesaikan pelanggaran HAM berat di antaranya penembakan misterius, kasus talang sari, dukun santet dan lain sebagainya.""Jadi, ini (pelanggaran HAM berat) akan terus dipersoalkan orang,"" ujar dia.

Pewarta: Muhammad Zulfikar

Editor: Chandra Hamdani Noor

Copyright © ANTARA 2023"
155,Bea Cukai Sampaikan Hal Ini ke Pelajar dan Mahasiswa di Bali …,https://www.antaranews.com/berita/3871161/bea-cukai-sampaikan-hal-ini-ke-pelajar-dan-mahasiswa-di-bali-dan-makassar,"Bea Cukai Sampaikan Hal Ini ke Pelajar dan Mahasiswa di Bali dan Makassar

Jakarta (ANTARA) – Jelaskan ketentuan kepabeanan dan cukai, Bea Cukai gelar pertemuan dengan kalangan pelajar dan mahasiswa di Bali dan Makassar. Dalam kegiatan ini sekaligus dilakukan education fair tentang Politeknik Keuangan Negara (PKN) STAN.







Di Badung, Kantor Wilayah (Kanwil) Bali Nusra bersinergi dengan Balai Diklat Keuangan (BDK) berpartisipasi dalam kegiatan education fair yang diselenggarakan di SMA Negeri 1 Kuta Bali pada Senin (27/11). Education fair merupakan pengenalan kampus PKN STAN yang dilakukan oleh BDK Denpasar. Dalam kegiatan ini disampaikan beberapa materi, terkait jurusan, kemahasiswaan, kurikulum, kegiatan oraganisasi kemahasiswaan, dan seleksi penerimaan mahasiswa baru.





Selain itu, para siswa juga dikenalkan terkait tugas dan fungsi Bea Cukai. Mulai dari tugas dan fungsi utama Bea Cukai, hingga perbedaan kepabeanan dan cukai. Para siswa ditekankan bahwa Bea Cukai adalah garda terdepan untuk menjaga lalu lintas barang internasional. “Dalam kegiatan tersebut kami juga mengimbau para siswa agar waspada terhadap penipuan mengatasnamakan Bea Cukai saat berbelanja secara online atau lewat media sosial,” ujar Kepala Subdbirektorat Humas dan Penyuluhan Bea Cukai, Encep Dudi Ginanjar.





Pengenalan tegas dan fungsi Bea Cukai juga dilakukan di Makassar. Bea Cukai Makassar menerima kunjungan dari Mahasiswa Jurusan Bisnis dan Keuangan Institut Bisnis dan Manajemen Nitro Makassar. Kunjungan dilakukan untuk mengenal lebih dalam tugas dan fungsi yang dijalankan oleh Bea Cukai.





“Pelajar dan mahasiswa adalah generasi muda yang saat ini aktif dalam media sosial. Kami harap dengan kegiatan ini, mereka dapat paham dan menyebarluaskan informasi ini ke masyarakat yang lebih luas,” pungkas Encep.

Pewarta: PR Wire

Editor: PR Wire

Copyright © ANTARA 2023"
157,Pemerintah seleksi usulan 20 negara bebas visa kunjungan,https://www.antaranews.com/berita/3871089/pemerintah-seleksi-usulan-20-negara-bebas-visa-kunjungan,"Pemerintah seleksi usulan 20 negara bebas visa kunjungan

Kami sudah bergeser dari paradigma pariwisata berbasis kuantitas menjadi kualitas yang artinya bukan soal produk tapi pasar

Gianyar, Bali (ANTARA) - Pemerintah terus menyeleksi sebanyak 20 negara yang diusulkan mendapatkan fasilitas bebas visa kunjungan ke Indonesia dengan mempertimbangkan sejumlah aspek mulai keamanan hingga kontribusi ekonomi.""Pemerintah sekarang masih menggodok untuk seleksi lagi, negara mana saja yang pantas diberikan bebas visa kunjungan,"" kata Deputi Bidang Produk Wisata dan Penyelenggara Kegiatan Kementerian Pariwisata dan Ekonomi Kreatif (Kemenparekraf) Vinsensius Jemadu di Ubud, Kabupaten Gianyar, Bali, Kamis.Dia menjelaskan sejumlah kementerian dan lembaga termasuk Kemenparekraf memberikan sejumlah pertimbangan yang terus dibahas untuk fasilitas bebas visa kunjungan itu.Adapun pertimbangan itu menyangkut keamanan, kontribusi jumlah wisatawan terbanyak yang datang ke Indonesia hingga wisatawan mancanegara yang banyak mengeluarkan anggaran belanja selama berlibur di tanah air.Ia menjelaskan ada pun wisatawan asing yang royal di antaranya dari negara-negara di kawasan Asia Timur dan Eropa.""Saat ini, kami sudah bergeser dari paradigma pariwisata berbasis kuantitas menjadi kualitas yang artinya bukan soal produk tapi pasar. Kami cari pasar yang belanja tinggi,"" imbuhnya.Selain itu, asas timbal balik atau resiprokal juga menjadi pertimbangan pemerintah dalam memberikan fasilitas kemudahan bepergian antarnegara itu.Pertimbangan lain yang dibahas yakni kebijakan durasi waktu visa bebas kunjungan yang akan diberikan.Saat ini, bebas visa kunjungan ke Indonesia diberikan kepada 10 negara di ASEAN dengan rata-rata durasi kunjungan hingga 30 hari.""Saat ini, masih dibahas apa perlu 30 hari. Kalau wisatawan Asia Pasifik itu rata-rata enam hari lima malam, kemudian dari Eropa itu dua minggu. Kami akan lihat kembali pembahasannya terkait durasinya,"" katanya.Sebelumnya, Menteri Pariwisata dan Ekonomi Kreatif (Menparekraf) Sandiaga Uno mengusulkan 20 negara untuk mendapatkan bebas visa kunjungan ke Indonesia, sehingga meningkatkan jumlah kunjungan dan memberikan efek pengganda perekonomian.Ke-20 negara itu yaitu Australia, China, India, Korea Selatan, Amerika Serikat, Inggris, Prancis, Jerman, Qatar, Uni Ermirat Arab, Arab Saudi, Belanda, Jepang, Rusia, Taiwan, Selandia Baru, Italia, dan Spanyol.Sedangkan, dua negara lainnya, Sandi menyebutkan merupakan negara dari Timur Tengah yang berkaitan dengan investasi.Adanya usulan 20 negara itu telah diajukan kepada Presiden Joko Widodo dan setelah itu, Presiden menugaskan jajaran kementerian terkait agar menyempurnakan usulan itu.""Satu bulan ke depan akan finalisasi dan setelah itu kami akan dapat arahan dari Presiden dan kebijakan itu akan ditindaklanjuti dengan imigrasi,"" kata Sandiaga.

Pewarta: Dewa Ketut Sudiarta Wiguna

Editor: Kelik Dewanto

Copyright © ANTARA 2023"
159,"Presiden: Pemerintah respons dampak El-Nino pada 18,8 juta KPM",https://www.antaranews.com/berita/3869901/presiden-pemerintah-respons-dampak-el-nino-pada-188-juta-kpm,"Presiden: Pemerintah respons dampak El-Nino pada 18,8 juta KPM

Baca juga: Presiden salurkan BLT El Nino untuk dorong daya beli masyarakat

Pekalongan (ANTARA) - Presiden RI Joko Widodo mengatakan bahwa Pemerintah merespons untuk memberikan bantuan terhadap dampak kemarau panjang kepada 18,8 juta keluarga penerima manfaat, termasuk warga Kota Pekalongan, Jawa Tengah.""Bantuan ini dilatarbelakangi adanya super El Nino dan jangan sampai hal itu mengurangi daya beli masyarakat. Oleh karena itu, pemerintah mengeluarkan BLT (bantuan langsung tunai),"" katanya di Kota Pekalongan, Rabu.Menurut dia, bantuan ini diberikan pada kelompok masyarakat yang menjadi penerima program keluarga harapan (PKH).""Ini adalah penyaluran BLT pertama yang disalurkan di seluruh Indonesia dan di Kota Pekalongan lebih dulu,"" katanya.Presiden mengatakan bantuan langsung tunai El-Nino tersebut diberikan pada keluarga penerima manfaat selama November hingga Desember 2023, sebesar Rp200 ribu per bulan.""Jadi, setiap keluarga penerima akan menerima bantuan sebesar Rp400 ribu,"" katanya.Pada kesempatan itu, Presiden Jokowi juga memastikan Pemerintah akan melakukan penyaluran bantuan sosial (bansos) beras sebanyak 10 kilogram selama tiga bulan yang dimulai dari September hingga November ditambah periode Desember 2023.Langkah ini, kata dia, diharapkan dapat membantu rakyat bisa memenuhi kebutuhan dasar yang memerlukan bantuan pangan di akhir 2023.""Program bansos sembako (diperpanjang) hingga Maret 2024. Nanti, bansos sembako dilanjutkan Januari, Februari dan Maret 2024. Silakan manfaatkan bantuan itu untuk memenuhi gizi keluarga dan semoga bisa meringankan beban masyarakat,"" katanya.Presiden Joko Widodo yang akrab disapa Jokowi memonitor langsung penyaluran bantuan langsung tunai (BLT) El-Nino 2023 periode November-Desember 2023, yang dibagikan kepada ratusan keluarga penerima manfaat (KPM) di Kota Pekalongan, yang berlangsung di Kantor Pos Kota Pekalongan, Rabu.Setelah melakukan monitor penyaluran BLT di kantor pos, Presiden Jokowi melanjutkan kunjungan kerja ke Gudang Bulog Bondansari Kabupaten Pekalongan dengan kegiatan yang sama.

Pewarta: Kutnadi

Editor: Endang Sukarelawati

Copyright © ANTARA 2023"
160,Ganjar Pranowo sebut kerugian negara akibat korupsi hingga …,https://www.antaranews.com/berita/3869871/ganjar-pranowo-sebut-kerugian-negara-akibat-korupsi-hingga-230-triliun-benarkah,"Ganjar Pranowo sebut kerugian negara akibat korupsi hingga 230 triliun, benarkah?

Jakarta (ANTARA/JACX) – Calon presiden dengan nomor urut tiga Ganjar Pranowo dalam debat pertama capres-cawapres yang diselenggarakan Komisi Pemilihan Umum. (KPU) pada Selasa (12/12/2023) menyebut kerugian negara akibat korupsi mencapai Rp230 triliun.Berikut pernyataan capres Ganjar Pranowo tersebut:“Yang kedua, jangan biarkan mereka setor pada pemimpinnya. Kalau ini terjadi, kerunyaman itu akan muncul. Data ICW menunjukkan sekitar 230-an triliun dalam 10 tahun terakhir kerugian negara itu terjadi dan ini ekvivalen kalau bisa kita pakai untuk membuat puskesmas kira-kira 27.000,”Namun, benarkah pernyataan tersebut?Berdasarkan penelusuran, kerugian negara yang timbul dari kasus korupsi mulai tahun 2013 hingga 2022 yaitu sebesar 236,4 triliun, dilansir dari Data Tren Vonis Korupsi ICW 2013-2022.Dengan demikian, pernyataan Ganjar sebut kerugian negara akibat korupsi hingga 230 triliun merupakan benar.Sebelumnya, KPU menyelenggarakan debat pertama capres-cawapres dengan tema pemerintahan, hukum, HAM, pemberantasan korupsi, penguatan demokrasi, peningkatan layanan publik, dan kerukunan warga.Debat diikuti tiga pasangan capres-cawapres yakni nomor urut satu yakni Anies Baswedan-Muhaimin Iskandar, nomor urut dua yakni Prabowo Subianto-Gibran Rakabuming Raka, dan nomor urut tiga yakni Ganjar Pranowo-Mahfud Md.Artikel ini adalah hasil kolaborasi Aliansi Jurnalis Independen, Asosiasi Media Siber Indonesia, Masyarakat Anti-Fitnah Indonesia, Cekfakta.com bersama 18 media di Indonesia.

Pewarta: Tim JACX

Editor: Indriani

Copyright © ANTARA 2023"
