,Title,Link,Content(RAW)
61,70 Personel dan 14 Unit Damkar Padamkan Kebakaran di Jl …,https://barat.jakarta.go.id/detailberita/9539,"70 Personel dan 14 Unit Damkar Padamkan Kebakaran di Jl Manggis Srengseng

Kesejahteraan Masyarakat Kamis, 21 Desember 2023 - 6:15 267 Reporter : H.Ahmad Mujahid Edited By Izzudin

Petugas Sudis Gulkarmat Jabar memadaman ebakaran di Srengseng Kecamatan Kembangan

Kesejahteraan Masyarakat

Musibah kebakaran melanda sebuah rumah tinggal dan musollah di Jalan Manggis, RT 03/05, Kelurahan Srengseng, Kecamatan Kembangan, Jakarta Barat, Rabu (20/12) malam.

Lurah Srengseng, Adith Pratama, mengungkapkan peristiwa terjadi sekitar pukul 20.20. ""Pukul 20.30 unit damkar sudah sampai di lokasi untuk melakukan pemadaman. Bangunan yang terbakar sebuah rumah dan satu musollah,"" sebut Adith, Kamis (21/12) pagi.

Armada damkar yang dikerahkan ke lokasi sebanyak 14 Unit dan 70 personel. Selain itu, jajaran perangkat Kelurahan Srengseng, Binmas, Babinsa, unsur Sudis Sosial, Dukcapil, Tagana, Satpel LH, BPBD, PMI, FKDM, RT, RW, LMK, PPSU dan lainnya.

Adith mengungkapkan, akibat peristiwa tersebut sebanyak tiga kepala keluarga (KK) atau sepuluh jiwa kehilangan tempat tinggal.

“Sekitar pukul 20.50 api sudah padam. Warga terdampak kebakaran sementara mengungsi ke rumah saudara di sekitar lokasi,” ujarnya.

Adapun penyebab kebakaran diduga karena hubungan arus pendek listrik/korsleting dari AC. Untuk bantuan dari Sudis Sosial dan lainnya untuk warga terdampak juga sudah sampai di lokasi.

“Bantuan Natura, terpal, alas tidur, pakaian layak pakai, sembako dan perlengkapan lainnya sudah diserahterima dini hari tadi,” ujar Adith.

Sementara Kasi Operasi Sudis Gulkarmat Jakbar, Syarifudin, menambahkan luas area yang terbakar sekitar 400 meter persegi.

“Tidak ada korban jiwa maupun luka dalam peristiwa kebakaran itu,"" tandasnya. (Aji)"
62,OPAC - Book Detail,https://kios-perpustakaan.jakarta.go.id/catalogue/detail/109469,"Dalam belantara kajian filsafat, kita akan menemui banyak cabang kajian yang akan membawa kita pada fakta betapa kayanya dan beragamnya kajian filsafat itu. Buku ini mengajak kita memahami apa saja yang menjadi kajian filsafat, cabang-cabang filsafat, memahami asal-usul sejarah filsafat, aliran-aliran filsafat dengan pemahaman terhadap masing-masing aliran itu. Berbeda dengan buku pengantar filsafat yang lain, buku ini mengajak kita berpikir kritis dengan memahami filsafat. Dengan mengambil contoh kehidupan sehari-hari, buku ini semakin mudah dipahami sehingga dapat membawa dalam pemahaman filsafat yang sesungguhnya. Buku ini mengupas filsafat dari pendekatan historis, pemetaan cabang-cabang filsafat, pertarungan pemikiran, memahami filsafat cinta, hingga panduan berpikir kritis-filosofis. Inilah pengantar filsafat yang mencerahkan."
79,Pemerintah Kota Surabaya Peringati Hari Ibu dan Penutupan …,https://disdukcapil.surabaya.go.id/2023/12/22/pemerintah-kota-surabaya-peringati-hari-ibu-dan-penutupan-msib-batch-5-di-balai-kota-surabaya/,"Surabaya – Bertepatan dengan Hari Ibu (22/12/2023), Pemerintah Kota Surabaya juga peringati Hari Bela Negara, Kesetiakawanan Nasional, sekaligus bersama mahasiswa MSIB Batch 5 meresmikan penutupan yang menandakan berakhirnya periode magang Batch 5 tahun 2023.

Walikota Surabaya Eri Cahyadi menjadi inspektur upacara pada acara yang dilaksanakan di Balai Pemuda Kota Surabaya. Acara yang sekaligus merayakan peringatan Hari Ibu Ke-95, hari Bela Negara ke-75, Hari Kesetiakawanan Sosial Nasional ini di komandani oleh guru perwakilan di bawah binaan Dinas Pendidikan Kota Surabaya

Dalam memperingati Hari Ibu, seluruh petugas upacara diperankan oleh seluruh perempuan berbagai Instansi di Kota Surabaya seperti Dinas Perhubungan (Dishub), Pramuka, Badan Penanggulangan Bencana Daerah (BPBD), Pemadam Kebakaran dan Satuan Polisi Pamong Praja (Satpol PP). Acara yang juga dimeriahkan oleh paduan suara dari Satuan Guru se-Surabaya ini menyanyikan Hymne hari Ibu, Mars Bela Negara, dan Mars Hari Ibu.

“Dibalik seorang tokoh yang hebat, terdapat wanita atau ibu yang hebat. Peran ibu sangat penting dalam membentuk karakter anak dalam keluarga” ujar Eri Cahyadi dalam wawancaranya bersama mahasiswa magang dari Swargaloka.

Penghargaan bagi wanita hebat Surabaya juga diberikan, sebagai bentuk dedikasi, peran, dan kontribusi mulai dari Dokter Gigi dan Mulut bagi anak berkebutuhan khusus, Instruktur Modelling bagi anak berkebutuhan khusus disabilitas, bidan atas peran dan kontribusi dalam kerjasama administrasi kependudukan bagi masyarakat Surabaya, pendampingan siswa rentan putus sekolah, pendamping penyandang kesejahteraan sosial, peningkatan pendapat masyarakat dalam bidang UMKM, pendamping bidang lingkungan, ketua himpunan wanita disabilitas indonesia Kota Surabaya dalam memperjuangkan hak-hak perempuan disabilitas.

Selain itu, acara utama adalah penutupan bagi mahasiswa magang yang dilaksanakan secara simbolis dengan melepas ID Card peserta magang. Pelepasan tersebut diwakili oleh 6 (enam) mahasiswa dari berbagai OPD di Kota Surabaya, yakni Hamid Redi dari Universitas Indonesia, Agnes Hutabarat dari Universitas Sriwijaya, Nafisah dari Universitas Airlangga, Laksono Hafid dari Universitas 17 Agustus 1945, dan Nur Rahma dari Universitas Brawijaya.

Eri Cahyadi juga berpesan bahwa seluruh mahasiswa magang dapat menjadi agen perubahan dan dapat memberikan yang terbaik untuk daerahnya masing-masing.

“Untuk seluruh mahasiswa yang hari ini mengikuti magang, masa tugasnya sudah purna dan saya berharap para mahasiswa bisa memberikan yang terbaik kepada kotanya masing-masing dan memberikan sumbangsih yang luar biasa dan perubahan menuju kebaikan bagi negara Indonesia, sukses selalu untuk seluruh mahasiswa” ujarnya.

Rini Indriyani, istri Walikota Surabaya sekaligus Ketua TP PKK Kota Surabaya turut menggelorakan semangat untuk para mahasiswa untuk mengejar cita-citanya dan bagi seluruh wanita yang akan menjadi ibu rumah tangga kelak untuk menjadi ibu yang hebat dan luar biasa bagi keturunannya kelak.

kontributor oleh Atha Aurynnia"
