,Title,Link,Content(RAW)
0,Second successful live-fire for RTX's Raytheon Lower Tier Air and Missile Defense Sensor,https://www.rtx.com/news/news-center/2023/12/13/second-successful-live-fire-for-rtxs-raytheon-lower-tier-air-and-missile-defense,"Tactical ballistic missile acquired, tracked and intercepted

WHITE SANDS MISSILE RANGE, N.M., Dec. 13, 2023 /PRNewswire/ -- Raytheon, an RTX (NYSE: RTX) business, completed another successful live-fire demonstration of the advanced, 360-degree Lower Tier Air and Missile Defense Sensor, known as LTAMDS. This tactical ballistic missile live fire represents the latest in a series of test event successes, closely following the cruise missile live fire test and the recently completed contractor verification testing. All milestones validate the radar's performance and progression through developmental testing.

For this test event, conducted in partnership with the U.S. Army, a tactical ballistic missile surrogate was launched, flying a threat-representative trajectory. The target was acquired and tracked by LTAMDS, its track data was passed to the Integrated Battle Command System (IBCS) for launch command, and LTAMDS guided a PAC-3, Cost Reduction Initiative (CRI), missile to intercept.

""With each test, we're putting the radar up against realistic threats that our forces could face on the battlefield. And with each success, we see capability improvement for this transformational radar,"" said U.S. Army COL Jason Tate, STARE Project Manager for PEO Missiles and Space. ""From the start, the goal was to design a next-generation radar capable of outpacing the full range of current and future threats – and we will achieve that goal with LTAMDS.""

Six LTAMDS radars are currently progressing through integration and test activities simultaneously at multiple government and Raytheon test sites. Formal testing will continue in 2024.

LTAMDS is the next generation air and missile defense radar for the U.S. Army. A 360-degree, Active Electronically Scanned Array radar, powered by Raytheon-manufactured Gallium Nitride, LTAMDS provides dramatically more performance against the range of threats, from manned and unmanned aircraft to cruise missiles, ballistic missiles and hypersonics.

About Raytheon

Raytheon, an RTX business, is a leading provider of defense solutions to help the U.S. government, our allies and partners defend their national sovereignty and ensure their security. For more than 100 years, Raytheon has developed new technologies and enhanced existing capabilities in integrated air and missile defense, smart weapons, missiles, advanced sensors and radars, offensive and defensive cybersecurity tools, interceptors, space-based systems, hypersonics and missile defense across land, air, sea and space.

About RTX

RTX is the world's largest aerospace and defense company. With more than 180,000 global employees, we push the limits of technology and science to redefine how we connect and protect our world. Through industry-leading businesses – Collins Aerospace, Pratt & Whitney, and Raytheon – we are advancing aviation, engineering integrated defense systems for operational success, and developing next-generation technology solutions and manufacturing to help global customers address their most critical challenges. The company, with 2022 sales of $67 billion, is headquartered in Arlington, Virginia.

For questions or to schedule an interview, please contact [email protected]

SOURCE RTX"
1,RTX to track UK space assets with Low Earth Orbit observation system,https://www.rtx.com/news/news-center/2023/12/13/rtx-to-track-uk-space-assets-with-low-earth-orbit-observation-system,"Further international deployment of LOCI will provide a wider, more comprehensive picture of LEO

LONDON, Dec. 13, 2023 /PRNewswire/ -- Raytheon NORSS -- RTX's (NYSE: RTX) UK-based space domain awareness specialist – has been awarded a contract to provide the UK Space Agency with Space Surveillance and Tracking Services Data (SST) in low-Earth orbit (LEO) for Resident Space Objects (RSO).

Under this contract, Raytheon NORSS will use its ground-based Low-Earth Orbit Camera Installation sensors, known as LOCI, to routinely collect observation data on objects in LEO, including space debris, defence assets and commercial satellites. This data will help expand and improve the UK's sovereign space domain awareness capabilities and enhance the UK Space Agency's ability to keep assets in orbit safe from possible dangers, such as collision or fragmentation events.

Raytheon NORSS has recently increased the international deployment of LOCI in order to provide a wider, more comprehensive picture of objects in LEO. The LOCI sensor network will be operated out of multiple locations in the UK, U.S. and Australia.

""As the number of objects in LEO continues to increase, it's vital that our customers know what is happening with and around not only their assets, but also in the space environment,"" said Sean Goldsbrough, head of Raytheon NORSS. ""Our recent international expansion of LOCI will provide the UK Space Agency and MOD with the high-quality, timely and assured SST data they need.""

This announcement comes following news that Raytheon NORSS has been selected, alongside intandem, to produce a 10-year strategy for the UK Space Agency's National Space Operations Centre (NSpOC). A key objective of the centre, which is set to open in April 2024, is to enable the UK to deliver on its space domain awareness responsibilities.

About Raytheon UK

With facilities in Broughton, Waddington, Glenrothes, Harlow, Gloucester and Manchester, Raytheon UK is invested in the British workforce and the development of UK technology. Across the country the company employs 1,700 people. As a prime contractor and major supplier to the U.K. Ministry of Defence, Raytheon UK continues to invest in research and development, supporting innovation and technological advances across the country. Raytheon UK is part of RTX's Raytheon business.

About RTX

RTX is the world's largest aerospace and defence company. With more than 180,000 global employees, we push the limits of technology and science to redefine how we connect and protect our world. Through industry-leading businesses – Collins Aerospace, Pratt & Whitney, and Raytheon – we are advancing aviation, engineering integrated defence systems for operational success, and developing next-generation technology solutions and manufacturing to help global customers address their most critical challenges. The company, with 2022 sales of $67 billion, is headquartered in Arlington, Virginia.

For questions or to schedule an interview, please contact [email protected].

SOURCE RTX"
2,Northrop Grumman to Help Drive Digital Transformation within Defense Intelligence Community,https://news.northropgrumman.com/news/releases/northrop-grumman-to-help-drive-digital-transformation-within-defense-intelligence-community,"CINCINNATI – Dec. 13, 2023 – Northrop Grumman Corporation (NYSE: NOC) was awarded a contract valued up to $700 million to provide the Defense Intelligence Agency (DIA) with an integrated cloud and sensor solution to provide faster intelligence to the warfighter.

Northrop Grumman will rapidly evolve the DIA’s collection, processing, and analytics tools by:

Leveraging model-based, systems engineering to consolidate and integrate the DIA’s technical capabilities.

Implementing leading-edge solutions that meet the needs of the rapidly changing intelligence environment.

Applying digital engineering to produce operational efficiencies and affordability.

As a part of the Neptune Phoenix award, Northrop Grumman will provide the DIA with timely intelligence needed by the warfighter. (Photo Credit: Northrop Grumman)

Expert:

Jennifer Walsmith, vice president of Cyber and Information Solutions, Northrop Grumman: “We’re transforming the digital ecosystem for the intelligence community to streamline inputs and provide actionable information at the speed needed to outpace evolving threats.”

Contract Details:

The award, known as Neptune Phoenix, is a nine-year, single-award contract that includes lifecycle management, engineering, design, development, purchasing, prototyping, test and evaluation, deployment, and data analysis for current and future Radio Frequency and Electro Optical sensor systems.

Northrop Grumman is a leading global aerospace and defense technology company. Our pioneering solutions equip our customers with the capabilities they need to connect and protect the world, and push the boundaries of human exploration across the universe. Driven by a shared purpose to solve our customers’ toughest problems, our employees define possible every day."
3,New Careers Inspiration Hub launches in Barrow,https://www.baesystems.com/en/article/new-careers-inspiration-hub-launches-in-barrow,"Earlier this year, the Company purchased several retail properties in the town, including the former Debenhams, WHSmith and Bodyshop units. These vacant sites are being transformed into vibrant new spaces to provide the local community with education, outreach and recruitment services. It is hoped this investment will increase footfall in town centre, helping to boost the local economy. 

The Careers Inspiration Hub is the first site to open at the Portland Walk Campus, offering employment advice from BAE Systems and a range of Barrow and Furness employers and organisations."
