,Title,Link,Content(RAW)
11,NASA’s Space Station Laser Comm Terminal Achieves First Link,https://www.nasa.gov/missions/tech-demonstration/laser-communications-relay/nasas-space-station-laser-comm-terminal-achieves-first-link/,"A NASA technology experiment on the International Space Station completed its first laser link with an in-orbit laser relay system on Dec. 5, 2023. Together, they complete NASA’s first two-way, end-to-end laser relay system.

NASA’s LCRD (Laser Communications Relay Demonstration) and the new space station demonstration, ILLUMA-T (Integrated LCRD Low Earth Orbit User Modem and Amplifier Terminal), successfully exchanged data for the first time. LCRD and ILLUMA-T are demonstrating how a user mission, in this case the space station, can benefit from a laser communications relay located in geosynchronous orbit.
Laser communications, also known known as optical communications, uses infrared light rather than traditional radio waves to send and receive signals. The tighter wavelength of infrared light allows spacecraft to pack more data into each transmission. Using laser communications greatly increases the efficiency of data transfer and can lead to a faster pace of scientific discoveries.
On Nov. 9, NASA’s SpaceX 29th commercial resupply services mission launched cargo and new science experiments, including ILLUMA-T, to the space station. Following its arrival, the payload was installed onto the station’s Japanese Experiment Module-Exposed Facility.
ILLUMA-T and LCRD are a part of the NASA Space Communications and Navigation (SCaN) program’s effort to demonstrate how laser communications technologies can significantly benefit science and exploration missions.

“ILLUMA-T’s first link with LCRD – known as first light – is the latest demonstration proving that laser communications is the future.” said Dr. Jason Mitchell, director of SCaN’s Advanced Communications and Navigation Technology division. “Laser communications will not only return more data from science missions, but could serve as NASA’s critical, two-way link to keep astronauts connected to Earth as they explore the Moon, Mars, and beyond.”
 To view this video please enable JavaScript, and consider upgrading to a web browser that
supports HTML5 video

This is a modal window.
Beginning of dialog window. Escape will cancel and close the window.
End of dialog window.





Shortly after space station installation, operation engineers began conducting on-orbit testing to ensure the ILLUMA-T payload operated nominally. Now, it is communicating with LCRD, a relay launched in 2021 that has conducted over 300 experiment configurations to help NASA refine laser communications technologies. LCRD and ILLUMA-T are exchanging data at 1.2 gigabits-per-second.

“We have demonstrated that we can overcome the technical challenges for successful space communications using laser communications. We are now performing operational demonstrations and experiments that will allow us to optimize our infusion of proven technology into our missions to maximize our exploration and science,” said David Israel, a NASA space communications and navigation architect.
The LCRD experiments are conducted with industry, academia, and other government agencies. ILLUMA-T is now LCRD’s first in-space user experiment. NASA is still accepting experiments to work with LCRD. Interested parties should contact lcrd-experiments@nasa.onmicrosoft.com for more information.

ILLUMA-T is funded by NASA’s Space Communications and Navigation (SCaN) program at NASA Headquarters in Washington. The payload is managed by NASA’s Goddard Space Flight Center in Greenbelt, Maryland. Partners include the International Space Station program office at NASA’s Johnson Space Center in Houston and the Massachusetts Institute of Technology Lincoln Laboratory in Lexington, Massachusetts.

For more information: https://nasa.gov/scan

Katherine Schauer is a writer for the Space Communications and Navigation (SCaN) program office and covers emerging technologies, commercialization efforts, exploration activities, and more.
NASA’s first two-way laser relay system completed its first year of experiments on June 28…
In 2023, NASA is sending a technology demonstration known as the Integrated LCRD Low Earth…
NASA explores the unknown in air and space, innovates for the benefit of humanity, and inspires the world through discovery."
12,NASA’s Webb Identifies Tiniest Free-Floating Brown Dwarf,https://www.nasa.gov/missions/webb/nasas-webb-identifies-tiniest-free-floating-brown-dwarf/,"Brown dwarfs are objects that straddle the dividing line between stars and planets. They form like stars, growing dense enough to collapse under their own gravity, but they never become dense and hot enough to begin fusing hydrogen and turn into a star. At the low end of the scale, some brown dwarfs are comparable with giant planets, weighing just a few times the mass of Jupiter.
Astronomers are trying to determine the smallest object that can form in a star-like manner. A team using NASA’s James Webb Space Telescope has identified the new record-holder: a tiny, free-floating brown dwarf with only three to four times the mass of Jupiter.
“One basic question you’ll find in every astronomy textbook is, what are the smallest stars? That’s what we’re trying to answer,” explained lead author Kevin Luhman of Pennsylvania State University.
To locate this newfound brown dwarf, Luhman and his colleague, Catarina Alves de Oliveira, chose to study the star cluster IC 348, located about 1,000 light-years away in the Perseus star-forming region. This cluster is young, only about 5 million years old. As a result, any brown dwarfs would still be relatively bright in infrared light, glowing from the heat of their formation.
The team first imaged the center of the cluster using Webb’s NIRCam (Near-Infrared Camera) to identify brown dwarf candidates from their brightness and colors. They followed up on the most promising targets using Webb’s NIRSpec (Near-Infrared Spectrograph) microshutter array.
Webb’s infrared sensitivity was crucial, allowing the team to detect fainter objects than ground-based telescopes. In addition, Webb’s sharp vision enabled them to determine which red objects were pinpoint brown dwarfs and which were blobby background galaxies.
This winnowing process led to three intriguing targets weighing three to eight Jupiter masses, with surface temperatures ranging from 1,500 to 2,800 degrees Fahrenheit (830 to 1,500 degrees Celsius). The smallest of these weighs just three to four times Jupiter, according to computer models.
Explaining how such a small brown dwarf could form is theoretically challenging. A heavy and dense cloud of gas has plenty of gravity to collapse and form a star. However, because of its weaker gravity, it should be more difficult for a small cloud to collapse to form a brown dwarf, and that is especially true for brown dwarfs with the masses of giant planets.
“It’s pretty easy for current models to make giant planets in a disk around a star,” said Catarina Alves de Oliveira of ESA (European Space Agency), principal investigator on the observing program. “But in this cluster, it would be unlikely this object formed in a disk, instead forming like a star, and three Jupiter masses is 300 times smaller than our Sun. So we have to ask, how does the star formation process operate at such very, very small masses?”
In addition to giving clues about the star-formation process, tiny brown dwarfs also can help astronomers better understand exoplanets. The least massive brown dwarfs overlap with the largest exoplanets; therefore, they would be expected to have some similar properties. However, a free-floating brown dwarf is easier to study than a giant exoplanet since the latter is hidden within the glare of its host star.
Two of the brown dwarfs identified in this survey show the spectral signature of an unidentified hydrocarbon, or molecule containing both hydrogen and carbon atoms. The same infrared signature was detected by NASA’s Cassini mission in the atmospheres of Saturn and its moon Titan. It has also been seen in the interstellar medium, or gas between stars.
“This is the first time we’ve detected this molecule in the atmosphere of an object outside our solar system,” explained Alves de Oliveira. “Models for brown dwarf atmospheres don’t predict its existence. We’re looking at objects with younger ages and lower masses than we ever have before, and we’re seeing something new and unexpected.”
Since the objects are well within the mass range of giant planets, it raises the question of whether they are actually brown dwarfs, or if they’re really rogue planets that were ejected from planetary systems. While the team can’t rule out the latter, they argue that they are far more likely to be a brown dwarf than an ejected planet.
An ejected giant planet is unlikely for two reasons. First, such planets are uncommon in general compared to planets with smaller masses. Second, most stars are low-mass stars, and giant planets are especially rare among those stars. As a result, it’s unlikely that most of the stars in IC 348 (which are low-mass stars) are capable of producing such massive planets. In addition, since the cluster is only 5 million years old, there probably hasn’t been enough time for giant planets to form and then be ejected from their systems.
The discovery of more such objects will help clarify their status. Theories suggest that rogue planets are more likely to be found in the outskirts of a star cluster, so expanding the search area may identify them if they exist within IC 348.
Future work may also include longer surveys that can detect fainter, smaller objects. The short survey conducted by the team was expected to detect objects as small as twice the mass of Jupiter. Longer surveys could easily reach one Jupiter mass.
These observations were taken as part of Guaranteed Time Observation program 1229. The results were published in the Astronomical Journal.
The James Webb Space Telescope is the world’s premier space science observatory. Webb is solving mysteries in our solar system, looking beyond to distant worlds around other stars, and probing the mysterious structures and origins of our universe and our place in it. Webb is an international program led by NASA with its partners, ESA (European Space Agency) and the Canadian Space Agency.
Download full resolution images for this article  from the Space Telescope Science Institute.
Read/Download the research results released in The Astronomical Journal.
Right click the images in this article to open a larger version in a new tab/window.
Laura Betz – laura.e.betz@nasa.gov, Rob Gutro– rob.gutro@nasa.govNASA’s  Goddard Space Flight Center, , Greenbelt, Md.
Hannah Braun  – hbraun@stsci.edu , Christine Pulliam – cpulliam@stsci.eduSpace Telescope Science Institute, Baltimore, Md.
Lifecycle of Stars
More Webb News – https://science.nasa.gov/mission/webb/latestnews/
More Webb Images –  https://science.nasa.gov/mission/webb/multimedia/images/
Webb Mission Page –  https://science.nasa.gov/mission/webb/

How do we weigh planets?
What is a nebula?
What is the Webb Telescope?
SpacePlace for Kids
Ciencia de la NASA
NASA en español 
Space Place para niños
Webb is the premier observatory of the next decade, serving thousands of astronomers worldwide. It studies every phase in the…
Overview Stars are giant balls of hot gas – mostly hydrogen, with some helium and small amounts of other elements.…
Overview Galaxies consist of stars, planets, and vast clouds of gas and dust, all bound together by gravity. The largest…
Discover the universe: Learn about the history of the cosmos, what it’s made of, and so much more.
NASA explores the unknown in air and space, innovates for the benefit of humanity, and inspires the world through discovery."
13,NASA Kennedy Space Center’s Top 20 Stories of 2023,https://www.nasa.gov/centers-and-facilities/kennedy/nasa-kennedy-space-centers-top-20-stories-of-2023/,"7 min read
Here’s a look back at 2023’s most significant events at NASA’s Kennedy Space Center in Florida:
JANUARYDay of Remembrance Marks 20th Anniversary of Columbia Tragedy 
NASA senior management and guests paid tribute to the crew members of space shuttle Columbia, as well as other astronauts who perished in the line of duty, during the agency’s Annual Day of Remembrance held at the Kennedy Space Center Visitor Complex.   
JANUARYFacilities, Spacecraft Prepped for Artemis II Mission 
Teams with Exploration Ground Systems began upgrading and modifying facilities at Kennedy to support Artemis II, paving the way for human exploration to the Moon and Mars. Artemis II will be the first crewed flight of the agency’s Space Launch System rocket and Orion spacecraft.   
FEBRUARY‘Famous’ Eagles Build New Nest at Kennedy
When storms badly damaged their original nest at the Florida spaceport, a well-known pair of American bald eagles built a new home nearby along Kennedy Parkway, providing a magnificent view of the majestic birds in their natural habitat.   
FEBRUARYNew Orion Test Article Makes a Splash
NASA’s Landing and Recovery team completed a rigorous round of testing on the new mock-up of the agency’s Orion spacecraft. This test article will be used to train NASA, Navy, and other Department of Defense personnel to retrieve astronauts from the Pacific Ocean after splashing down on Artemis Moon missions.   
MARCHCrew-6 Lights up Florida Early-Morning Sky
A Falcon 9 rocket and Crew Dragon Endeavour spacecraft roared off of Kennedy’s Launch Pad 39A at 12:34 a.m. EST March 2, kickstarting NASA’s SpaceX Crew-6 mission. The launch carried NASA astronauts Stephen Bowen and Woody Hoburg, along with UAE (United Arab Emirates) astronaut Sultan Alneyadi and Roscosmos cosmonaut Andrey Fedyaev to the International Space Station for a six-month science expedition mission.  
MARCHCrew-5 Comes Back to Earth
NASA astronauts Nicole Mann and Josh Cassada, JAXA (Japan Aerospace Exploration Agency) astronaut Koichi Wakata, and Roscosmos cosmonaut Anna Kikina splashed down safely in the SpaceX Dragon Endurance in the Gulf of Mexico off the coast of Tampa, Florida, at 9:02 p.m. EST March 11, returning to Earth after 157 days in space.  
MARCHCRS-27 Launches to the Space Station
At 8:30 p.m. EDT March 14, SpaceX’s Falcon 9 rocket rumbled off the pad at Kennedy’s Launch Complex 39A, starting Dragon’s two-day journey to the International Space Station to deliver new science investigations, supplies, and equipment for Expedition 68 and 69 crews aboard the orbiting laboratory.
MARCHSwamp Works Celebrates a Decade of Discoveries
In 2023, Swamp Works, which drew its inspiration from Lockheed Martin’s Skunk Works in California, celebrated 10 years. The facility is devoted to innovation and leveraging skills and capabilities across the center, focusing on granular mechanics and regolith operations, applied chemistry, electrostatics and surface physics, advanced materials and systems, applied physics, and corrosion technology.  
MAYAstronauts Complete Second All-Private Mission
Four private astronauts completed a successful Axiom Mission 2, the second all-private astronaut mission to the space station. Axiom Space astronauts Peggy Whitson, John Shoffner, Ali Alqarni, and Rayyanah Barnawi spent 10 days on the orbiting laboratory after lifting off at 5:37 p.m. EDT on May 21 from Launch Complex 39A at Kennedy Space Center.
JUNESolar Arrays Delivered on CRS-28
Several thousand pounds of important research, crew supplies and hardware, including new solar arrays, were delivered to the space station following the June 5 launch of SpaceX’s 28th commercial resupply services mission for NASA from Kennedy’s Launch Complex 39A.  
JULYArtemis Crews Get New Ride to the Pad
Teams from manufacturer Canoo Technologies Inc. of Torrance, California, delivered three specially designed, fully electric, environmentally friendly crew transportation vehicles to Kennedy on July 11. The vehicles will take Artemis crews on the final Earth-bound leg of their journey to the Moon before boarding their rocket and spacecraft.  
AUGUSTCrew-7 Carries International Crew to Space Station   
A Dragon spacecraft, named Endurance, launched atop a Falcon 9 rocket, carrying NASA astronaut Jasmin Moghbeli, ESA (European Space Agency) astronaut Andreas Mogensen, JAXA (Japan Aerospace Exploration Agency) astronaut Satoshi Furukawa, and Roscosmos cosmonaut Konstantin Borisov to the space station on NASA’s SpaceX Crew-7 mission. Liftoff occurred at 3:27 a.m. EDT on Saturday, Aug. 26.  
AUGUSTArtemis II Crew Meets Their Ride Around the Moon 
Inside the high bay of Kennedy’s Neil Armstrong Operations and Checkout Building, Artemis II NASA astronauts Reid Wiseman, Victor Glover, and Christina Koch, and CSA (Canadian Space Agency) astronaut Jeremy Hansen visited the Orion spacecraft that will take them on a 10-day journey around the Moon as the first Artemis crew.  
SEPTEMBERCrew-6 Completes Six-Month Mission  
NASA astronauts Stephen Bowen and Woody Hoburg, along with UAE (United Arab Emirates) astronaut Sultan Alneyadi and Roscosmos cosmonaut Andrey Fedyaev splashed down safely in SpaceX’s Dragon spacecraft, named Endeavour, in the Atlantic Ocean off the coast of Jacksonville, Florida, at 12:17 a.m. EDT Monday, Sept. 24, after 186 days in space.  
SEPTEMBERArtemis II Astronauts Conduct Launch-Day Demonstration 
NASA astronauts Reid Wiseman, Victor Glover, and Christina Koch, along with CSA (Canadian Space Agency) astronaut Jeremy Hansen, practiced the procedures they will undergo on launch day to prepare for their mission around the Moon. The Artemis II crew and teams with NASA’s Exploration Ground Systems Program successfully completed the critical ground system tests at Kennedy on Sept. 20. 
OCTOBERPsyche Launches to a Metal Asteroid
NASA’s Psyche spacecraft began its six-year voyage to an asteroid of the same name, a metal-rich world that could tell us more about the formation of rocky planets, after successfully launching aboard a SpaceX Falcon Heavy rocket from Launch Pad 39A at Kennedy on Oct. 13.
OCTOBERProgress Continues Toward NASA’s Boeing Crew Flight to Station 
NASA and Boeing are working to complete the agency’s verification and validation activities ahead of the Starliner spacecraft’s first flight with astronauts to the International Space Station. While Boeing is targeting March 2024 to have the spacecraft ready for flight, teams decided during a launch manifest evaluation that a launch in April will better accommodate upcoming crew rotations and cargo resupply missions this spring.  
OCTOBERSea Turtle Nests Set Kennedy Record  
A record number of sea turtle nests were built on the undisturbed beaches of the Florida spaceport in 2023. Biologists counted 13,935 sea turtle nests along Kennedy’s shoreline during the 2023 nesting season, 639 more nests than 2022 and the most found on center in a single year since record-keeping began in 1984.  
NOVEMBERNASA, SpaceX Launch New Science, Hardware to Space Station 
Following a successful launch of NASA’s SpaceX 29th commercial resupply mission from Kennedy’s Launch Complex 39A, scientific experiments and technology demonstrations – including studies of enhanced optical communications and measurement of atmospheric waves – were delivered to the space station.  
DECEMBERKennedy Celebrates 25 Years of International Space Station Science
NASA Kennedy marked a quarter of a century of assembling and processing components and science missions for the International Space Station. In December 1998, the Unity module of the International Space Station was carried to orbit on STS-88 from Kennedy, helping kick off a 25-year legacy that includes over 3700 science investigations conducted to date on the orbiting laboratory by 273 people from 21 countries.   
NASA explores the unknown in air and space, innovates for the benefit of humanity, and inspires the world through discovery."
