,Title,Link,Content(RAW)
5,"NASA’s NEOWISE Celebrates 10 Years, Plans End of Mission",https://www.nasa.gov/missions/neowise/nasas-neowise-celebrates-10-years-plans-end-of-mission/,"6 min read
The asteroid and comet-hunting infrared space telescope has gathered an impressive haul of observations, but it’s now at the mercy of the Sun, which is accelerating its demise.
NASA’s NEOWISE has had a busy decade. Since its reactivated mission began on Dec. 13, 2013, the space telescope has discovered a once-in-a-lifetime comet, observed more than 3,000 near-Earth objects, bolstered international planetary defense strategies, and supported another NASA mission’s rendezvous with a distant asteroid. And that’s just a partial list of accomplishments.
But all good things must come to an end: Solar activity is causing NEOWISE – short for Near-Earth Object Wide-field Infrared Survey Explorer – to fall out of orbit. By early 2025, the spacecraft is expected to drop low enough into Earth’s atmosphere that it will become unusable. Eventually, it will reenter our atmosphere, entirely burning up.
About every 11 years, the Sun experiences a cycle of increased activity that peaks during a period called solar maximum. Explosive events, such as solar flares and coronal mass ejections, become more frequent and heat up our planet’s atmosphere, causing it to expand. Atmospheric gases increase drag on satellites orbiting Earth, slowing them down. With the Sun currently approaching its next maximum, NEOWISE will no longer be able to maintain its orbit above our atmosphere.
“The mission has planned for this day a long time. After several years of calm, the Sun is waking back up,” said Joseph Masiero, NEOWISE’s deputy principal investigator and a scientist at IPAC, a research organization at Caltech in Pasadena, California. “We are at the mercy of solar activity, and with no means to keep us in orbit, NEOWISE is now slowly spiraling back to Earth.”
The past 10 years represent a second life for the spacecraft. Managed by NASA’s Jet Propulsion Laboratory in Southern California, NEOWISE repurposed a different mission that launched in 2009: the Wide-field Infrared Survey Explorer (WISE). Data from WISE and NEOWISE has been used to study distant galaxies, cool stars, exploding white dwarf stars, outgassing comets, near-Earth asteroids, and more.
In 2010, WISE achieved its scientific goal of conducting an all-sky infrared survey with far greater sensitivity than previous surveys. The WISE mission also found tens of millions of actively feeding supermassive black holes across the sky. Through the Disk Detective project, citizen scientists have used WISE data to find circumstellar disks, which are spinning clouds of gas, dust, and rubble around stars.
Invisible to the naked eye, infrared wavelengths are emitted by warm objects. To keep the heat generated by WISE itself from interfering with its observations of infrared wavelengths, the spacecraft relied on cryogenic coolant. After the coolant ran out and WISE had mapped the sky twice, NASA put the spacecraft into hibernation in February 2011.

Without coolant, the space telescope could no longer observe the universe’s coldest objects, but it could still see near-Earth asteroids and comets, which are heated by the Sun. So NASA reactivated the spacecraft in 2013 with a more specialized role in mind: aiding planetary defense efforts by surveying and studying those objects, which can stray into our planet’s orbital neighborhood and create a potential impact hazard.
Astronomers could not only rely on the mission to seek out these objects, but also use its data to figure out their size and albedo – how much sunlight their surfaces reflect – and to gather clues about the minerals and rocks they’re composed of.
“NEOWISE has showcased the importance of having an infrared space survey telescope as part of NASA’s planetary defense strategy while also keeping tabs on other objects in the solar system and beyond,” said Amy Mainzer, the mission’s principal investigator at the University of Arizona in Tucson.
Mainzer is also leading NASA’s upcoming NEO Surveyor, which will build on NEOWISE’s legacy. The next-generation infrared space telescope will seek out some of the hardest-to-find near-Earth objects, such as dark asteroids and comets that don’t reflect much visible light, as well as objects that approach Earth from the direction of the Sun. Scheduled for launch in 2027, the JPL-managed mission will also search for objects known as Earth Trojans – asteroids that lead or trail our planet’s orbit – the first of which WISE discovered in 2011.
Since becoming NEOWISE, the mission has scanned the entire sky over 20 times and made 1.45 million infrared measurements of over 44,000 solar system objects. That includes more than 3,000 near-Earth objects, 215 of which NEOWISE discovered. Data from the mission has contributed to refining the orbits of these objects while gauging their size as well.
Its forte is characterizing near-Earth asteroids. In 2021, NEOWISE became a key component of an international planetary defense exercise that focused on the hazardous asteroid Apophis.
The mission has also discovered 25 comets, including the long-period comet C/2020 F3 (NEOWISE). The comet became a dazzling celestial object visible in the Northern Hemisphere for several weeks in 2020 and the first comet that could be seen by the naked eye since 2007, when Comet McNaught was primarily visible in the Southern Hemisphere.
Future researchers will continue to rely on the vast archive of NEOWISE observations to make new discoveries, similar to the way researchers used WISE data from 2010 long after the observations were made to characterize asteroid Dinkinesh in support of NASA’s Lucy mission before its October 2023 encounter.
“This is a bittersweet moment. It’s sad to see this trailblazing mission come to an end, but we know there’s more treasure hiding in the survey data,” said Masiero. “NEOWISE has a vast archive, covering a very long period of time, that will inevitably advance the science of the infrared universe long after the spacecraft is gone.”
NEOWISE and NEO Surveyor support the objectives of NASA’s Planetary Defense Coordination Office (PDCO) at NASA Headquarters in Washington. The NASA Authorization Act of 2005 directed NASA to discover and characterize at least 90% of the near-Earth objects more than 140 meters (460 feet) across that come within 30 million miles (48 million kilometers) of our planet’s orbit. Objects of this size can cause significant regional damage, or worse, should they impact the Earth.
JPL manages and operates the NEOWISE mission for PDCO within the Science Mission Directorate. The Space Dynamics Laboratory in Logan, Utah, built the science instrument. Ball Aerospace & Technologies Corp. of Boulder, Colorado, built the spacecraft. Science data processing takes place at IPAC at Caltech. Caltech manages JPL for NASA.
For more information about NEOWISE, visit:
https://www.nasa.gov/neowise
Ian J. O’NeillJet Propulsion Laboratory, Pasadena, Calif.818-354-2649ian.j.oneill@jpl.nasa.gov
2023-182
NASA explores the unknown in air and space, innovates for the benefit of humanity, and inspires the world through discovery."
6,NASA Provides Update on Venture-Class Launch Services,https://www.nasa.gov/directorates/somd/launch-services-office/lsp/nasa-provides-update-on-venture-class-launch-services/,"4 min read
NASA currently is working with several commercial companies as part of the agency’s VADR (Venture-Class Acquisition of Dedicated and Rideshare) launch services contract, providing new opportunities for science, and technology payloads.
These include:
Building on NASA’s previous procurement efforts to foster development of a growing U.S. commercial launch market, VADR provides Federal Aviation Administration -licensed commercial launch services for payloads that can tolerate higher risk. By using a lower level of mission assurance, and commercial best practices for launching rockets, these highly flexible contracts help broaden access to space through lower launch costs.
Awards Update

Task orders under the VADR contract include launch services for several small satellite missions. CubeSats are a class of nanosatellites that use a standard size and form factor. The standard CubeSat size uses a “one unit” or “1U” measuring 10x10x10 centimeters and is extendable to larger sizes; 1.5, 2, 3, 6, and even 12U. A CubeSat typically weighs less than 2 kilogram (4.4 pounds) per unit.
Given the standardized size of these payloads and the ability to launch as a rideshare, rockets and launch dates are subject to change for these missions by the launch provider. This flexibility is one of the reasons NASA can cost-efficiently secure launch services for these small satellites.
Previously Announced Task Orders:
PREFIRECubeSats for Phantom Space Corp.EscaPADETwo CSLI Missions Awarded to SpaceXTROPICSTRACERS
NASA explores the unknown in air and space, innovates for the benefit of humanity, and inspires the world through discovery."
7,I am Artemis: Bruce Askins,https://www.nasa.gov/image-article/i-am-artemis-bruce-askins/,"3 min read
Growing up, Bruce Askins was passionate about space and oceanography. His desire to explore other worlds always made him want to be an astronaut. Though he did not become an astronaut, Askins has built a 42-year career at NASA, and, as the infrastructure management lead for NASA’s SLS (Space Launch System) Program at the agency’s Marshall Space Flight Center in Huntsville, Alabama, Askins is an integral part for the next generation of explorers.
Askins and his team are the gatekeepers and protectors of data and responsible for both cyber- security and physical security for the SLS Program. Under Askins’ leadership, his team ensures all data is stored properly, that information about the rocket shared outside NASA  is done with proper data markings, and access is given to those that need it.
Askins wasn’t always familiar with the world of infrastructure and cyber security. As a mechanical engineering graduate from the University of Alabama in Huntsville, Askins began his career as part of NASA’s internship program. He considered himself imaginative, or “creatively driven,” which is why Askins originally pursued a career at NASA.
“I always loved the design aspect of my early position in special test equipment,” Askins says. “Back then I drew everything by hand with a pencil before eventually transitioning to computers.”
His creativity and interest in underwater worlds, along with his scuba diver certification, led him to have a hand in designing early test elements for NASA’s Hubble Space Telescope. At the Neutral Buoyancy Simulator, a former underwater training facility at Marshall, Askins interacted with a crew of astronauts supporting Hubble and designed the flight simulation hardware used for crew training on the Canadarm2 robotic arm that is still a part of the International Space Station today.
Askins has been a part of the NASA family for almost half a century and is thrilled to be a part of the next era of space exploration to the Moon under Artemis.
“To explore is one of the greatest things that we can all do, and with the Artemis Generation the sky’s the limit,” Askins said.
SLS is part of NASA’s backbone for deep space exploration, along with the Orion spacecraft, advanced spacesuits and rovers, the Gateway in orbit around the Moon, and commercial human landing systems. SLS is the only rocket that can send Orion, astronauts, and supplies to the Moon in a single launch.
Check out some of our other “I am Artemis” features.  
NASA explores the unknown in air and space, innovates for the benefit of humanity, and inspires the world through discovery."
8,NASA Stennis Continues Preparations for Future Artemis Testing,https://www.nasa.gov/centers-and-facilities/stennis/nasa-stennis-continues-preparations-for-future-artemis-testing/,"3 min read
Crews at NASA’s Stennis Space Center cleared a milestone Dec. 11, installing a key component in preparation for future Green Run testing of NASA’s new Exploration Upper Stage (EUS) vehicle for use on the SLS (Space Launch System) rocket.
Four large diffusers, each weighing 14 tons, were lifted by crane for installation on the Thad Cochran Test Stand (B-2). The diffusers are a critical component designed to help direct engine exhaust away from the EUS during hot fire testing to minimize heat exposure to sensitive vehicle systems.
NASA’s new EUS is being built at NASA’s Michoud Assembly Facility in New Orleans as a more powerful SLS second stage to send the Orion spacecraft and heavier payloads to deep space as NASA continues its mission to explore the secrets of the universe for the benefit of all. The EUS is expected to fly on the Artemis IV mission following a series of Green Run tests of its integrated systems at NASA Stennis to demonstrate it is ready to fly. The test series will culminate with a hot fire of the four RL10 engines that will power the EUS.
During an actual flight, critical EUS systems will be protected by the SLS interstage. To protect the systems during Green Run testing, teams are using an interstage simulator, a size-and-weight replica of the actual SLS interstage, and the connected diffusers.
The system requires a high level of precision. The diffusers will be connected to the EUS engine nozzles using a flexible seal so gimbaling, or moving a rocket engine a few degrees along a tight circular axis to direct the thrust and “steer” the vehicle, can occur during testing. They also are designed to facilitate propellant connections and allow test teams access to the engine area as needed.
The carbon steel diffusers were precisely designed by a joint NASA Stennis and Jacobs Engineering team, using computational models, subscale testing, and historical data. The units then were made by Custom Steel Fabricators in Columbia, Tennessee, and delivered by truck to NASA Stennis.
Following lift and installation on the test stand, the diffuser system will be connected to the facility water and hydraulic supplies. A final checkout of the system will include a full test stand water flow demonstration.

Doing Business with NASA Stennis



About NASA Stennis



Visit NASA Stennis



NASA Stennis Media Resources


NASA explores the unknown in air and space, innovates for the benefit of humanity, and inspires the world through discovery."
9,2023 in Review: Highlights from NASA in Silicon Valley,https://www.nasa.gov/centers-and-facilities/ames/2023-nasa-silicon-valley/,"6 min read
It’s been another great year at NASA’s Ames Research Center in California’s Silicon Valley. Join us as we review some of the highlights of the science, engineering, and innovation from 2023. 
Announcing a New Innovation Hub Planned for NASA Research Park at Ames
Berkeley Space Center is a proposed new campus of the University of California, Berkeley, and an innovation hub for research and advances in astronautics, aeronautics, quantum computing, climate studies, and more. Planning to join Ames as a tenant of our NASA Research Park in Silicon Valley, the new campus aims to bring together researchers from the private sector, academia, and the government to tackle the complex scientific, technological, and societal issues facing our world.
Mapping Water Distribution on the Moon’s South Pole
Using data collected by the now-retired Stratospheric Observatory for Infrared Astronomy (SOFIA), researchers shared the first detailed, wide-area map of water distribution on the Moon. Understanding how much water lies beneath the lunar surface, and how it’s distributed, will help guide future missions like VIPER, as well as prospective sites for human habitats.
Colliding Moons May Have Formed Saturn’s Rings
New research suggests Saturn’s icy moons and rings were formed by a collision a few hundred million years ago, creating debris that gathered into the planet’s dusty, icy rings or clumped together to form moons.
NASA and Airlines Partner to Save Fuel and Reduce Delays
This year, NASA partnered with five major U.S. airlines on an air traffic decision-making tool that saved more than 24,000 pounds of jet fuel in 2022 for flights departing from Dallas-Fort Worth International Airport and Dallas Love Field Airport. Partners include American Airlines, Delta Air Lines, JetBlue Airways, Southwest Airlines and United Airlines.
NASA Leaders View Climate Science, Wildfire Innovations at Ames
NASA’s top leadership, industry experts, and legislative officials visited Ames in April to learn about about the center’s climate science efforts and innovations in aeronautics that will help scientists and engineers better understand climate change and mitigate natural disasters like wildland fires.
Starling Takes Flight
In July NASA’s Starling mission, managed at Ames, launched four CubeSats into low-Earth orbit to test robotic swarm technologies for space. You can track mission milestones via the Small Satellite Missions blog, and follow the mission live in NASA’s Eyes on the Solar System 3D visualization.
NASA’s First Robotic Moon Rover
This year engineers began assembling NASA’s first robotic Moon rover, VIPER — short for the Volatiles Investigating Polar Exploration Rover — and the agency is giving the public a front row seat to watch along as the rover takes shape. While individual components, such as the rover’s science instruments, lights, and wheels, were assembled and tested, the VIPER team also completed software development, mission planning, and tricky tests of the rover’s ability to drive off the Astrobotic Griffin lunar lander and onto the lunar surface.
Bringing Home Ancient Space Rocks
NASA’s OSIRIS-REx mission – short for the Origins, Spectral Interpretation, Resource Identification, and Security-Regolith Explorer – returned to Earth in Sept. 2023, bringing with it extraterrestrial rocks and dust that it scooped up from an asteroid estimated to be 4.5 billion years old. Ames contributed to the spacecraft’s heat shield, anti-contamination systems, post-landing sample curation, and more.
Preparing to Send Yeast to the Moon’s Surface for Astronaut Health
NASA’s plans to explore the Moon and eventually go to Mars will bring humans deeper into space for longer duration missions than ever before. These extended missions beyond low Earth orbit pose certain health risks to astronauts. The Lunar Explorer Instrument for Space Biology Applications team is preparing an experiment to study yeast’s biological response to the lunar environment to help understand and mitigate health risks for astronauts.
X-59 Team Moves Toward First Flight in 2024
This year, NASA’s X-59 team installed the finishing touches to the aircraft’s tail structure and moved it from its assembly facility to the flight line to perform structural testing. The X-59 quiet supersonic aircraft will take its first flight in 2024.
Celebrating a Stellar Year for Webb Telescope Science
The James Webb Space Telescope’s Near-Infrared Camera instrument produced a feast for the eyes with a view into a star-forming region, named Sagittarius C, in the heart of the Milky Way. The image reveals a portion of the dense center of our galaxy in unprecedented detail, including never-before-seen features astronomers have yet to explain.
Supercomputer Simulations Lead to Air and Space Innovations
Simulations and models developed using technology at the NASA Advanced Supercomputing Facility (NAS) help researchers and engineers develop innovations in air and space. Modeling turbofan engines could lead to designs that reduce engine noise and improve efficiency by understanding where noise is generated inside the machine.
S-MODE Sails the Seas and Soars through the Sky
The Sub-Mesoscale Ocean Dynamics Experiment (S-MODE) logged its final field expedition, and they took a team from the TODAY Show along for the ride. S-MODE combined airborne instruments, research ships, and autonomous ocean gliders to get an unprecedented look at how gas and heat exchange at the ocean’s surface impacts Earth’s climate.
From Intern to Astronaut, and Back to Ames
NASA astronaut Jessica Watkins, who was once an intern at Ames, returned to the Bay Area in Feb. 2023 to visit with local elementary schools and speak with Ames employees. Watkins started her career with NASA at Ames, where she conducted research on Mars soil simulant supporting the Phoenix Mars Lander mission.
Second Gentleman Joins East Bay Kids for STEM Activities
Nearly 100 East Bay kids and their families got to experience the thrill of “launching a rocket” and “making clouds” at a fun-filled STEM event hosted in honor of Women’s History Month at the East Oakland Youth Development Center in Oakland, California, in March 2023. Second Gentleman Douglas Emhoff, NASA Ames Research Center Director Dr. Eugene Tu, and NASA astronaut Dr. Yvonne Cagle joined kids at the Manzanita Community School for hands-on activities and to distribute approximately 500 STEM Artemis Learning Lunchboxes aimed to inspire the Artemis generation to learn about NASA’s Artemis Program.
Top Leaders in Our Midst Hailed from the White House and Australia
In January, U.S. President Joe Biden landed at Moffett Federal Airfield, at Ames, on his way to visit storm-damaged regions in the state. Research conducted at our Silicon Valley center could help predict extreme climate-related weather events. Later in the spring, Vice President Kamala Harris arrived at Moffett before delivering remarks at a local company, and leaders of the Australian Space Agency visited Ames to learn about the center’s missions supporting NASA’s Artemis program, including the VIPER Moon rover, which will launch to the lunar South Pole in late 2024.
NASA explores the unknown in air and space, innovates for the benefit of humanity, and inspires the world through discovery."
10,2023 in Review: Artemis II Crew Visits Kennedy,https://www.nasa.gov/image-article/2023-in-review-artemis-ii-crew-visits-kennedy/,"1 min read
On Aug. 8, 2023, Artemis II crew members (from left) Jeremy Hansen, Victor Glover, Reid Wiseman, and Christina Koch took a photo in front of their Orion crew module at NASA’s Kennedy Space Center in Florida. Announcing the crew and continuing work on the Space Launch System rocket and Orion are part of the significant steps taken this year toward the agency’s goal of landing the first woman and first person of color on the Moon.
Look back on NASA’s achievements in 2023.
Image Credit: NASA
NASA explores the unknown in air and space, innovates for the benefit of humanity, and inspires the world through discovery."
