,Local Site,Title,Link,Content(RAW)
56,[New Jersey] https://www.northjersey.com/news/,"North Jersey traffic: Closures on GWB; I-80; Routes 46, 1&9",https://www.northjersey.com/story/news/traffic/2023/12/13/north-jersey-traffic-closures-gwb-80-route-46/71892444007/,"NorthJersey.com

Daytime and overnight construction will cause lane closures on major roadways including the George Washington Bridge, Interstate 80, and U.S. Highways 1&9 and 46.

The Devils bring hockey back home to the Prudential Center tonight, Sunday and Tuesday.

Visit 511nj.org or for up-to-date traffic information and real-time traffic cameras from throughout the state, or call 511.

Bergen County traffic

The left lane will be closed for construction on the George Washington Bridge lower level westbound, 8:30 a.m. to 2:30 p.m., Dec. 13 and Dec. 14. The right lane will be closed on the upper level eastbound, 10 a.m. to 4:30 p.m., through Dec. 15. The lower level will be closed eastbound, 9 p.m. to 5 a.m., through Dec. 16; and 11 p.m. Dec. 16 to 8 a.m. Dec. 17.

lower level westbound, 8:30 a.m. to 2:30 p.m., Dec. 13 and Dec. 14. The right lane will be closed on the upper level eastbound, 10 a.m. to 4:30 p.m., through Dec. 15. The lower level will be closed eastbound, 9 p.m. to 5 a.m., through Dec. 16; and 11 p.m. Dec. 16 to 8 a.m. Dec. 17. The right lane will be closed in both directions on Route 17 between Century Road and Midland Avenue in Paramus, 10 p.m. to 6 a.m., Dec. 14 through Dec. 16. Two lanes will be closed northbound near Route 202 in Mahwah, 9 p.m. to 5 a.m., through Dec. 15.

between Century Road and Midland Avenue in Paramus, 10 p.m. to 6 a.m., Dec. 14 through Dec. 16. Two lanes will be closed northbound near Route 202 in Mahwah, 9 p.m. to 5 a.m., through Dec. 15. The entrance ramp to the Garden State Parkway southbound at exit 159 in Saddle Brook will be closed for the installation of sign structure, 10 p.m. to 5 a.m., through Dec. 15.

southbound at exit 159 in Saddle Brook will be closed for the installation of sign structure, 10 p.m. to 5 a.m., through Dec. 15. The right lane will be closed for construction on Route 4 in both directions between Zink Place and Yerger Road in Fair Lawn, 9 a.m. to 3 p.m., through Dec. 15. Up to two lanes will be closed between Mackay Avenue and the Garden State Parkway in Paramus, 9 p.m. to 6 a.m., through Dec. 17.

in both directions between Zink Place and Yerger Road in Fair Lawn, 9 a.m. to 3 p.m., through Dec. 15. Up to two lanes will be closed between Mackay Avenue and the Garden State Parkway in Paramus, 9 p.m. to 6 a.m., through Dec. 17. Horse racing at Meadowlands Racetrack at 6:20 p.m. on Fridays and Saturdays may cause some extra congestion in the area.

at 6:20 p.m. on Fridays and Saturdays may cause some extra congestion in the area. Two lanes will be closed for longterm construction on Lemoine Avenue northbound, between Route 46 and Bridge Plaza North in Fort Lee, from 9 p.m. to 6 p.m., through June 30.

Essex County traffic

At the Prudential Center , hockey is back as the Devils return home to play the Boston Bruins at 7:30 p.m. Dec. 13, the Anaheim Ducks at 7 p.m. Dec. 17 and the Philadelphia Flyers at 7 p.m. Dec. 19.

, hockey is back as the Devils return home to play the Boston Bruins at 7:30 p.m. Dec. 13, the Anaheim Ducks at 7 p.m. Dec. 17 and the Philadelphia Flyers at 7 p.m. Dec. 19. The right lane will be closed on Route 10 westbound near Hazel Avenue in Livingston, 9 a.m. to 3 p.m. Dec. 13.

westbound near Hazel Avenue in Livingston, 9 a.m. to 3 p.m. Dec. 13. The right lane will be closed on the Route 1&9 express lanes southbound near Route 22 in Newark, from 9 a.m. to 3 p.m. Dec. 14. One lane will be closed near Delancey Street, 9 a.m. to 2:30 p.m., through Dec. 15.

express lanes southbound near Route 22 in Newark, from 9 a.m. to 3 p.m. Dec. 14. One lane will be closed near Delancey Street, 9 a.m. to 2:30 p.m., through Dec. 15. One lane will be closed for utility work on Route 22 eastbound near Route 21 in Newark, 8 p.m. Dec. 14 to 4 a.m. Dec. 15.

eastbound near Route 21 in Newark, 8 p.m. Dec. 14 to 4 a.m. Dec. 15. All lanes will be intermittently closed on Route 21 northbound between exit 7 in Belleville and exit 12 in Passaic, 8 p.m. to 6 a.m., through Dec. 16.

northbound between exit 7 in Belleville and exit 12 in Passaic, 8 p.m. to 6 a.m., through Dec. 16. Bridge work will keep the ramp to I-280 from Clifton Avenue in Newark closed until Jan. 31.

Hudson County traffic

The Lincoln Tunnel south tube will be closed eastbound, 11 p.m. to 5 a.m., through Dec. 15.

south tube will be closed eastbound, 11 p.m. to 5 a.m., through Dec. 15. One lane will be closed for construction in the Holland Tunnel south tube eastbound, 11 p.m. to 5 a.m., through Dec. 15.

south tube eastbound, 11 p.m. to 5 a.m., through Dec. 15. The left lane will be closed for drainage improvements on Route 3 westbound near the New Jersey Turnpike Eastern Spur in Secaucus, through noon Dec. 18.

westbound near the New Jersey Turnpike Eastern Spur in Secaucus, through noon Dec. 18. Marin Boulevard will be closed in both directions for water main work between 18th Street in Jersey City and Henderson Street in Hoboken, 9 a.m. to 5 p.m. through Feb. 9. Drivers are encouraged to use Grove Street or Jersey Avenue or northern routes into and out of Hoboken.

Morris County traffic

One lane will be closed on Route 15 in both directions between Berkshire Valley Road and Taylor Road in Jefferson, 9 a.m. to 2 p.m., Dec. 13 and Dec. 14. All lanes will be closed intermittently northbound, 8 p.m. to 5 a.m., through Dec. 15.

in both directions between Berkshire Valley Road and Taylor Road in Jefferson, 9 a.m. to 2 p.m., Dec. 13 and Dec. 14. All lanes will be closed intermittently northbound, 8 p.m. to 5 a.m., through Dec. 15. The right lane will be closed for installation of conduits on Route 46 eastbound near Main Street in Rockaway, 9 a.m. to 3 p.m. Dec. 13. The left lane will be closed in both directions near I-80 in Denville, 9 a.m. to 3 p.m., Dec. 13 and Dec. 14.

eastbound near Main Street in Rockaway, 9 a.m. to 3 p.m. Dec. 13. The left lane will be closed in both directions near I-80 in Denville, 9 a.m. to 3 p.m., Dec. 13 and Dec. 14. The right lane will be closed for drainage improvements on Route 10 westbound near Route 53 in Morris Plains, 9 a.m. to 3 p.m. Dec. 13. The right lane will be closed in both directions near Whippany Road in Hanover, 8 a.m. to 3 p.m., through Dec. 15. The right lane will be closed westbound between Franklin Road in Denville and Dover Chester Road in Randolph, 9 a.m. to 3 p.m., through Dec. 15; and between Harrison Avenue in Morris Plains and Franklin Road in Denville, 9 a.m. to 3 p.m., through Dec. 17.

westbound near Route 53 in Morris Plains, 9 a.m. to 3 p.m. Dec. 13. The right lane will be closed in both directions near Whippany Road in Hanover, 8 a.m. to 3 p.m., through Dec. 15. The right lane will be closed westbound between Franklin Road in Denville and Dover Chester Road in Randolph, 9 a.m. to 3 p.m., through Dec. 15; and between Harrison Avenue in Morris Plains and Franklin Road in Denville, 9 a.m. to 3 p.m., through Dec. 17. The right lane will be closed for utility work on Route 206 northbound near Flanders Netcong Road in Mount Olive, 8 p.m. Dec. 13 to 5 a.m. Dec. 14.

northbound near Flanders Netcong Road in Mount Olive, 8 p.m. Dec. 13 to 5 a.m. Dec. 14. At least one lane will be closed on I-80 westbound between exit 25 in Mount Olive and the Allamuchy rest area, 9 p.m. Dec. 13 to 5 a.m. Dec. 14; eastbound between exit 34 in Wharton and exit 35 in Rockaway, 11 p.m. Dec. 14 through 4 a.m. Dec. 15; westbound near exit 30 in Roxbury and Mount Arlington, 10 a.m. to 1 p.m., through Dec. 15; eastbound near exit 30, 10 a.m. to 3 p.m., through Dec. 15; and eastbound between exit 37 in Rockaway and exit 38 in Denville, 9 p.m. Dec. 15 to 5 a.m. Dec. 16.

westbound between exit 25 in Mount Olive and the Allamuchy rest area, 9 p.m. Dec. 13 to 5 a.m. Dec. 14; eastbound between exit 34 in Wharton and exit 35 in Rockaway, 11 p.m. Dec. 14 through 4 a.m. Dec. 15; westbound near exit 30 in Roxbury and Mount Arlington, 10 a.m. to 1 p.m., through Dec. 15; eastbound near exit 30, 10 a.m. to 3 p.m., through Dec. 15; and eastbound between exit 37 in Rockaway and exit 38 in Denville, 9 p.m. Dec. 15 to 5 a.m. Dec. 16. Up to two lanes will be closed for roadwork on I-287 northbound near exit 39 in Hanover, 8 p.m. to 6 a.m., through Dec. 16.

Passaic County traffic

The right lane will be closed for a moving operation and utility work on Route 46 westbound between Paulison Avenue in Clifton and Browertown Road in Little Falls, 9 a.m. to 3 p.m., Dec. 13. One lane will be closed eastbound near Route 3 in Clifton, 9 a.m. to 4 p.m., through Dec. 22. The westbound ramp to Valley Road in Clifton will be closed until Feb. 4.

westbound between Paulison Avenue in Clifton and Browertown Road in Little Falls, 9 a.m. to 3 p.m., Dec. 13. One lane will be closed eastbound near Route 3 in Clifton, 9 a.m. to 4 p.m., through Dec. 22. The westbound ramp to Valley Road in Clifton will be closed until Feb. 4. The right lane will be closed for construction on Route 20 in both directions between 21st Avenue and Broadway in Paterson, 9 a.m. to 3 p.m., through Dec. 15.

in both directions between 21st Avenue and Broadway in Paterson, 9 a.m. to 3 p.m., through Dec. 15. The left lane will be closed for bridge work on Route 19 southbound near the Garden State Parkway in Clifton, 10 a.m. to 3 p.m. Dec. 15.

southbound near the Garden State Parkway in Clifton, 10 a.m. to 3 p.m. Dec. 15. The right lane will be closed for tree trimming on Route 23 southbound near Reservoir Road in West Milford, 11 a.m. to 3 p.m., through Dec. 15.

Sussex County traffic"
57,[New Jersey] https://www.nj.com/,What’s eating the military? Not a Biden game snub | Letters,https://www.nj.com/opinion/2023/12/whats-eating-the-military-not-a-biden-game-snub-letters.html,"Don’t miss an issue of our Opinion newsletter! Get it delivered each Wednesday right into your inbox by adding your email below and hitting ""subscribe.""

"
58,[New Jersey] https://www.nj.com/,Please don’t let Bell Labs and Murray Hill fade from history | Opinion,https://www.nj.com/opinion/2023/12/please-dont-let-bell-labs-and-murray-hill-fade-from-history-opinion.html,"Nokia Bell Labs will relocate by 2028 to a state-of-the-art research and development facility in New Brunswick, pictured here. A former research engineer at the Bell Labs Murray Hill facility suggests that information about the innovation that took place there should be preserved with a telecommunication science and technology museum.Nokia"
59,[New Jersey] https://www.nj.com/,"GOP ghouls will deny abortions in any case, because they can | Editorial",https://www.nj.com/opinion/2023/12/gop-ghouls-will-deny-abortions-in-any-case-because-they-can-editorial.html,"A 31-year-old Texas woman named Kate Cox is being forced to carry her pregnancy to term because of the state’s strict abortion law, even though it is a 95% medical certainty that her baby daughter will be stillborn or die within hours of delivery.

It is a horrid diagnosis for this mother of two, who is 20 weeks pregnant and has already been to the ER four times because of severe cramping or leaking amniotic fluid: The fetus has a fatal genetic abnormality, her doctors say she could jeopardize her future fertility if she doesn’t end the pregnancy, and judging by her TV interviews this past week, Cox and her husband are shattered beyond despair over the loss of a child they wanted so badly.

Is it Ken Paxton’s intent to abuse women in Texas because he enjoys it, to help get Democrats elected in every close race in the country, to help his best pal Trump lose, or is he just sick, sadistic, corrupt and stupid? pic.twitter.com/dVvKdIlIME — Ron Filipkowski (@RonFilipkowski) December 12, 2023

This is Texas Supreme Court Justice John Devine—a man tasked w/ impartially upholding the law—bragging about breaking the law to harass women at abortion clinics.



He’s one of the justices who just blocked Kate Cox from getting a *legal* abortion.



He’s up for reelection in 2024. pic.twitter.com/PoOsqIw82Q — Beto O'Rourke (@BetoORourke) December 11, 2023

Don’t miss an issue of our Opinion newsletter! Get it delivered each Wednesday right into your inbox by adding your email below and hitting ""subscribe.""

"
60,[New Jersey] https://www.nj.com/,The one Yankee who really needs Juan Soto to stick around | Klapisch,https://www.nj.com/yankees/2023/12/the-one-yankee-who-really-needs-juan-soto-to-stick-around-klapisch.html,"If there’s anything that unites the Yankees family, it’s the decree that says Juan Soto can’t be allowed to leave town. A long-term deal after 2024 is crucial for a million reasons, including Hal Steinbrenner’s credibility, Aaron Boone’s future and preserving the Yankees’ prestige within the industry. All are at stake.

Rank them in any order you like, but there’s a wildcard that’s hovering above the franchise’s endless championship drought. No one needs Soto to come through more than Aaron Judge, who’s entering his ninth year in the big leagues and still hasn’t sniffed a World Series.

Judge signed away the rest of his career to the Yankees last winter. That $360 million contract was backed by a promise from Steinbrenner to keep the Bombers from ever turning into the Red Sox or the Giants, two legacy franchises lost in no-man’s land.

Steinbrenner couldn’t keep his word in 2023, in part because Judge himself missed two months with a broken toe. But the standings have no pity for bad luck and freak injuries: the Yankees won only 82 games and continued a downward spiral that began in 2019.

If I’m Judge, I make sure to smile for the cameras and promise life will be better in 2024. But deep inside, No. 99 has to be wondering where the Yankees go from here. He didn’t sign up for mediocrity.

The trade for Soto was a symbolic triumph – but only if the new slugger doesn’t leave the Yankees in the dust next off-season. The scent of a bigger payday could be an intoxicant.

The same goes for Yoshinobu Yamamoto, who the Yankees are aggressively pursuing. Club officials are optimistic after a face-to-face meeting in Los Angeles on Monday. But like Soto, there’s no guarantee Yamamoto won’t bolt for a more cash from, say, the Dodgers or the Mets.

That’s a dreary scenario for Judge, who’ll be starting his age-32 season in a few months. He’s not old, but no longer young. Most MLB algorithms give Judge 3-4 more years of peak productivity before his decline phase begins.

FIXING THE YANKEES:

Sign up HERE for our twice-weekly newsletter on the off-season changes

Judge doesn’t have time to wait out a Yankees rebuild. Unless Steinbrenner’s money can pull the Bombers out of their slump, Judge could turn into this generation’s Don Mattingly – a superstar, the Captain and face of the franchise in the 80s and early 90s who never made it to the World Series.

That’s why Judge needs to Soto to sign a decade-long contract. Same goes for Gerrit Cole. You can even make the argument that rookie Jasson Dominguez, a fellow Dominican, needs Soto at his side.

But Judge is first on that list, which is why I suspect he was aware of Soto’s comments during a 30-minute Zoom interview with reporters on Tuesday. The superstar was wearing a Yankees hat (smart move) and had his agent Scott Boras on screen (also wise) and otherwise answered the questions perfectly.

Correction: Soto deflected queries about his long-term status. Despite his graciousness and good manners, Soto never once said he has a soft spot for the Yankees. It left little doubt where he’ll be next November.

Not signing off on a $600 million contract in Steinbrenner’s office, not celebrating the long-term commitment with Judge. He’ll be working the market with Boras.

Don’t hate on Soto if he bolts. Free agency is his right. He’ll have earned it. And if Soto and Boras are looking for the very last dollar, they’re both in luck. Mets’ owner Steve Cohen is already printing money in his basement.

So it’ll be up to Judge and Cole and Boone and Brian Cashman to make Soto see the Yankees in a different light: not just one of 30 teams, but No. 1 in culture and legacy.

I ran that idea by Soto. I asked if there was anything his new teammates could say or do to make him fall in love with New York. Soto chuckled and said, “it’s not their job” to recruit.

But it is in Judge’s nature make newcomers feel welcome.

He did so for socially awkward players like Joey Gallo and Josh Donaldson, unpopular ones like Aaron Hicks, and less talented ones like Kyle Higashioka. Even rookies have felt the warmth from Mount Olympus.

Just before the start of the 2023 season, Anthony Volpe went to a high-end tailor in Manhattan. The newcomer needed a suit for his first Yankees road trip. Finally fitted, Volpe tried to pay the bill – but learned Judge had already picked up the tab.

“It’s just what you do,” Judge explained to the Athletic’s Brendan Kuty.

Volpe didn’t need to be won over. Judge had already bought the kid a PS5 console during spring training after learning he and Volpe shared a common interest in playing FIFA.

That’s why Judge’s friendship with Soto is inevitable. That bond may or may not sway a shark like Boras, whose job it will be to leverage as many desperate owners as possible. When it comes to free agency, emotion finishes a distant second to bare-knuckle negotiating.

And it’s very likely Soto feels that way today. Even with all the right responses about the Yankees – “excited…looking forward…just want to win” – Soto wasn’t particularly warm towards the Yankees. It’s just business, nothing personal. For now.

But give it a few months. By then Judge and Soto will be bros. If the Yankees snare Yamamoto, they could be good enough to make fans forget about 2023. They might even declare a truce with Boone. You never know.

If all goes right, Soto and Judge will become the American League’s most feared two-headed monster. The Yankees need it. And so does Judge, perhaps more than anyone else.

Thank you for relying on us to provide the journalism you can trust. Please consider supporting us with a subscription.

Bob Klapisch may be reached at bklapisch@njadvancemedia.com."
61,[New Jersey] https://www.nj.com/,"Time has run out to try man in 1990 sex assault of woman found dead at Shore, court rules",https://www.nj.com/cape-may-county/2023/12/time-has-run-out-to-try-man-in-1990-sex-assault-of-woman-found-dead-at-shore-court-rules.html,"Statute of limitations laws will prevent prosecutors from trying a Millville man for the sexual assault of a woman in Wildwood in 1990, the New Jersey Supreme Court ruled Wednesday.

The decision effectively ends the case against Jerry Rosado, who authorities charged in April 2022 with sexually assaulting Susan Negersmith, a 20-year-old found dead and partially clothed behind a restaurant in May 1990.

In 2023, a state appeals court decision led to the dismissal of the charge, due to the statute of limitations, and the state’s highest court on Wednesday decided not to disturb that decision.

Negersmith was from Carmel, New York, in Putnam County, and was at the Jersey Shore with friends for the Memorial Day weekend when she went missing, authorities said.

Authorities found her body on May 27, 1990.

Neither evidence from the scene, which included scrapings from under her fingernails, nor police investigations led to anyone being charged in her assault, or death.

Negersmith’s family in told ABC News in 2015 that her death had first been classified as accidental but was later ruled a homicide after a medical examiner, who later studied autopsy photos, listed 26 points of trauma on the victim’s body. She’d also been sexually assaulted.

Lab testing in 2018 identified Rosado as a person of interest, and authorities later obtained DNA from his body. In June 2021, the DNA matched to Rosado, court decisions say. The Cape May County Prosecutor’s Office then charged Rosado in April 2022, when he was 62 years old, with sexually assaulting Negersmith.

Rosado was not charged with her death.

At the trial level, Rosado’s lawyers argued the statute of limitations at the time of the alleged crime, 1990, was five years, and the clock had run out.

The trial judge, though, denied the argument, saying the clock did not start until 2021, when investigators made a DNA match, citing a 2002 change to the sex assault statute.

Rosado’s lawyers went to the appellate level, where a panel of judges reversed the trial judge, finding the statute of limitations was five years in 1990.

The appeals decision explained how two changes to the sexual assault law since then did not impact this case.

First, in 1996, the statute of limitations for sex assault was removed, starting for cases that had not yet run out, as of May 1, 1996. In the Negersmith case, the statute of limitation for sex assault ended May 27, 1995.

And in 2002, an amendment to the sex assault law provided for a time exception for cases involving DNA or fingerprint evidence. But the amendment provided for no retroactivity, nor does other case state and federal case law.

The state Supreme Court quoted the 2023 appeals decision, which found the 2002 amendment could not reach back and “constitutionally revive” a statute of limitation that had already expired.

The high court’s decision did not even address the case in their own language, and opted to full accept the appeals decision’s language.

The Cape May County Prosecutor’s Office did not immediately respond to a request for comment.

Thank you for relying on us to provide the local news you can trust. Please consider supporting NJ.com with a voluntary subscription.

Kevin Shea may be reached at kshea@njadvancemedia.com"
62,[New Jersey] https://www.nj.com/,"Shore Conference Player of the Year and other postseason honors, 2023",https://www.nj.com/highschoolsports/2023/12/shore-conference-player-of-the-year-and-other-postseason-honors-2023.html,"We made it to the end of the 2023 New Jersey high school football season, and it proved to be another solid year for the Shore Conference.

Three Shore Conference teams reached the group finals and two -- Toms River North and Red Bank Catholic -- won titles. Rumson-Fair Haven was a runnerup in. Group 2."
63,[New Jersey] https://www.nj.com/,N.J. home values now top $1M in these 40 towns. See how your town ranks.,https://www.nj.com/realestate-news/2023/12/nj-home-values-now-top-1m-in-these-40-towns-see-how-your-town-ranks.html,"The $1 million club for real estate values in New Jersey continues to grow with an unrelenting increase in home prices in nearly every town despite higher mortgage costs, according to the latest data for October from Zillow.

New Jersey now has 40 towns with typical home values above $1 million.

The small Jersey Shore borough of Deal in Monmouth County remained firmly at the top of the list with a typical value of $3.3 million in October, up 3.46% from a year earlier. The next highest was Alpine in Bergen County at just under $2.8 million."
64,[New Jersey] https://www.nj.com/,Half of Bubbakoo’s Burritos’ 100 restaurants are now located in N.J. after its latest eatery opens,https://www.nj.com/business/2023/12/half-of-bubbakoos-burritos-100-restaurants-are-now-located-in-nj-after-its-latest-eatery-opens.html,"Bubbakoo’s Burritos recently unveiled another New Jersey restaurant.

The burrito concept opened at 20-26 Maple Ave. in Fair Lawn on Dec. 4.

This is the company’s 50th Garden State location.

“Bubbakoo’s has a passionate fan base that has been unbelievably supportive of my location in Park Ridge, and I’m excited to open a new location in Fair Lawn,” franchisee Rubert Nogales said. “I’m confident that the Fair Lawn community will welcome us with open arms and that our menu will have something for everyone to enjoy.”

The company is also planning to open locations in West Orange and Pennington in the coming months although exact opening dates have yet to be announced.

Bubbakoo’s build-your-own style menu consists of burritos, bowls, quesadillas, tacos, nachos and salads. Guests can choose from proteins, such as chicken, pork, ground beef, steak and shrimp, along with classic toppings, like rice, beans and salsa.

The eatery also offers curly fries, tater tots, chicken wings and desserts.

Bubbakoo’s opened its first spot in New Jersey in 2008 in Point Pleasant.

There are more than 100 Bubbakoo’s restaurants nationwide.

NEW RESTAURANTS & CHAINS OPENING IN NEW JERSEY

Our journalism needs your support. Please subscribe today to NJ.com.

Christopher Burch can be reached at cburch@njadvancemedia.com. Follow him on Twitter: @SwishBurch. Find NJ.com on Facebook. Have a tip? Tell us. nj.com/tip"
