,Local Site,Title,Link,Content(RAW)
28,[Texas] https://www.dallasnews.com/news/,Judge finds Farmers Branch officer not guilty in 2019 fatal shooting of man in stolen car,https://www.dallasnews.com/news/courts/2023/12/13/farmers-branch-officer-not-guilty-juan-moreno-shooting/,"A judge on Wednesday found a Farmers Branch police officer not guilty of murder in the 2019 shooting death of a 35-year-old man who was killed as he drove a stolen white pickup.

Officer Michael Dunn, 47, was indicted in 2019 by a Dallas County grand jury on a murder charge in connection with the killing of Juan “Johnny” Moreno Jr. He took the stand in his own defense on the third and final day of the trial Wednesday, testifying he feared for his life and believed Moreno wanted to kill him with the truck.

Advertisement

Dunn declined to comment after the verdict. His trial was before visiting Judge Mike Snipes instead of a jury. Dunn has been on administrative leave for more than four years. A conviction could have brought up to life in prison.

Advertisement

Breaking News Get the latest breaking news from North Texas and beyond. Email Address By signing up you agree to our Terms of Service and Privacy Policy SUBMIT

After Snipes read the verdict, several people near Dunn let out sighs of relief, and moments later loved ones and supporters hugged him outside the courtroom. Members of Moreno’s family, who declined to speak with reporters during the trial, leaned forward as they listened to the verdict. They later left the courthouse in silence.

One of Dunns’ attorneys, Dan Hagood, said after the verdict that prosecutors had asked for the trial to be heard by a judge instead of a jury and that the defense agreed because both sides had confidence in Snipes, a former state district judge, defense attorney and prosecutor.

Advertisement

Hagood said Dunn has been filled with stress, anxiety and worry for years, but Farmers Branch “stood 100% behind Officer Dunn.” He said Dunn might be the first officer in the U.S. who wasn’t fired after being indicted on a murder charge.

“It’s been an awful, awful ordeal for Officer Dunn,” Hagood said.

Dallas County District Attorney John Creuzot said in a written statement that his team worked diligently on the case and presented all of the evidence it had.

Advertisement

“We will respect the judge’s decision just as we would a jury,” he said.

Advertisement

Juan Moreno Sr., right and Carlos Quintanilla speak to the media outside the Moreno home in Farmers Branch on June 27, 2019. Mr. Moreno's son Juan ""Johnny"" Moreno was shot and killed by Farmers Branch police officer Michael Dunn, who was found not guilty Wednesday of murder. (Brian Elledge/The Dallas Morning News) (Brian Elledge / Staff Photographer)

A central question in the case was whether Dunn reasonably feared for his life when he fatally shot Moreno on June 12, 2019. Dunn’s attorneys argued he made a split-second decision because he believed he was in imminent danger. Prosecutors said Moreno did not pose a threat to Dunn.

Farmers Branch police Chief Kevin McCoy, who was in the courtroom Wednesday, said in a written statement after the verdict that he wanted to extend condolences to Moreno’s family. He said Dunn will need to go through an internal investigation and will remain on administrative leave until it’s concluded.

Advertisement

“The purpose in this and every investigation conducted by the Farmers Branch Police Department is to act with integrity and transparency in our constant effort to maintain the trust of the public we serve,” McCoy said.

Farmers Branch police surveilled Moreno for hours before the shooting as he drove a stolen white pickup. Moreno, whom Dunn and other officers had encountered in the past, pulled into a northwest Dallas shopping center and went into a dimly lit game room followed by an undercover officer. He then left and got back inside the truck.

Surveillance footage shows Dunn approach the truck in a marked police car, then exit his vehicle. Moreno makes a wide left turn to pull the truck out of a parking space. Video shows black plumes emanating from the truck’s exhaust as it revs. Dunn fires at Moreno three times as the truck, initially perpendicular to Dunn, moves in an arc around the officer and crashes into other parked vehicles.

In closing arguments, Hagood said Moreno, who was “hopped up on meth,” escalated the situation. Hagood paused and appeared to choke up as he described Dunn as a man of integrity. The evidence, he said, scientifically proved Dunn had reason to fear Moreno might have been about to hurt or kill him or others with the truck.

Advertisement

“We have to put ourselves in the shoes of Officer Dunn,” Hagood said.

Prosecutor Mischeka Nicholson said the case was about the actions and decisions Dunn made, not his character. She said there was no way the truck Moreno drove could have come into contact with Dunn, adding she believes the third and final shot Dunn fired is the one that killed Moreno, who was already past Dunn when the shot was fired. The defense argued Moreno was killed by the initial gunshot.

“We don’t know what was going through Johnny Moreno’s mind because he’s not here to tell us that,” Nicholson said.

Before he read his verdict, Snipes said shooting into a moving vehicle is rarely justified.

Advertisement

Snipes previously was lead prosecutor in the criminal case against Roy Oliver, the Balch Springs police officer sentenced to 15 years in prison for murdering 15-year-old Jordan Edwards in 2017. Oliver was firing into a car driving away from him when he killed Jordan. His 2018 conviction made him the first on-duty police officer in Texas to be found guilty of murder in 45 years.

Snipes said Wednesday he doesn’t think the truck was headed straight at Dunn but that he believes the officer perceived he could be run over, a view that was backed up by the testimony of other officers present when the shooting occurred.

He said after reviewing both sides and the available videos, he couldn’t conclude prosecutors proved beyond a reasonable doubt that Dunn did not act in self-defense.

Advertisement

‘I was in imminent danger’

Dunn, dressed in a white shirt, light blue tie and black suit jacket, appeared calm on the witness stand. He told the judge he encountered Moreno about a week before the shooting. Moreno was arrested by a fellow officer on a charge of possession of burglary tools. That Farmers Branch officer testified that Moreno told her he wasn’t going to be caught next time — a warning, she said, she told Dunn and other officers.

A day after the arrest, Dunn said, Moreno had a stomachache and was coming down off meth, so Dunn escorted him to a medical center. Dunn said he spoke with Moreno about the dangers of addiction and told him stealing trucks wasn’t a good career. He said it was like “fatherly advice.”

Days later as police tracked Moreno in the stolen vehicle, Dunn said he volunteered to help with the arrest.

Juan ""Johnny"" Moreno is shown with his daughter in an undated photo. (Moreno family)

He approached Moreno, who he said looked directly at him and his expression was “very angry,” Dunn recalled. Moreno pushed a female passenger out of the truck and cranked the vehicle “hard to the left” toward Dunn, the officer testified.

Dunn said everything seemed to occur within fractions of a second. He said his back was almost to his patrol car and he took on a stance to defend himself as the truck hurtled forward. He yelled at Moreno to stop, and Moreno appeared to yell something from the driver’s seat of the truck, Dunn said.

Advertisement

”There was no doubt in my mind,” Dunn said. “I was in imminent danger, and so was everybody else around me.”

While Dunn insisted he was “directly in the path of Mr. Moreno,” prosecutors paused the surveillance footage around the moment he fired a third time at Moreno. At that point, Dunn appeared to be lined up with the back of the truck, and Moreno was past him in the driver’s seat.

Pressed by prosecutors on why he didn’t have on his body-worn camera, Dunn said it was “just a mistake.”

Moreno’s father watched Dunn with his head slightly cocked in the back of the courtroom. People packed in the front rows of the gallery, including Moreno’s loved ones and officers from Farmers Branch, Dallas and Carrollton.

Advertisement

Officers, experts testify

Experts analyzed different angles of surveillance footage frame by frame, computing the speed of the truck and the distance between the vehicle and Dunn when the shots were fired.

Dallas police Det. Cayce Shelton, who assisted the lead investigator in the case, testified he was told by his command staff to hand over the case file to prosecutors within about a week of the shooting. He said detectives worked “tirelessly” and recreated what occurred.

He said the wheels of Moreno’s truck began to straighten, turned away from Dunn. He characterized Dunn’s position as a shooting stance, repeating that Moreno was not in a position to harm Dunn.

Advertisement

A key witness brought by the defense was Ronald Lee Martinelli, a former officer and expert in exercise physiology and police practices. Martinelli told the judge that action is always faster than reaction. With his body processing everything at the same time, his ability to orient himself slowed, Martinelli testified, adding that Dunn made a decision in about .57 seconds.

”I didn’t see a single policy violation” related to use of force, Martinelli said.

Attorney Toby Shook, who represented Dunn along with Hagood, said after the verdict the expert testimony about how people perceive things under stress was critical.

“It’s one thing to see it on video, but you have scientific evidence of how these things happen,” Shook said. “They’re all different angles, and none of them were at the angle that Officer Dunn saw. It’s a life and death decision made in literally just a couple of seconds.”

Advertisement

Moreno’s family also filed a civil suit against Dunn and Farmers Branch police; it is pending."
29,[Texas] https://www.dallasnews.com/news/,City Council rejects Watermark Church’s rezoning request for South Dallas,https://www.dallasnews.com/news/politics/2023/12/13/city-council-rejects-watermark-churchs-rezoning-request-for-south-dallas/,"Dallas City Council unanimously denied Watermark Community Church the rezoning it needs to convert a South Dallas school into a development campus at Wednesday’s meeting, saying the church has been unclear in its vision for the property, aggravating the neighborhood.

The megachurch bought an old Dallas ISD school – Pearl C. Anderson Middle Learning Center – in 2019 in hopes to expand into South Dallas, but there has been much frustration from residents who say they were left out of the conversation.

Advertisement

Council member for this area of Dallas, Adam Bazaldua, proposed denying Watermark the rezoning it needs to carry out plans to build a church campus on the property at 3400 Garden Lane.

Advertisement

“There’s been way too much gray area,” he said in the Wednesday meeting. “There’s been way too many questions unanswered….I would say that there were several red flags that were brought up in the process.”

Political Points Get the latest politics news from North Texas and beyond. Email Address By signing up you agree to our Terms of Service and Privacy Policy SUBMIT

Watermark’s request asks to allow a portion of its property to be rezoned as a walkable mixed-use district, in order to provide “additional services,” according to the city agenda legislation. It is unclear what “services” the church intends to add.

In its rezoning proposal, Watermark said the proposed rezoning district “would allow office, medical and limited retail uses to allow for training, a medical clinic, and a possible grocery store.”

Advertisement

Watermark’s South Dallas campus pastor Marvin Walker told The Dallas Morning News that he did not want to comment on the rezoning process, but said the church is going to be in the neighborhood for the long haul.

“We’re just grateful to be a part of the South Dallas community and really do look forward to partnering with the community members and other local organizations for years to come,” Walker said.

While staff recommended approving the rezoning, Council disagreed.

Advertisement

Deputy Mayor Pro Tem Carolyn King Arnold said from the beginning she had concerns that the megachurch would come in and gentrify the neighborhood without community input.

Advertisement

“I’m still puzzled and troubled by the fact that we would have this blatant footstep moving into our communities in such a way that is distasteful,” she said. “As stated, you can’t come into communities with this whole imperialistic mindset, building your empire, and disrespecting the people.”

Council member Omar Narvaez said he wants to “hit the reset button,” so the community gets what it needs from Watermark.

“Actually what the vast majority of community members and black and brown neighborhoods believe is that you don’t want to get to know us and you want to shove something into our communities without making us a partner,” Narvaez said. “They don’t need saving. They need partners to bring into the communities what they need.”

Advertisement

Some residents told Council they feel the nondenominational church has not been honest with the community.

Todd Atkins, who represented the South Dallas Fair Park Faith Coalition, said locals have not gotten clear answers on the vision or goal of Watermark’s campus in their neighborhood.

“We remain unclear which Watermark entity we should be engaging: Watermark South Dallas LLC, Watermark CDC, Watermark Community Church,” he told the council. “This lack of a clear partner makes it difficult to determine who the decision makers are, and who has all the information regarding Watermark’s desired uses of this property.”

Michael Sneed said he was a Watermark parishioner and he loves the services, but he doesn’t think the church is ready for this rezoning or willing to work with South Dallas.

Advertisement

“We don’t need you to call us over to the church for a dinner. We need you to come up with a strategy to make something better, to help us get the homeless off the street, to help us do something for the kids. That’s what we need. We need a change in South,” he told the council. “Nobody in my neighborhood trusts them.”

The church was the sole bidder on the school, buying the 9-acre property for $211,111.10.

Residents called the school a “legacy” and “historic” in a January community meeting to discuss the property and its rezone. They shared that the middle school was the only option in the area for 50 years, and it served as a cornerstone of childhood memories for those who grew up in South Dallas.

Walker apologized to residents and asked for forgiveness at the community meeting, saying he wants to build trust with the locals and listen.

Advertisement

Some residents shared that Watermark’s presence has been a good thing for the old DISD school, where it had become a blighted property with an unkempt lawn and litter. The church has since cleaned up the property, and residents say they have offered free meals and afterschool programs for kids.

Bazaldua said in the council meeting that he encourages Watermark to go back to the community to have a conversation about the future of the property.

“I am encouraging the applicant to get back to the drawing board and to do what it takes to earn that trust,” he said. “So that ultimately, an approval is something that everyone can be excited about. That’s not the case now.”"
30,[Texas] https://www.dallasnews.com/news/,Rain arrives Friday,https://www.dallasnews.com/news/weather/2023/12/13/rain-arrives-friday/,"Rain chances will remain west of DFW tonight and Thursday. While there will be some clouds, we’ll see some sunshine too on Thursday. Highs will be in the upper 50s to lower 60s, pretty close to normal for this time of year.

A good chance of rain for all of North Texas will arrive on Friday. Widespread showers are anticipated with chilly conditions for much of Friday. Most of the rain will exit by late Friday night, so a dry weekend is expected.

Advertisement

Next week looks mild and dry with highs in the low to mid 60s. The mild weather could easily last through Christmas.

Advertisement

Latest Forecast:

D-FW Weather Wise From snow to 100-degree heat, we've got you covered. Email Address By signing up you agree to our Terms of Service and Privacy Policy SUBMIT

TONIGHT: Mostly cloudy. Low: 43. Wind: E 5-10 mph.

THURSDAY: A mixture of clouds and sun. High: 63. Wind: E 5-10 mph.

Advertisement

FRIDAY: Cloudy and chilly with a 80% chance of rain. Low: 47. High: 53. Wind: NE 10-15 mph.

SATURDAY: Decreasing clouds and cool. Low: 44. High: 55. Wind: N 10-15 mph.

SUNDAY: Milder with sunshine and a few clouds. Low: 38. High: 61. Wind: NW 5-10 mph.

Advertisement

MONDAY: Partly cloudy and seasonably cool. Low: 38. High: 60. Wind: N 5-10 mph.

Advertisement

TUESDAY: Partly cloudy and pleasant. Low: 39. High: 63. Wind: SE 5-10 mph.

WEDNESDAY: Partly cloudy and pleasant. Low: 42. High: 64. Wind: SE 5-10 mph.

THURSDAY: Mild with a mix of clouds and sun. Low: 46. High: 64. Wind: S 5-10 mph.

Advertisement

FRIDAY: Mostly cloudy and mild. Low: 49. High: 65. Wind: S 5-10 mph.

SATURDAY: Mostly cloudy and mild with a 20% chance of showers. Low: 46. High: 64. Wind: S 10-15 mph."
31,[Texas] https://www.dallasnews.com/news/,Denton County woman convicted of multiple crimes in connection with romance scam operation,https://www.dallasnews.com/news/courts/2023/12/13/denton-county-woman-convicted-of-multiple-crimes-in-connection-with-romance-scam-operation/,"A North Texas woman arrested in 2021 and accused of being part of a large scam operation targeting those looking for romantic partners has been found guilty of multiple criminal charges, the U.S. Attorney’s Office in the Northern District of Texas announced.

Ijeoma Okoro, 33, of Aubrey was among the people accused in the scheme. On Thursday, a jury found her guilty of one count of conspiracy to commit wire fraud and one count of conspiracy to commit money laundering, according to the attorney’s office.

Advertisement

In September 2021, the attorney’s office said authorities arrested 11 people in connection with the scam, which focused on the elderly. Between 2015 and 2020, the 11 arrested took tens of thousands of dollars from victims, the U.S. attorney’s office had said. Most of the accused were arrested in the Dallas-Fort Worth area, the office said, according to the attorney’s office.

Advertisement

Authorities described the scams as “romance schemes” in which suspects allegedly used fake names to lure victims through dating websites and mobile apps.

Breaking News Get the latest breaking news from North Texas and beyond. Email Address By signing up you agree to our Terms of Service and Privacy Policy SUBMIT

Investigators believe many of the people arrested in connection with the schemes were tied to a transnational organized crime syndicate, the attorney’s office had said.

“[Okoro] now faces up to 20 years in federal prison on the wire fraud conspiracy count, up to 10 years in federal prison on the money laundering conspiracy count, and an order to repay the victims the losses that she and her coconspirators caused the victims,” the attorney’s office said in a Friday news release.

Advertisement

Aubrey is a Denton County city about 50 miles north of downtown Dallas.

At least three others who were arrested in 2021 — Emanuel Stanley Orji, Frederick Orji and Oluwalobamise Michael Moses — have pleaded guilty to similar charges in connection with romance scams, according to online court records.

Advertisement

Emanuel Stanley Orji and Frederick Orji has each been sentenced to 37 months in prison and Moses was sentenced Monday to two years, records showed.

Advertisement

Nearly two dozen more people had been charged in a related indictment in the Eastern District of Texas, authorities had said.

Okoro’s sentencing has been scheduled for March 18, court records showed.

“I do believe there were some issues that came out at trial that might play into the sentencing,” said Trey Bunch, Okoro’s attorney."
32,[Texas] https://www.dallasnews.com/news/,"Live camels, flying angels: Plano megachurch criticized again for lavish Christmas show",https://www.dallasnews.com/news/faith/2023/12/13/live-camels-flying-angels-prestonwood-baptist-criticized-again-for-lavish-christmas-show/,"Plano’s Prestonwood Baptist Church is once again facing backlash online for the extravagance of its annual Christmas show.

The prominent megachurch has produced the “The Gift of Christmas” for over 25 years, and received online backlash last year after footage of the show’s flying performers went viral. This year, the show’s 100-minute production, which ran from Dec. 1-3 and 6-10, was similarly lavish, with a nearly 1,000-member cast and choir, live camels, giant bedazzled costumes and acrobatic dance numbers.

Advertisement

One TikTok clip of this year’s production showed airborne dancers and drummers performing to “The Greatest Show” from The Greatest Showman and has received 9.9 million TikTok views as of Wednesday. “When you’re new to Texas and didn’t realize just how hard Texas mega churches go at Christmastime,” poster Lawson Martin, whose handle is @lawsonmaee, wrote over clips of the show.

Advertisement

Other TikTok videos of the church’s production highlighted a dance number set to Michael Jackson’s “Thriller” and performers in angel costumes flying through the air, suspended by cables.

Breaking News Get the latest breaking news from North Texas and beyond. Email Address By signing up you agree to our Terms of Service and Privacy Policy SUBMIT

A Reddit post Tuesday linking to a San Antonio Express-News article on this year’s show has received around 300 comments, with some criticizing the Plano church with quotes from the Bible.

“Lot of camels getting through needle eyes these days,” one wrote, in apparent reference to a quote from Jesus that appears in several gospels, including Mark 10:25, which says, “It is easier for a camel to go through the eye of a needle than for a rich person to enter the kingdom of God.”

Advertisement

Responding to criticism of its Christmas program, Prestonwood Baptist sent a statement to San Antonio Express-News published Tuesday. “The Gift of Christmas is a ticketed Christian production, not a church service, and a long beloved Christian tradition celebrated by the many hundreds-of-thousands in our community and surrounding states who have attended for more than 25 years. Prestonwood Baptist Church is not ashamed to pull out all the stops in celebration of the birth of Jesus Christ during the Christmas season,” the statement read.

“At Prestonwood, we believe Jesus deserves our absolute best, especially during Christmas. It’s unfortunate that the perennial American tradition of the church Christmas program now draws criticism. We pray that they, too, may come to know the joy of Christmas and the love of our Savior.”

Prestonwood is one of the largest and most influential Southern Baptist churches in the United States, with a membership of nearly 50,000 across three campuses in Plano, Prosper and Lewisville. Its congregation has included a number of leaders in Texas politics, such as Texas Attorney General Ken Paxton, Rep. Matt Shaheen and Rep. Jeff Leach, both R-Plano.

Advertisement

Last year, a third-party investigation into sex abuse at Southern Baptist churches found church leaders suppressed reports of sexual abuse for two decades. The report said Prestonwood and its longtime lead pastor, Jack Graham, helped protect an alleged abuser from criminal charges in 1989.

Advertisement

The church vehemently denied the report’s characterization of the incident.

Staff writer Sarah Bahari contributed to this report.

Joy Ashford covers faith and religion in North Texas for The Dallas Morning News through a partnership with Report for America."
