,Local Site,Title,Link,Content(RAW)
0,[Georgia] https://www.ajc.com/news/,Gridlock Guy: Longstanding open manhole injures crash victim,https://www.ajc.com/atlanta-traffic/gridlock-guy-longstanding-open-manhole-injures-crash-victim/PEHB55EXBNFJTORW43STY72ASY/,"“My daughter gets out of the car and literally disappears,” Jake Walsh recounted to the AJC and 95.5 WSB. “(Kellie) gets out and looks and she is down in this hole, trying to get out. She’s a fit young lady, so she got out pretty easily. But she got scratched up pretty badly; it was pretty traumatic.” Walsh said that Camryn’s stress was so bad from the whole ordeal that she avoided freeway driving for weeks after.

Walsh was bewildered by what happened to his daughter. He wondered how this manhole could be simply left gaping like that. He thought about how much worse Camryn’s injuries could have been. What if she had hooked her chin on the edge on the way down, or what if someone less fit or larger had taken that unexpected plunge? What about panhandlers or landscapers that could walk there and get hurt?

So Walsh did what every citizen should do when confronted with a problem: He reached out to get it fixed. Walsh dialed 3-1-1, the City of Atlanta’s Department of Customer Service, and did not get very far. While he talked to several people, Walsh said he felt he got handed around and never to the right person.

He says he thinks this manhole is another accident waiting to happen.

Walsh is worried about people who truly need that strip of pavement for an emergency; it is an emergency lane. And while people should not normally walk along a freeway or a ramp, sometimes that is necessary.

“If you’re walking in that area, you’re not going to walk on the concrete where the traffic is and you’re not going to walk in the grass, because it is uncut and you could turn an ankle or something,” Walsh said. And then, unexpectedly, that slice of ground is gone. No cones, no signs.

Walsh has visited the site several times since Camryn’s June 2023 fall. The hole still sits unprotected. He has gone on Google Street View and seen that same hole in that spot dating back to 2011, the earliest Street View shots of that spot. So this unprotected void dates at least back to Obama’s first term. Kasim Reed was the Atlanta mayor. GA-400 still had a toll plaza. Freddie Freeman and Julio Jones were rookies and Chipper Jones was in his penultimate season. Taylor Swift was only a millionaire. And no one knew what “Snowmageddon” was.

Given the brick wall Walsh hit with the city, I recently reached out to Atlanta DOT and also to GDOT (since this manhole is along an interstate and the state maintains freeways) and am waiting to hear back.

Camryn Walsh is 5 feet, 6 inches tall. Her surprise manhole plunge saw her peeking up with only the top of her nose and above cresting the edge. This hole is on a busy stretch of I-285 that sees its fair share of wrecks and jams. Inevitably, a motorist or first responder is going to need that Cascade entrance ramp emergency lane. As long as that manhole remains uncovered, someone else is eventually going to get hurt worse than she did. Thank goodness that Jake Walsh has stayed on this small crusade for six months; we can all learn from him. Hopefully, the right people take notice and take action.

Doug Turnbull, the PM drive Skycopter anchor for Triple Team Traffic on 95.5 WSB, is the Gridlock Guy. Download the Triple Team Traffic Alerts App to hear reports from the WSB Traffic Team automatically when you drive near trouble spots. Contact him at Doug.Turnbull@cmg.com."
1,[Georgia] https://www.ajc.com/news/,"Police: 3 men killed, 4th injured in Buckhead shooting during drug deal",https://www.ajc.com/news/crime/breaking-3-men-killed-4th-injured-in-buckhead-shooting/A5NPFKO4OBAMLH5B74T5U3OZXY/,"“This is an incident that happened inside a unit,” Malecki said. “That’s an area that we cannot police. So, we do need common sense to prevail in those situations. And, of course, nothing good comes from drug activity. This department does its best to shut down drug operations. So, if anyone has tips or information, that’s why we ask that you send those our way so we can try to prevent incidents like this.”

Three of the men died at the scene and a fourth was alert while being taken to the hospital for treatment, police said.

The names of the victims were not released late Saturday. The shooting remains under investigation.

The shooting at the high-rise was the second this year and both incidents involved drug deals, according to Atlanta police. In a separate incident in February, a man was arrested after two people were shot during a drug deal, police previously said."
2,[Georgia] https://www.ajc.com/news/,"SUNDAY’S WEATHER | Strong storms, temps dropping due to cold front",https://www.ajc.com/atlanta-weather/sundays-weather-strong-storms-temps-dropping-due-to-cold-front/CBCVOWBPLZC73IPS4P6JZM5T64/,"Most of Sunday will be soggy, and some strong storms are possible.

Showers will persist overnight ahead of a cold front that will pass over metro Atlanta starting around 8 a.m. According to the National Weather Service, scattered thunderstorms between 10 p.m. Saturday and 4 a.m. Sunday have the potential to turn severe with wind gusts reaching up to 60 mph. There is also the chance for brief tornadoes in North Georgia, but the risk remains low.

“We’re going to see some heavy downpours. But in addition to that, there is that risk that we could be dealing with some damaging wind gusts, hail and, a brief tornado cannot be ruled out,” Channel 2 Action News meteorologist Eboni Deon said."
3,[Georgia] https://www.ajc.com/news/,Shop with a sheriff: 250 kids select gifts with Fulton County deputies,https://www.ajc.com/news/crime/shop-with-a-sheriff-250-kids-select-gifts-with-fulton-county-deputies/NYTNBFF7GJBIFNMKNB3SUPMBNE/,"The sixth-grader and his two younger sisters were among the 250 children invited to the Fulton County Sheriff’s Office “Shop with a Sheriff” event Saturday at the Target store at Atlantic Station. The event, held for the third year under Sheriff Patrick “Pat” Labat, offers children in need the chance for holiday cheer. Each child was given a $150 gift card before being escorted by a sheriff’s office employee for the shopping fun.

Credit: Steve Schaefer Credit: Steve Schaefer

The event was one of many across metro Atlanta involving law enforcement agencies partnering with community and corporate organizations to make the holidays brighter for children. Officers and deputies say building those relationships with the youngest citizens is crucial.

Also Saturday morning, the 25th Annual Paulding Cops for Kids event was held, coordinated by the sheriff’s office. More than 230 children were able to shop during the event. And on Wednesday, the City of Atlanta Fire and Rescue Department joined with other city groups to sponsor a Winter Resource Fair that offered groceries, gift cards and health screenings to those in need.

“We don’t necessarily want our first interactions with a young child to be a bad thing,” Labat told The Atlanta Journal-Constitution during Saturday’s event. “This is bringing hope and it’s an opportunity during the holidays for us to give back.”

Dexter Whiteside said he is focused on getting his 9-year-old son the things he needs, like a new belt and clothes. As he shopped with a deputy, Donte was focused on the Nerf guns.

“This day is about him,” Dexter Whiteside said.

Credit: Steve Schaefer Credit: Steve Schaefer

While some children quickly went to the exact gifts they wanted — dolls, lego sets and even a bike — others deliberated longer, carefully choosing what to pick. Kaleb Whidby, 9, was overwhelmed with all of his options before settling on a boxing set, football, and walkie-talkies. He also picked out a board game he could play with his grandmother.

But Kaleb didn’t have time to stop and talk. There were more aisles of toys to check out.

Gladys Bush said she had no idea what she wanted before she arrived at the store with her mother. The 12-year-old quickly spotted two dolls she wanted, including one dressed in a Minnie Mouse outfit. Next, she wanted to look at lip gloss.

“This really came in handy because times are hard,” Elizabeth Bush, the sixth-grader’s mother, said as her daughter looked at her selections. “She’s the youngest of four, so it’s good to be able to be here and be able to let her get what she wants.”

The deputies also enjoyed the shopping, a different type of service than during their typical workday.

Sgt. Anthony Burgess works in the juvenile court division, where he says he focuses on trying to change the lives of children who have gotten into trouble.

Credit: Steve Schaefer Credit: Steve Schaefer

“You can’t save everyone but if you save one, you did your job,” he said.

On Saturday, Burgess wore a different uniform. He was Santa Claus and spent the morning posing for pictures and hugging children.

“It brings joy to my heart,” he said. “It’s wonderful to see the kids in a different light.”

Meanwhile, Prentis was eager to play with his new toys and Play-doh. His sisters, Preyanna and Mielle, picked out dolls and some accessories, including a tiny crib and stroller.

“We’re gonna act like I’m making food for the dolls,” Prentis said.

But 10-year-old Preyanna wasn’t so sure of that plan.

“My baby’s not going to be eating Play-doh,” she said with a laugh."
4,[California] https://www.mercurynews.com/latest-headlines/,"49ers roundup: McCloud shelved, Conley promoted, Greenlaw fined",https://www.mercurynews.com/2023/12/09/49ers-put-return-specialist-ray-ray-mccloud-on-shelf-dre-greenlaw-fined/,"SANTA CLARA — The 49ers will be without return specialist Ray-Ray McCloud for at least the rest of this month.

McCloud went on the Injured Reserve list Saturday and must miss a minimum of four games, which could prove consequential if the 49ers don’t find a sure-handed replacement in their playoff push.

Rookie Ronnie Bell filled in last game for McCloud and botched a punt return with the ball harmlessly bouncing out of bounds in last Sunday’s 42-19 win at Philadelphia.

Veteran wide receiver Chris Conley was promoted from the practice squad to fill McCloud’s roster spot.

McCloud was ruled out Friday, along with defensive tackle Arik Armstead and tight end Ross Dwelley, for this Sunday’s game between the 49ers (9-3) and the Seattle Seahawks (6-6) at Levi’s Stadium.

“He was limited on Wednesday, but didn’t feel great, so we’ve got to be safe with him,” coach Kyle Shanahan said Friday of McCloud.

McCloud injured his ribs in last month’s win against the Tampa Bay Buccaneers, but he played in the Thanksgiving night win at Seattle, where he fumbled a punt return that teammate Oren Burks recovered in the fourth quarter of that 31-13 win.

GREENLAW FINED

Linebacker Dre Greenlaw got fined $10,927 for his “unnecessary roughness” tackle that sparked an Eagles’ sideline scuffle with security chief Dom DiSandro, who’s reportedly not allowed on the Philadelphia sideline Sunday at Dallas. Also fined for unnecessary roughness in separate third-quarter plays from Sunday’s game: the 49ers’ Demetrius Flannigan-Fowles ($9,940, for a facemask violation) and the Eagles’ Jalen Carter ($16,937, for a violation on a point-after kick).

SEAHAWKS QB ISSUES

With starting quarterback Geno Smith (groin) questionable for Sunday’s game, the Seahawks elevated Foothill High-Pleasanton product Sean Mannion from the practice squad, as an option behind Drew Lock, Smith’s potential replacement starter. Also elevated was Patrick O’Connell as fellow linebacker Jordyn Brooks (ankle) is also questionable. Outside linebacker Frank Clark will not travel with the team for non-injury reasons, the Seahawks announced.

OTHER MOVES

Safety Erik Harris and running back Jeremy McNichols were elevated from the practice squad, likely for special-teams roles in Sunday’s games along with depth purposes at their specific positions. McNichols got the nod over fellow running back Ty Davis-Price, who was released Tuesday but re-signed to the practice squad. Also of note, the 49ers opted for Conley’s promotion rather than activate Danny Gray off Injured Reserve."
5,[California] https://www.mercurynews.com/latest-headlines/,It's Sho-ver: Ohtani passes over SF Giants for record-breaking deal with Dodgers,https://www.mercurynews.com/2023/12/09/its-sho-ver-ohtani-passes-over-sf-giants-for-record-breaking-deal-with-dodgers/,"Baseball’s highest-profile free agency ever is over, and the San Francisco Giants struck out once again.

Shohei Ohtani announced Saturday via his personal Instagram a record-shattering agreement that not only meant the Giants finished as runners-up, but will have to face the two-way megastar a dozen times a year as the Dodgers’ grip on the National League West grows even tighter.

Long perceived to be the favorites in the sweepstakes for the two-time MVP and global sensation, the Dodgers reeled in their prize one day after false reports that Ohtani was in agreement with the Toronto Blue Jays sent the sport into a frenzy. The terms of the contract, according to his agent, Nez Balelo: $700 million over 10 years, eclipsing the previous record held by Mike Trout, whose $426.5 million deal had been the largest in major-league history.

In a statement, Balelo called it a “unique, historic contract for a unique, historic player.”

Ohtani, whose decision has stalled the baseball offseason, addressed “all the fans and everyone involved in the baseball world” in his own statement, writing that “I apologize for taking so long to come to a decision,” adding a message to Dodgers fans. “I pledge to always do what’s best for the team and always continue to give it my all to be the best version of myself. Until the last day of my playing career, I want to continue to strive forward not only for the Dodgers but for the baseball world.”

The outcome couldn’t be worse for the Giants, who have been adamant about adding star power this offseason and now must pivot elsewhere while coming to terms with the game’s biggest attraction hitting 1-2-3 with Mookie Betts and Freddie Freeman through at least 2027 (when Freeman’s contract expires).

Don’t forget they also share a division with the defending National League champion Diamondbacks, and while the Padres traded away Juan Soto, they still have Manny Machado, Fernando Tatis Jr., Xander Boegarts and Ha-Seong Kim.

If there’s one silver lining, the Dodgers are taking on considerable risk, given that Ohtani is ruled out from pitching in 2024 after what was reported to be a second Tommy John surgery and is no sure thing to ever be the same two-way player. However, there can only be so much downside to signing the game’s preeminent slugger.

While they were one of at least three teams reported to have received a meeting, the Giants’ final offer is unknown.

“Shohei and I want to thank all the organizations that reached out to us for their interest and respect, especially the wonderful people we got to know even better as this process unfolded,” Balelo said in a statement. “We know fans, media and the entire industry had a high degree of interest in this process, and we want to express our appreciation for their passion and their consideration as it played out.”

Ohtani was easily the top prize on the market, but the Giants should have enough funds earmarked for him that they can use to patch multiple holes on the roster.

They’re still seeking to upgrade their outfield, improve their defense and athleticism, and find a partner for Logan Webb at the top of the rotation.

The Giants have been linked to the top two center fielders available, Cody Bellinger and Jung-Hoo Lee, and general manager Pete Putila said at the Winter Meetings that “we have some internal options, but we’re scanning the entire market, as well.” Third baseman Matt Chapman has strong ties to manager Bob Melvin and would help stabilize the left side of the Giants’ infield and their lineup.

The top priority after Ohtani, though? It might be another Japanese sensation, Yoshinobu Yamamoto.

Only 25 years old, the right-hander has won the past three Sawamura Awards, given annually to the top pitcher in Nippon Pro Baseball. The idea of pairing him with Webb, who’s 26, and Kyle Harrison, 22, is an enticing proposition — but it will also likely be an expensive one, with the Mets and Yankees expected to be in the bidding.

Don’t rule out the Dodgers, either. The addition of Ohtani doesn’t address their biggest need for 2024 — the starting rotation — and the deal reportedly includes “unprecedented deferrals,” meaning they might not be done spending.

Given his age and ability, Yamamoto represents almost as much of a unicorn as Ohtani.

Almost.

This is a developing story. Check back for updates."
6,[California] https://www.mercurynews.com/latest-headlines/,"As expected, Serra falls to Mater Dei in CIF Open state title game",https://www.mercurynews.com/2023/12/09/as-expected-serra-falls-to-mater-dei-in-cif-open-division-state-championship-game/,"MISSION VIEJO — One of the greatest teams in Central Coast Section history, a group of players led by a passionate and driven coach who knows how to motivate young men, took another shot at perfection Saturday night, another swing at the state’s top championship.

But like the past two years, Serra fell short, a second consecutive unbeaten season ending in defeat against one of Southern California’s superpowers.

This time, Mater Dei-Santa Ana took down the Padres, winning the CIF Open Division championship 35-0 at Saddleback College behind its all-star collection of major college talent. The final 11:50 was played with a running clock.

The Open title was Mater Dei’s fourth, all since 2017, and second at Serra’s expense.

A massive underdog on this stage for the third time in as many appearances, the Padres (12-1) pulled out every trick in their book to keep Mater Dei out of sorts and ran down the play clock before snaps to shorten the game.

It worked, to some degree.

Serra trailed 14-0 after the first quarter and didn’t give up a third touchdown until late in the second quarter.

The Padres played with spirited aggression, which was to be expected given the fire coach Patrick Walsh breathes into his program, but they simply were overmatched by a Mater Dei team that loaded four- and five-star talent.

When it was over and Walsh gathered the team in the locker room, he told his players that he loved them.

“One of the best teams I’ve ever coached, a great senior class,” Walsh said. “Full of heart. Full of integrity. Full of pride. Nothing to be ashamed of. The only thing I would fear is if this experience tore them apart. But that’s not going to happen because this team is too tight.”

Mater Dei was far from perfect, penalized 10 times for 80 yards in the first half alone and 16 times for 150 yards overall.

But the Monarchs caught their own break on their first possession when a roughing-the-punter infraction opened the door for a 16-yard touchdown pass from senior quarterback Elijah Brown, a Stanford commit, to freshman tight end Mark Bowman.

The lead stretched to 14-0 later in the quarter on a 74-yard pass down the sideline from Brown to Marcus Harris, a four-star junior. Harris caught the ball in stride and turned on the jets to reach the end zone.

Brown finished 17 of 22 for 298 yards and four touchdowns.

Serra used the Wildcat, spread five receivers to one side of the field, called a fake punt and field goal, recovered an onside kick but with minimal success on the scoreboard.

Mater Dei (13-1) crossed the goal line again late in the first half on a 12-yard TD pass from Brown to Jonah Smith that made it 21-0 at the midway break.

“It didn’t end how I wanted it to,” Serra two-way standout Jabari Mann said. “But I love my team. I love what we did this year. I’m proud of the guys. Proud of the coaches for getting us here every year.”

Last season, an undefeated Serra team that averaged 36.6 per game lost to St. John Bosco 45-0 in the state’s Open Division championship game.

The Padres averaged 43.25 points per game this season while going 12-0, which included victories over Folsom and De La Salle and West Catholic Athletic League and Central Coast Section championships.

Serra finished with 58 yards of offense on Saturday in 39 plays. Mater Dei had 386 yards in 43 plays.

So the story goes.

In California during this era, two teams play at a level nobody in Northern California and very few in Southern California have reached.

“It’s not the outcome we wanted the past three years,” senior safety Joseph Bey said. “But brotherhood is something you can’t buy. Some things just didn’t go our way. I thought we played a really good first half. That first drive we stopped them and then we rushed the punter. That really hurt.”

Mater Dei widened the margin to 28-0 on an 8-yard run by Jordon Davison, a four-star junior from the Bay Area, and 35-0 early in the fourth quarter on a 31-yard touchdown pass from Brown to Jack Ressler.

Before Serra took the field on Saturday night, it watched Folsom — a team it beat in August — hoist a state championship trophy by winning the Division 1-A title with a 20-14 victory over St. Bonaventure.

If Serra had lost to Folsom and/or De La Salle, it might have had a chance to win another division this weekend.

Instead, a senior class that included standouts such as Mann, Bey, Maealiuaki Smith and Danny Niu will leave Serra without a state title but as the top team in NorCal during their era.

Was that hard to watch?

“The best team in Northern California, hands down, bar none,” Walsh said. “We beat other teams that were down here. Not hard at all. No. 1 team in NorCal and if the cost of being the No. 1 team in our area is this, then we’re going to going to continue to strive to do this. That’s just the way it’s going to be.

“We’re the undisputed champs. We’ve gone undefeated back-to-back in the WCAL. That’s never been done since 1958. I’m so proud of this team. I am proud of these kids. I wish I could have done a better job coaching tonight, getting them in position to play better. But I have no regrets and I love the group.”"
