,Local Site,Title,Link,Content(RAW)
96,[New York] https://nypost.com/news/,Blinken says sexual violence by Hamas ‘beyond anything that I’ve seen’ as he blasts UN’s slow response,https://nypost.com/2023/12/11/news/blinken-says-sexual-violence-by-hamas-beyond-anything-ive-seen/,"US Secretary of State Antony Blinken has blasted the United Nations and other international groups for being too slow to condemn rapes and additional sexual attacks by Hamas terrorists — which he says are “beyond anything that I’ve ever seen.”

“The atrocities that we saw on Oct. 7 are almost beyond description or beyond our capacity to digest,” Blinken said in a Sunday interview with CNN’s Jake Tapper.

“And we’ve talked about them before, but the sexual violence that we saw on Oct. 7 is beyond anything that I’ve ever seen, either.”

Blinken said the failure to condemn, and in some cases failure to even believe, the reports of sexual violence is something about which “these organizations, these countries need to ask themselves.”

Blinken was asked whether he thought the UN’s stalled acknowledgment was because of antisemitism.

“I don’t know why countries, leaders, international organizations were so slow to focus on this, to bring it to people’s attention,” Blinken responded. “I’m glad it is finally happening.”

Blinken said the widespread sexual violence committed by Hamas is “beyond anything I’ve ever seen.” CNN

Reports of widespread rape in Israel during Hamas’ attack were first reported last month, when the Physicians for Human Rights Israel published its initial assessment.

Israel War Update Get the most important developments in the region, globally and locally. Enter your email address Please provide a valid email address. By clicking above you agree to the Terms of Use and Privacy Policy. Thanks for signing up!

Never miss a story. Check out more newsletters

“What we know for sure is that it was more than just one case and it was widespread, in that this happened in more than one location and more than a handful of times,” said Hadas Ziv, the group’s policy and ethics director.

One combat medic told The Associated Press how he came across at least a half-dozen bodies of women and men with possible signs of sexual assault.

The bodies had mass bleeding around the groins, he said, with limbs distorted at odd angles.

Israeli police say they are combing through about 60,000 videos seized from terrorists’ body cameras, from social media and from security cameras, as well as 1,000 testimonies, to bring the perpetrators to justice.

But it has been difficult to find the rape survivors, as many were killed afterward.

At first, several lawmakers questioned the reports, and US Rep. Pramila Jayapal (D-Wash.) even called for “balanced” criticism when asked about the rapes.

But House Democrats are planning to introduce a resolution condemning Hamas’ use of rape against Israelis as a weapon of war.

Terrorists celebrate on Saturday, Oct. 7, 2023, after the horrific attack. AP

Meanwhile, the Office of the UN High Commissioner for Human Rights said it requested access to Israel and the Palestinian territories to allow it to collect information about the events of Oct. 7, but a rep for the agency said Israel has not responded to the requests.

The Jewish nation has previously said the UN has pre-existing biases and that Israel will not cooperate with the body.

Instead, Israeli officials said they will consider all options for independent international groups to investigate.

With Post wires"
97,[New York] https://nypost.com/news/,"What did you Google in 2023? ‘Barbie,’ Israel-Hamas war are among the year’s top internet searches",https://nypost.com/2023/12/11/news/what-did-you-google-in-2023-barbie-israel-hamas-war-are-among-the-years-top-internet-searches/,"Your Google search history for 2023 has arrived.

Well, actually, the world’s. On Monday, the California-based tech giant released its “Year in Search,” a roundup of 2023’s top global queries, ranging from unforgettable pop culture moments (hello, Barbenheimer ), to the loss of beloved figures and tragic news carrying worldwide repercussions.

The ongoing Israel-Hamas war topped news trends in 2023, per Google’s global data, followed by queries related to the Titanic-bound submersible that imploded in June, as well as February’s devastating earthquakes in Turkey and Syria.

Damar Hamlin was Google’s top trending person on search this year.

A safety with the NFL’s Buffalo Bills, Hamlin experienced a near-death cardiac arrest on the field during a January game, but has since completed a celebrated comeback.

Actor Jeremy Renner, who survived a serious snowplow accident at the start of 2023, followed. Meanwhile, the late Matthew Perry and Tina Turner led search trends among notable individuals who passed away.

6 Actor Jeremy Renner, who survived a serious snowplow accident, led search trends among notable individuals. ZUMAPRESS.com

In the world of entertainment, “Barbie” dominated Google search’s movie trends this year — followed by Barbenheimer co-pilot “Oppenheimer” and Indian thriller “Jawan.”

In TV, “The Last of Us,” “Wednesday” and “Ginny and Georgia” were the top three trending shows in 2023.

Yoasobi’s “アイドル (Idol)” was Google’s top trending song on search.

6 Damar Hamlin was Google’s top trending person on search this year. AP

6 The Titanic-bound submersible that imploded in June was among the top google search trends. Becky Kagan Schott / OceanGate Expeditions

Jason Aldean’s “Try That In A Small Town” — which soared in the charts after controversy this summer — and Shakira and Bizarrap’s “Bzrp Music Sessions, Vol. 53” followed.

And that’s just the tip of the iceberg for Google’s 2023 global search trends. Bibimbap was the top trending recipe. Inter Miami CF, the new home of Argentine soccer superstar Lionel Messi, led Google’s sports teams trends.

And in the U.S. specifically, many consumers spent 2023 asking why eggs, Taylor Swift tickets and sriracha bottles were so expensive — while “rizz” (recently named Oxford’s word of the year ) was a frontrunner for trending slang definition inquires.

6 The late Matthew Perry and Tina Turner led search trends among notable individuals who passed away. NBCU Photo Bank/NBCUniversal via Getty Images

You can find more data, including country-specific lists and trends from years past, on Google’s “Year in Search” archive.

The company says it collected its 2023 search results from Jan. 1 through Nov. 27 of this year.

Google isn’t the only one to publish annual data as 2023 draws to a close — and from dictionary lookups to music streams, chances are, you’ve probably seen other lists recapping online activity this year.

6 The ongoing Israel-Hamas war topped news trends in 2023, per Google’s global data. AFP via Getty Images

6 More data can be found on Google’s “Year in Search” archive. GoodPics – stock.adobe.com

Last week, for example, Wikipedia released its year-end list of most-viewed entries — with its article about ChatGPT leading the pack.

To mark the search engine’s 25th birthday, Google also released top search data “of all time” across various specific categories.

Since 2004 (when the company’s trends data first became available globally), the most-Googled Grammy winner of all time has been Beyoncé, for example, while Portuguese soccer great Cristiano Ronaldo is the highest-searched athlete, and the most-searched movie or TV cast is “Harry Potter.”"
98,[New York] https://nypost.com/news/,"Israel battles militants in Gaza’s main cities, with civilians still stranded near front lines",https://nypost.com/2023/12/11/news/israel-battles-militants-in-gazas-main-cities-with-civilians-still-stranded-near-front-lines/,"Israeli forces battled Palestinian militants in Gaza’s two largest cities on Monday, with civilians still sheltering along the front lines even after massive waves of displacement across the besieged territory.

Israel has pledged to keep fighting until it removes Hamas from power, dismantles its military capabilities and returns all of the scores of hostages still held by Palestinian militants after being captured during the Oct. 7 surprise attack into Israel that ignited the war.

The US has provided unwavering diplomatic and military support for the campaign, even as it has urged Israel to minimize civilian casualties and further mass displacement.

The war has killed thousands of Palestinian civilians and driven nearly 85% of the territory’s 2.3 million people from their homes.

6 Palestinians mourn relatives killed in the Israeli bombardment of the Gaza Strip outside a morgue in Khan Younis on Dec. 10, 2023. AP

Residents said there was heavy fighting in and around the southern city of Khan Younis, where Israeli ground forces opened a new line of attack last week, and battles were still underway in parts of Gaza City and the built-up Jabaliya refugee camp in northern Gaza, where large areas have been reduced to rubble.

“The situation is extremely difficult,” said Hussein al-Sayyed, who is staying with relatives in Khan Younis after fleeing Gaza City earlier in the war. “I have children and I don’t know where to go. No place is safe.”

He and his three daughters are staying in a three-story home with around 70 others, most of whom have fled from the north, and said they have been rationing food for days. “Over many days, I have eaten just one meal a day to save food for the girls. They are still young,” he said.

6 An Israeli mobile artillery unit fires a shell from southern Israel towards the Gaza Strip, in a position near the Israel-Gaza border on Dec. 10, 2023. AP

Another Khan Younis resident, Radwa Abu Frayeh, witnessed heavy Israeli strikes around the European Hospital, where the UN humanitarian office says tens of thousands of people have sought shelter. She said a strike hit a home close to hers late Sunday.

“The building shook,” she said. “We thought it was the end and we would die.”

FEARS OF PERMANENT DISPLACEMENT

With very little aid allowed in, Palestinians face severe shortages of food, water and other basic goods.

6 Israeli troops prepare weapons and military vehicles by the border fence before entering the Gaza Strip on Dec. 10, 2023. AFP via Getty Images

Some observers openly worry that Palestinians will be forced out of Gaza altogether in a repeat of the mass exodus from what is now Israel during the 1948 war surrounding its creation.

“Expect public order to completely break down soon, and an even worse situation could unfold including epidemic diseases and increased pressure for mass displacement into Egypt,” UN Secretary-General Antonio Guterres told a forum in Qatar, a key intermediary, on Sunday.

Eylon Levy, an Israeli government spokesman, called allegations that Israeli intends mass displacement from Gaza “outrageous and false.”

6 Palestinians carry a wounded girl after being rescued from under the rubble of buildings that were destroyed by Israeli airstrikes in Jabaliya refugee camp, northern Gaza Strip, on Nov. 1, 2023. AP

But other Israeli officials have discussed such a scenario, raising alarm in Egypt and other friendly Arab countries that refuse to accept any refugees.

At the same time, it’s not clear when or if Palestinians would be allowed to return to Gaza City and much of the north — home to some 1.2 million before the war — where entire neighborhoods have been flattened.

The fighting in and around Khan Younis threatens to bring similar destruction to the south, and has already pushed tens of thousands toward the town of Rafah and other areas along the border with Egypt.

6 An Israeli soldier loads a shell into a tank outside the northern Gaza Strip. REUTERS

It has also hindered the delivery of humanitarian aid to most of Gaza, putting even more pressure on people to head south.

HARSH CONDITIONS IN THE SOUTH

Israel says it tries to avoid harming civilians and blames their deaths on Hamas, saying it endangers residents by fighting in dense areas and positioning military infrastructure — including weapons, tunnels and rocket launchers — in or near civilian buildings.

The military said Sunday that troops killed armed men as they left a clinic, and that forces operating in Jabaliya found a truck full of long-range rockets near a school.

6 Palestinians work among debris of buildings that were targeted by Israeli airstrikes in Jabaliya refugee camp, northern Gaza Strip, on Nov. 1, 2023. AP

In a home in Jabaliya, soldiers found a rifle, two rocket-propelled grenade launchers and explosives, it said.

Israel has urged people to flee to what it says are safe areas in the south but has continued to strike alleged militant targets throughout the territory.

Associated Press reporters saw nine bodies brought to a local hospital on Monday after an airstrike hit a home in Rafah overnight.

Israel War Update Get the most important developments in the region, globally and locally. Enter your email address Please provide a valid email address. By clicking above you agree to the Terms of Use and Privacy Policy. Thanks for signing up!

Never miss a story. Check out more newsletters

The aid group Doctors Without Borders said people in the south are also falling ill as they pack into crowded shelters or sleep in tents in open areas.

Nicholas Papachrysostomou, MSF emergency coordinator in Gaza, said “every other patient” at a clinic in Rafah has a respiratory infection after prolonged exposure to cold and rain.

“In some shelters, 600 people share a single toilet. We are already seeing many cases of diarrhea. Often children are the worst affected,” he said.

With the war in its third month, the Palestinian death toll in Gaza has surpassed 17,900, the majority women and children, according to the Health Ministry in the Hamas-controlled territory.

The ministry does not differentiate between civilian and combatant deaths.

Some 1,200 people have been killed on the Israeli side, mostly civilians killed during the Oct. 7 attack, in which Hamas and other militants also captured more than 240 people, including babies, women and older adults.

More than 100 captives were released during a weeklong cease-fire late last month in exchanges for women and minors held in Israeli prisons.

Israel says Hamas still has 117 hostages and the remains of 20 people killed in captivity or during the Oct. 7 attack.

Most remaining hostages are soldiers and civilian men, and the militants hope to exchange them for Palestinians imprisoned by Israel.

The military says 101 Israeli soldiers have died since the start of the Gaza ground offensive.

Palestinian militants have continued firing rockets at Israel, though the vast majority have been intercepted or landed in open areas without causing casualties or damage."
99,[New York] https://nypost.com/news/,Georgia high school football player found dead day before team’s championship game,https://nypost.com/2023/12/11/news/georgia-high-school-football-player-found-dead-day-before-teams-championship-game/,"A beloved Georgia high school football player was found dead a day before his team was scheduled to play in its first state championship in more than 25 years, according to school officials and reports.

The body of 17-year-old Brandon Smith was discovered Sunday but details surrounding his “untimely” death, including the cause, remain unclear.

“We are heartbroken to hear the news of the tragic and untimely death of one of our student-athletes, Brandon Smith,” Manchester Schools Superintendent Robert Griffin and Manchester High School Principal Suze Neal said in a joint statement posted on the school’s website.

“Manchester High School’s celebration of playing for the Georgia 1-A State Football Championship has unfortunately turned into something none of us could have fathomed.”

The school leaders said the tragedy was being probed, with more information expected to be released by the authorities.

3 Manchester High School football player Brandon Smith was found dead day before his team was set to make an appearance in the state championship. Brandon Smith / Hudl

3 Details surrounding his death remain unclear. Manchester High School Blue Devils Football / Facebook

A scene tied to the death was being investigated by police Sunday afternoon, 11 Alive reported. The student was reported missing on Saturday, according to the station.

The Georgia Bureau of Investigation confirmed to WRBL that it was assisting Manchester police with the “crime scene processing.”

“We continue to pray for Brandon’s family, friends, teammates, and classmates,” Griffin and Neal wrote, adding. “Brandon was a loyal teammate and friend who excelled on and off the field. He will be deeply missed.”

3 Mercedes-Benz Stadium in downtown Atlanta, Georgia. Felix Mizioznikov – stock.adobe.com

The school’s football team is slated to play Bowdon High School on Monday in its first state championship contest since 1997, the Atlanta Journal-Constitution reported.

The game is scheduled to take place at the Mercedes-Benz Stadium where the NFL’s Atlanta Falcons play their home games."
100,[New York] https://nypost.com/news/,"Florida man allegedly crashed stolen Mustang into sheriff cars, Uber vehicle killing three",https://nypost.com/2023/12/11/news/florida-man-leosvany-roman-allegedly-crashed-stolen-mustang-into-sheriff-cars-uber-vehicle-killing-three/,"Three people are dead following a wrong-way crash on a Florida bridge involving a rideshare driver and a stolen vehicle.

The crash happened the night of Dec. 6 on I-275 at the Skyway Bridge in St. Petersburg, according to Florida Highway Patrol.

Troopers responded to assist Hillsborough County Sheriff’s Office deputies regarding a stolen Ford Mustang that they had unsuccessfully attempted to stop.

The driver, identified as 22-year-old Leosvany Roman, allegedly crashed into two HCSO vehicles before fleeing the scene, the sheriff’s office said.

According to FHP, Roman led officers on a chase in which he collided with an FHP trooper’s vehicle, then turned around, rammed the vehicle again, then sped off before hitting a Dodge Caravan head-on.

The driver, who FHP confirmed was an Uber operator, was pronounced dead at the scene along with one of three passengers, with a second passenger later dying at a hospital from her injuries.

“This criminal had no regard for human life. Our deputies, facing danger, had to jump out of the way of a man they feared would run them over to get away,” HCSO Sheriff Chad Chronister said. “The additional charges he faces will ensure the only road he’s ever on again is the one that leads straight to jail.”

Leosvany Roman was arrested after allegedly crashing into two HCSO vehicles before fleeing the scene, the sheriff’s office said. Hillsborough County Sheriffs Office

The Dodge driver was identified as a 33-year-old man from Bradenton, Florida. The passenger who died at the scene is said to be a 52-year-old man from Ohio.

FHP said they could not confirm whether the Dodge driver was on duty for Uber at the time.

Uber said in a statement to Fox News Digital that they have no record of the trip, and that the crash “does not appear to be connected to the Uber platform.”

Florida Highway Patrol said they could not confirm whether the Dodge driver was on duty for Uber at the time. Florida Highway Patrol

A 24-year-old passenger from Ohio was last said to have suffered a serious injury, and a 27-year-old trooper who is a two-year veteran with the department, also suffered minor injuries as a result of the incident, FHP said.

Roman is charged with felony murder, vehicular homicide, aggravated fleeing and eluding involving death, driving while license suspended involving death and battery on a law enforcement officer."
101,[New York] https://nypost.com/news/,Jury trial will decide how much Giuliani must pay election workers over false election fraud claims,https://nypost.com/2023/12/11/news/jury-trial-will-decide-how-much-giuliani-must-pay-election-workers-over-false-election-fraud-claims/,"A trial set to get underway in Washington on Monday will determine how much Rudy Giuliani will have to pay two Georgia election workers who he falsely accused of fraud while pushing Donald Trump’s baseless claims after he lost the 2020 election.

The former New York City mayor has already been found liable in the defamation lawsuit brought by Ruby Freeman and her daughter, Wandrea “Shaye” Moss, who endured threats and harassment after they became the target of a conspiracy theory spread by Trump and his allies.

The only issue to be determined at the trial — which will begin with jury selection in Washington’s federal court — is the amount of damages, if any, Giuliani must pay.

The case is among many legal and financial woes mounting for Giuliani, who was celebrated as “America’s mayor” in the aftermath of the 9/11 terrorist attack and became one of the most ardent promoters of Trump’s election lies after he lost to President Joe Biden.

3 This booking photo provided by the Fulton County Sheriff’s Office shows Rudy Giuliani on Wednesday, Aug. 23, 2023, in Atlanta, after he surrendered and was booked. AP

Giuliani is also criminally charged alongside Trump and others in the Georgia case accusing them of trying to illegally overturn the results of the election in the state.

He has pleaded not guilty and maintains he had every right to raise questions about what he believed to be election fraud.

He was sued in September by a former lawyer who alleged Giuliani only paid a fraction of roughly $1.6 million in legal fees stemming from investigations into his efforts to keep Trump in the White House.

And the judge overseeing the election workers’ lawsuit has already ordered Giuliani and his business entities to pay tens of thousands of dollars in attorneys’ fees.

3 Wandrea Moss, former Georgia election worker, becomes emotional while testifying as her mother Ruby Freeman watches during the fourth hearing held by the Select Committee to Investigate the January 6th Attack on the US Capitol on June 21, 2022. Getty Images

Moss had worked for the Fulton County elections department since 2012 and supervised the absentee ballot operation during the 2020 election.

Freeman was a temporary election worker, verifying signatures on absentee ballots and preparing them to be counted and processed.

Giuliani and other Trump allies seized on surveillance footage to push a conspiracy theory that the election workers pulled fraudulent ballots out of suitcases.

The claims were quickly debunked by Georgia election officials, who found no improper counting of ballots.

3 Voting machines fill the floor for early voting at State Farm Arena, Oct. 12, 2020, in Atlanta. AP

The women have said the false claims led to a barrage of violent threats and harassment that, at one point, forced Freeman to flee her home for more than two months.

In emotional testimony before the US House Committee that investigated the US Capitol attack, Moss recounted receiving an onslaught of threatening and racist messages.

In her August decision holding Giuliani liable in the case, US District Judge Beryl Howell said he gave “only lip service” to complying with his legal obligations and had failed to turn over information requested by the mother and daughter.

The judge in October said that Giuliani had flagrantly disregarded an order to provide documents concerning his personal and business assets.

She said that jurors deciding the amount of damages will be told they must “infer” that Giuliani was intentionally trying to hide financial documents in the hopes of “artificially deflating his net worth.”

Giuliani conceded in July that he made public comments falsely claiming Freeman and Moss committed fraud to try to alter the outcome of the race while counting ballots at State Farm Arena in Atlanta.

But Giuliani argued that the statements were protected by the First Amendment."
