,Local Site,Title,Link,Content(RAW)
123,[District of Columbia] https://www.washingtonpost.com/latest-headlines/,"To defeat Trump, Liz Cheney is out to defeat House Republicans",https://www.washingtonpost.com/politics/2023/12/09/liz-cheney-trump-2024-elections/,"Listen 8 min Share Comment on this story Comment Add to your saved stories Save

Liz Cheney is considering many different political roles over the next several years. But there’s one certainty she’s trying for in the next 11 months: Defeating her former House GOP colleagues and electing a new Democratic majority. Keeping up with politics is easy with The 5-Minute Fix Newsletter, in your inbox weekdays. ArrowRight Cheney believes that the 2024 presidential contest could end without any candidate securing a majority of the electoral votes — an outcome that would toss the decision into the House. Or, ex-president Donald Trump could again contest the outcome if he loses the electoral college. That’s why she believes a Democratic majority is the only safeguard for democracy.

“I think that’s why it’s so important that the Republicans not be in the majority in 2025. And that’s, again, for me to be sitting here saying that, is a pretty stunning thing,” said the former three-term lawmaker, who served in House GOP leadership, whose father served 12 years as a House Republican and eight years as a GOP vice president and whose mother served two Republican presidents.

Advertisement

Cheney, 57, has grown so disillusioned with her former caucus that she plans to build on a model she tested out last fall after she lost her August 2022 primary for the sin of challenging Trump politically. Then, she stumped for Democrats in key races at both the state and federal levels that could play a role in future presidential elections.

She has spent the past week crisscrossing the media airwaves promoting her new book, “Oath and Honor,” which recounts her story of growing up in Republican politics and rising up the House GOP ranks, only to end up helping Democrats lead the investigation into the Trump-fueled Capitol attack in January 2021.

She recently raised eyebrows with a tease of a potential independent run for president against the incumbent, Joe Biden, and Trump. Every interview leads to more questions about the indomitable GOP leader and his firm grip over the party’s base voters. She’s already suggested that, should he win a second term, Trump will not leave the White House at the end of his constitutionally mandated exit.

But Cheney has held almost as much contempt for her former House colleagues, who vaulted her to the No. 3 leadership post after just one term in Congress. Quickly and decisively, House Republicans fell in line behind Trump, retired or, like Cheney, lost their GOP primary to a Trump-backed firebrand, replaced by political sycophants.

Advertisement

“I don’t think that the people who are in charge on the Republican side in the House of Representatives today can be counted on to stand up against Donald Trump,” she said during a 45-minute interview on Friday in a private club in Georgetown.

That goes for Rep. Kevin McCarthy (R-Calif.), who’s resigning this month after the MAGA wing took him down as speaker. And it also goes for Rep. Jim Jordan (R-Ohio), the Trump ally who refused subpoenas from the select Jan. 6 committee on which Cheney served as vice-chair last year.

“It felt good for the country, that he lost,” Cheney said of Jordan’s bruising defeat in his bid to succeed McCarthy as speaker. “But I think Mike Johnson is just as much of a threat as Jim Jordan would have been.”

Johnson (R-La.), who ultimately won the speakership, is essentially Jordan with a lower profile, eyeglasses and a clipboard under his arm, as Cheney sees it.

When she was first sworn in on Jan. 3, 2017, the House Republican Conference still leaned heavily toward traditional Reagan-Bush ethos. Speaker Paul D. Ryan (R-Wis.) led the House and its top committee chairs came from the old establishment, like Reps. Greg Walden (R-Ore.), at Energy and Commerce, Kevin Brady (R-Tex.), at Ways and Means, and Mac Thornberry (R-Tex.), at Armed Services.

Advertisement

“I do feel, in some ways, like I kind of saw the very end of a situation in which there was responsible functioning of government,” she recalled.

Ryan and those three committee chairs would all soon retire rather than continue to serve in their party’s Trump-dominated era. Every GOP retirement seems to create a coin-toss chance the successor will not be a serious legislator and instead embrace politics as performance.

“I think one of the best examples of what’s happened is the switch of Mac Thornberry for Ronny Jackson,” Cheney said.

Thornberry, a mentor to Republicans and Democrats alike on national security issues, retired at the start of 2021.

Jackson has so far gained attention mostly for getting into a cursing match with state troopers at a rodeo that ended with him in handcuffs. No charges were filed and the former White House physician said he was trying to help a teenager having a seizure.

Advertisement

Rep. Bryan Steil (R-Wis.), a former Ryan aide, was appointed chair of the House Administration Committee and has overseen investigations of the 2021 attack on the Capitol that have shifted blame away from Trump and his allies.

Share this article Share

In recent weeks a flood of retirement announcements prompted more concerns about what Cheney calls the “caliber” of people serving, particularly on the GOP side.

Does Cheney even consider herself still a Republican?

“I certainly am not a Trump Republican. And I still believe all the same things that I believed before. But the Republican Party no longer stands for those things in the way that it once did,” she said.

Fixing the GOP — whether it’s working from within to reclaim its Reagan-Bush roots, or breaking off to form a new party — is a “post-’24 cycle” matter, according to Cheney.

Advertisement

For now, she’s focused on key House races for next year. Her leadership PAC, the Great Task, had $3.2 million on hand as of its last federal filing, but Cheney can now also raise unlimited sums for her efforts, freed from House ethics rules.

As Cheney and others ponder independent presidential bids, the chances grow that some third-party contender could win a state or two and deny any candidate the bare minimum of 270 electoral votes needed to secure the presidency.

Or, in 2020, had Trump won Arizona, Georgia and Wisconsin — each of which he lost by less than 1 percentage point — he and Biden would have tied at exactly 269 votes and the House would have settled the race.

In these scenarios, the House would vote state by state, with each state counting as one vote.

So Cheney’s Wyoming, with less than 600,000 residents and one lone representative — Rep. Harriet M. Hageman (R), who defeated Cheney last year — would probably cast its one vote for Trump. California, with roughly 39 million residents, would probably cast its one vote for Biden based on its 40-12 split for Democrats in its delegation.

Advertisement

“It’s really going to matter who is in the majority,” Cheney said. “And it’s going to matter a lot who has the majority in each state.”

After the 2022 elections, Republicans held a majority in 26 delegations, Democrats in 22 and two — Minnesota and North Carolina — were tied.

Cheney campaigned in person last year for Rep. Elissa Slotkin (D-Mich.) and endorsed Rep. Abigail Spanberger (D-Va.), each of whom won close races and have backgrounds in national security like Cheney.

Slotkin is running for Senate next year, while Spanberger runs for Virginia governor in 2025, so expect to see Cheney stumping for the nominees to succeed them in the House to help keep the Democrats’ one-seat edge in the delegations from Michigan and Virginia.

Flipping one currently GOP-majority state, to either a tie or the Democratic column, might leave Trump’s path to power short-circuited, because Republicans would hold just 25 majorities and a candidate must win 26 states to claim the Oval Office.

Advertisement

All of this might seem like preparing for a worst-case scenario that is very unlikely to come. The House last decided a presidential contest 200 years ago. But ever since Jan. 6, 2021, Cheney leaves nothing to chance.

She still despises most Democratic policies — “what’s happening at the border is really irresponsible” — but her foremost focus is blocking Trump.

And Trump’s recent words and actions as the GOP front-runner, embracing authoritarian rhetoric and dire warnings about how he’d govern in a second term, added to her cause.

“It’s not a choice that anyone would ever wish to have. But we can survive bad policy. We can’t survive a leader who’s going to torch the Constitution,” Cheney said.

In early 2020, she had a chance to run for an open Senate seat, from which she would have had a six-year term and still be in the arena. Instead, Cheney preferred the House’s traditional hand-to-hand combat over the Senate’s debate society ways, seeing a path to become the first GOP female elected speaker.

Her true calling was to sacrifice her career in her pursuit of defeating Trump.

“And I think that was exactly the right place for me to be,” she said."
124,[District of Columbia] https://www.washingtonpost.com/latest-headlines/,"LeBron James, Anthony Davis punish Pacers as Lakers lift NBA Cup",https://www.washingtonpost.com/sports/2023/12/09/lakers-win-season-tournament-nba-cup/,"Listen 6 min Share Comment on this story Comment Add to your saved stories Save

LAS VEGAS — LeBron James hugged his Los Angeles Lakers teammates, donned a commemorative hat and lifted the NBA Cup over his head with both hands in a joyous, but not overly emotional, conclusion to the inaugural in-season tournament. The stunners. The cheers. The home runs, hat tricks and gameday magic. Don’t miss out with The Sports Moment, a newsletter for the biggest sports news. ArrowRight The Lakers scored a 123-109 victory over the Indiana Pacers in the championship game at T-Mobile Arena on Saturday night, claiming the title thanks to their punishing style and just enough late-game resolve. James finished with 24 points, 11 rebounds and four assists to earn tournament MVP honors, adding to his four regular season MVPs, four Finals MVPs and three All-Star Game MVPs.

Anthony Davis added 41 points, 20 rebounds and five assists, pounding away against an overmatched Pacers front line from start to finish. Each Lakers player earned a $500,000 bonus as tournament champions, while each Pacers player took home $200,000 as the runners-up.

Advertisement

“Records will be broken, but one thing that will never be broken is being the first to do something,” James said. “We’re the first champions of the in-season tournament and nobody can ever top that.”

In the quiet moments after the trophy presentation, James munched on grapes at his locker, packed his body with ice and gifted his Cup-winning sneakers to longtime Nike executive Lynn Merritt. James handed off his MVP trophy to Maverick Carter, his longtime business partner, and chatted with Klutch Sports CEO Rich Paul at the end of a long weekend. The Lakers’ cork-popping was confined to an auxiliary room and seemingly over before it started.

The Lakers looked and acted like a team that was proud that it handled its business going 4-0 in the group stage before beating the Phoenix Suns, New Orleans Pelicans and Pacers in the knockout round, but their understated celebration was a far cry from the tearful and champagne-soaked scene following their 2020 championship in the Bubble. Lakers owner Jeanie Buss wasn’t on hand for the trophy presentation, and it remains unclear whether the franchise will hang a banner to recognize the tournament title at Crypto.com Arena in Los Angeles.

Though the NBA Cup and its accompanying riches were something to compete for early in the season, the event paled in comparison to what’s coming in the playoffs, especially for a franchise that has won 17 championships.

Advertisement

“We want to put it in perspective that it’s still December,” James said. “We like where we are right now but we want to continue to work our habits, continue to get healthy as well. Right now, where we are in December, I would take it. But I’m definitely not looking to May and June. That’s too far.”

The in-season tournament’s 67th game proved to be a fervent finale for an event that largely exceeded expectations by delivering intense elimination games and improved television ratings. Neither team built a double-digit lead until Los Angeles went up 70-60 early in the third quarter, and a nonstop stream of officiating complaints from both sides confirmed this was a more serious occasion than a typical regular season game.

Share this article Share

“I will say, in terms of the interest we are seeing around the in-season tournament, I don’t think it was just the money,” NBA Commissioner Adam Silver said Saturday. “I think it was the competition, in part. I think it was coming to Vegas. I think it was all those things that made the difference. I should say also that players like LeBron, [Stephen Curry] and other leading veterans in this league embracing this from day one makes a big difference with the players.”

Both the Lakers and Pacers entered Saturday’s final with identical 6-0 tournament records and differing motivations: James wanted to put his stamp on the new event while making his case to one day own an NBA franchise in Las Vegas, while Tyrese Haliburton and his small-market teammates wanted to introduce themselves to a national television audience while getting valuable experience for the playoffs.

Sin City was anything but a neutral site: Lakers fans outnumbered Pacers fans at least 20-1 in a sold-out crowd of more than 19,000, and boos rained down when James uncharacteristically found himself in early foul trouble. The 38-year-old forward picked up two fouls in the first quarter before wrestling with Aaron Nesmith to earn his third with more than three minutes left before halftime. Lakers Coach Darvin Ham challenged the call, and James protested at length, but their efforts proved unsuccessful.

Advertisement

Davis and Austin Reaves picked up the slack in James’s absence, helping the Lakers claim a 65-60 halftime lead by attacking the heart of the Pacers’ defense. Davis piled up 13 points and eight rebounds in the first quarter, and Reaves scored 22 of his 28 points before halftime.

“That was a Shaq-like dominant performance,” James said of Davis.

The Lakers’ cast of long and aggressive perimeter defenders was difficult for Haliburton to crack: The Pacers’ star guard had a three-pointer blocked and tossed up an air ball under duress in the early going, and he finished with 20 points and 11 assists, never looking as comfortable as he had while knocking out the Boston Celtics and Milwaukee Bucks.

While Indiana enjoyed a memorable tournament run thanks to its free-flowing, league-leading attack, its offense stalled Saturday, buoyed by a parade to the free throw line in the first half and several sloppy Los Angeles turnovers late in the third quarter. The Lakers squandered possessions with an illegal screen, an over-and-back violation and a bad pass in quick succession, and Bennedict Mathurin hit a running three-pointer to beat the third-quarter buzzer to help the trailing Pacers maintain contact.

Advertisement

Down the stretch, the Pacers’ frontcourt ultimately proved unable to withstand the Lakers’ bludgeoning. Indiana center Myles Turner played just 25 minutes because of persistent foul trouble, and he fouled out with more than four minutes remaining. Turner’s undersized replacements struggled to keep Davis and James from scoring inside; Los Angeles racked up 86 points in the paint.

“We’ve been doing it together for a long time, five years now,” Davis said of his partnership with James. “We just figure it out. We know each other’s tendencies, what we like to do. Obviously in crunchtime, we get to our infamous pick-and-roll and it’s tough to stop. We feed off one another.”

A well-rested James, who played just 23 minutes in the Lakers’ blowout of the Pelicans in the semifinals Thursday before watching from the sideline for chunks of the first half Saturday, slammed the door with a double-clutch dunk with a little more than two minutes to play. Soon after, Pacers Coach Rick Carlisle waved the white flag by emptying his bench and Silver handed out the hardware."
125,[District of Columbia] https://www.washingtonpost.com/latest-headlines/,Capitals turn in a complete effort to rout the first-place Rangers,https://www.washingtonpost.com/sports/2023/12/09/capitals-rangers-shutout/,"Listen 5 min Share Comment on this story Comment Add to your saved stories Save

The Washington Capitals keep finding ways to surprise. After losing their previous three games heading into Saturday night’s matchup with the New York Rangers, who are atop the Metropolitan Division and entered the day third in the NHL, the Capitals were a significant underdog. Their most recent loss — in a shootout against visiting Dallas on Thursday — was a step forward after flat performances at Las Vegas and Arizona ended a five-game Western Conference road trip with a pair of thuds, but the Rangers presented another significant challenge.

After Sonny Milano opened the scoring just 43 seconds after the puck dropped at Capital One Arena, though, Washington rolled to a 4-0 win. Charlie Lindgren made 31 saves — including three on his younger brother Ryan, a Rangers defenseman — to notch his second shutout of the season.

Advertisement

Milano was a healthy scratch Thursday, and he wasted little time in responding after returning to the lineup. His line, with Evgeny Kuznetsov at center and T.J. Oshie on the right wing, started the game and worked the puck deep into the Rangers’ end. As the Capitals cycled around the zone, stretching out the defense, Milano slid unmarked toward the far post. Defenseman Martin Fehervary slipped a pass across the crease, and Milano had a wide-open net behind goalie Igor Shesterkin (25 saves).

“I thought that shift from Kuzy’s line ... set the tone for our entire group,” Capitals Coach Spencer Carbery said. “Just right away, from the puck pressure, good decisions, the execution with the puck that we’ve talked extensively about and had discussed earlier in the day, it just got us right into the right mind-set for the entire group.”

Anthony Mantha doubled Washington’s lead 1:43 into the second period, two seconds after a power play expired. Another forward left unmarked by the Rangers, Mantha drove toward the net and tipped a pass from Kuznetsov over Shesterkin’s shoulder.

The goals kept coming. The Capitals’ sluggish scoring has been well documented, but they regularly found openings on Shesterkin — who won the Vezina Trophy in 2022 as the best goalie in the league. Tom Wilson made it 3-0 less than four minutes after Mantha’s tally with a transition goal; he poked the puck away in the defensive zone, raced up the ice on a two-on-one with Alex Ovechkin and fired a wrist shot past Shesterkin.

Advertisement

Nicolas Aube-Kubel added the last goal at 11:52 of the second with a bar-down wrister from the slot — not the kind of goal typically produced by the fourth line, which only emphasizes the confidence the Capitals gathered on offense during this one.

Share this article Share

“They’re kind of a benchmark team right now in the league,” Wilson said of the Rangers (18-6-1). “We knew we were going to have to be ready. They play fast. They have a lot of skill. Good balanced lineup. I think we set the tone from a first shift. Kuzy’s line did a good job, and [we] kind of rolled from there.”

The Rangers pushed back at points — midway through the first period, late in the second and for brief stretches of the third — but the offensive outburst gave Washington (13-8-3) the luxury of a cushion. Many of the Capitals’ wins have been characterized by white-knuckle defending and clinging to a narrow lead in the final minutes, but Saturday they were in control from start to finish.

Advertisement

Lindgren improved to 6-2-1 with a .931 save percentage. He didn’t have to be perfect for the Capitals to win Saturday, but he was anyway.

Carbery and Aube-Kubel agreed it was Washington’s most complete effort of the season. The Capitals received a standing ovation from the capacity crowd of 18,573 over the game’s final 90 seconds.

“I thought our puck play tonight was as good as it’s been all year long,” Carbery said. “Coming through the neutral zone, we looked way quicker. Our execution, whether it was a bank pass or whether we were beating a guy with speed or whether it was an area play, everything just seemed like it was way cleaner and connected.”

Said Aube-Kubel: “Especially against that team, against our ex-coach [Peter Laviolette], just means a lot.”

The next challenge for the Capitals is to translate the effort they often show against the league’s top teams into every game on the schedule. They’re developing a habit of showing up when the lights are brightest — Lindgren’s other shutout was against the Vegas Golden Knights, the defending Stanley Cup champions — but slipping away when the spotlight fades.

Advertisement

“Starting to learn that,” Carbery said. “And that maybe is something that’s been talked about in the past, of playing to a level and that. Now we need to lose that reputation because you just don’t have that luxury of being able to turn it on and off.”"
126,[District of Columbia] https://www.washingtonpost.com/latest-headlines/,"At least 6 dead, 23 injured after tornadoes touch down near Nashville",https://www.washingtonpost.com/nation/2023/12/09/tennessee-tornado-fatalities/,"Listen 3 min Share Comment on this story Comment Add to your saved stories Save

Six people were killed and nearly two dozen injured after tornadoes touched down around Nashville on Saturday, according to local authorities, who feared the death toll could rise as rescue efforts continued late Saturday night. Want to know how your actions can help make a difference for our planet? Sign up for the Climate Coach newsletter, in your inbox every Tuesday and Thursday. ArrowRight The severe thunderstorms that spawned the tornadoes erupted ahead of an intense cold front that stretched from Michigan through western Tennessee and into eastern Texas. Ahead of the front, abnormally warm and humid air — as much as 20 degrees higher than average for this time of year — surged northward, helping to fuel the storms.

Six people were killed and nearly two dozen injured after tornadoes caused by severe thunderstorms tore through areas near Nashville on Dec. 9. (Video: Naomi Schanen/The Washington Post)

More than 75,000 customers were without power in Tennessee as of Saturday night. The hardest hit areas appeared to be Clarksville, Tenn., and the northern side of Nashville. A child and two adults were killed in Clarksville, the city’s mayor said, and the Nashville Emergency Operation Center reported three people were killed by severe storms there.

Advertisement

“This is devastating news and our hearts are broken for the families of those who lost loved ones,” said Clarksville Mayor Joe Pitts, who declared a state of emergency and enacted a 9 p.m. curfew for Saturday and Sunday night. “The city stands ready to help them in their time of grief.”

Share this article Share

Rescue efforts were still underway in both areas Saturday night. Photos from the Clarksville Fire Rescue showed at least two homes with their front facades and roofs torn off, a tractor-trailer truck that had been flipped onto its side and rescue workers scouring neighborhoods for people trapped or injured. Northeast of Nashville, utility poles, trees and power lines were downed in the nearby city of Gallatin, while buildings were at least partially collapsed in parts of neighboring Hendersonville.

Tennessee Gov. Bill Lee (R) directed the public Saturday night to follow guidance from local and state officials. “We mourn the lives lost,” he said in a social media post.

Advertisement

Through 8:30 p.m. Eastern, the National Weather Service had received about 75 reports of severe weather from northern Louisiana to southern Kentucky. But most of the severe weather was concentrated in western and central Tennessee, including 15 reports of tornadoes. The NWS said that as of 10 p.m., the severe weather threat had ended for all of Middle Tennessee.

The same front is forecast to barge toward the East Coast on Sunday. Some severe storms could erupt in the Southeast and Mid-Atlantic but they are not predicted to be as widespread or violent as Saturday’s storms in the Tennessee Valley.

In the Northeast, the front is expected to trigger torrential rains Sunday night into Monday morning. Flood watches are in effect from northern Virginia to eastern Maine, including Washington, Philadelphia, New York and Boston, where 1 to 3 inches of rain are predicted."
