,Local Site,Title,Link,Content(RAW)
178,[District of Columbia] https://www.washingtonpost.com/latest-headlines/,Asteroid pieces brought to Earth may offer clue to life’s origin,https://www.washingtonpost.com/science/2023/12/11/nasa-osiris-rex-sample-results/,"Listen 7 min Share Comment on this story Comment Add to your saved stories Save

Before Earth had biology, it had chemistry. How the one followed from the other — how a bunch of boring molecules transformed themselves into this special thing we call life — is arguably the greatest unknown in science. It’s also a big reason NASA sent a robotic spacecraft, OSIRIS-REx, on a multiyear journey around the sun to fetch some crumbly material from an ancient asteroid named Bennu and then bring it back to Earth.

On Monday, the scientific community got its first description of that precious, exotic stuff, revealed by the mission’s top scientist, Dante Lauretta, at the fall meeting of the American Geophysical Union in San Francisco.

Lauretta, a planetary scientist at the University of Arizona, showed slides with a long list of intriguing molecules, including carbon-based organics, in the grains and pebbles retrieved from Bennu. They will shine light on the molecular building blocks of the solar system and “maybe — still early phase — maybe insights into the origin of life.”

Advertisement

This analysis has only just started. The team has not yet released a formal scientific paper. In his lecture, Lauretta cited one interesting triangular, light-colored stone, which he said contained something he’d never seen before in a meteorite.

“It’s a head-scratcher right now. What is this material?” he said.

In an interview after the lecture, Lauretta said almost 5 percent of the sample is carbon. “That is a very carbon-rich sample — the richest we have in all our extraterrestrial material. … We’re still unraveling the complex organic chemistry, but it looks promising to really understand: Did these carbon-rich asteroids deliver fundamental molecules that may have gone on to contribute to the origin of life?”

The laboratory analysis is searching for other molecules and compounds important to life on Earth, such as amino acids, lipids, sugars and the bases of the genetic code, Lauretta said, adding that the results so far are exciting. The team is still refining its report, which will be discussed at a scientific meeting early next year, he said.

NASA chose to send a probe to Bennu in part because it is potentially the most dangerous asteroid in the solar system. Its orbit around the sun is similar to that of Earth. Every six years the rock, which is about three-tenths of a mile in diameter (large enough to get your attention, but not nearly big enough to deliver an extinction-level impact) crosses our planet’s orbital path.

Advertisement

A calculation published in 2021 estimated that Bennu has a 1-in-2,700 chance of slamming into Earth in September 2182. That estimate will be refined after the asteroid makes a close pass in 2135.

On the very off chance that earthlings will want to knock the rock off course, they’d definitely like to know precisely what they’re hitting. A telescope doesn’t deliver as much information as a robotic visitor. Hence, OSIRIS-REx (which stands for Origins, Spectral Interpretation, Resource Identification and Security – Regolith Explorer).

Even before the scientists began analyzing the samples, one thing had been firmly established: Bennu is very, very black.

“It’s super black. It’s so black it’s hard to take a picture of,” project scientist Jason Dworkin said in advance of the meeting. The material includes “all kinds of different shades of black” — plus mysterious glints of yellow and red and pink, he added.

A career’s worth of material

NASA launched the OSIRIS-REx spacecraft in 2016, and it reached Bennu in 2018. In 2020 it performed a series of delicate maneuvers to touch the asteroid with a sampling device on the end of a robotic arm. The arm plunged unexpectedly deep into the asteroid, which turned out to be what scientists call a rubble pile, made of loosely aggregated material held together by gravity.

Advertisement

The spacecraft then returned to the vicinity of Earth and released a capsule containing the sample. On Sept. 24 it landed almost perfectly on target on a military bombing and training range in western Utah. The capsule showed no sign of stress from its long voyage and, indeed, sat upright on the desert floor just a few convenient paces from a road.

Share this article Share

The carefully sealed capsule was then transported to NASA’s Johnson Space Center in Houston. Next came the very delicate work of retrieving the material from Bennu. Inside the capsule was a canister that, in turn, held a sampling device. The canister was opened, but the sampling device proved uncooperative. It was sealed by 35 specially designed fasteners, two of which wouldn’t budge.

NASA is designing a new tool that should get the job done in coming weeks. In the meantime, according to a NASA blog post, the sampling device has been transferred to another container and is “surrounded by a sealed Teflon bag to make sure the sample is kept safe in a stable, nitrogen-rich, environment.”

Advertisement

Still, no one panicked: A member of the team realized that it would be possible, using tweezers and scoops, to retrieve some of the trapped material from inside the device. As a result, the team obtained 70 grams of sample, exceeding the official mission requirement of 60 grams.

“This is a career’s worth of material for thousands of researchers all over the world. So we’re ecstatic,” Lauretta said. “I fully expect the cosmochemistry community is going to go to town on this.”

“We’re getting a lot of information from a very small amount of sample,” NASA astrobiologist Danny Glavin said in advance of the meeting.

Looking for life

Bennu is a fragment of a larger object that was shattered during a collision early in the history of the solar system, scientists believe. The parent body, heated by radioactive decay, would have been warm enough for interior water to be in liquid form.

Advertisement

“If you add water, you can do a lot of interesting chemistry,” Glavin said.

It is not prejudicial to say that chemistry gets more interesting when it somehow produces a living thing. Paleobiologists know that life existed on Earth, as bacteria, at least 3.5 billion years ago — relatively soon after the planet survived a long period of violent bombardment from rocks that cluttered the solar system in its youth.

It’s unlikely that Bennu’s parent body had anything alive in it, but it may have cooked up interesting compounds akin to the ones that formed the building blocks of life on Earth, which, as Dworkin put it, “had to have started with chemistry that happens in space.”

Prebiotic chemistry, however, is a long way from a bacterium — “about as far as a bottle of vitamins from Thanksgiving dinner,” Dworkin said.

Advertisement

This space dirt has astrobiological import, though. By looking at prebiotic chemistry on Bennu, scientists will have a better idea what they are looking at if and when they find suspicious molecules elsewhere in the solar system, such as on Mars, Jupiter’s moon Europa or Saturn’s moon Enceladus.

“This is almost the perfect laboratory control from non-biological chemistry,” Glavin said. “This better prepares us for our search for life on Mars, or Europa or Enceladus — places that might have had life at one point.”"
179,[District of Columbia] https://www.washingtontimes.com/news/world/,Climate talks enter last day with no agreement in sight on fossil fuels,https://www.washingtontimes.com/news/2023/dec/11/climate-talks-enter-last-day-with-no-agreement-in-/,"DUBAI, United Arab Emirates — Hopes for finishing a critical climate summit on time were fading early Tuesday as countries were still far apart on key issues, including an agreement on what to do about the fossil fuels that are causing dangerous global warming.

The United Nations-led summit known as COP28 was scheduled to end around midday after nearly two weeks of speeches, demonstrations and negotiations. But the climate talks often run long, and Monday’s release of a draft agreement angered countries that insist on a commitment for rapid phase-out of coal, oil and gas.

Instead, the draft called for countries to reduce “consumption and production of fossil fuels, in a just, orderly and equitable manner.”

Tina Stege, climate envoy for the Marshall Islands, ridiculed the document as “a meaningless wish list” that “questions the science” and said it doesn’t address the Paris agreement goal of limiting warming to 1.5 degrees Celsius (2.7 Fahrenheit) to stave off the worst effects of climate change. Earth is on its way to smashing the record for hottest year, endangering human health and leading to ever more costly and deadly extreme weather.

“There is no justice in a result from this COP that condemns my country’s future,” said Stege, whose country is one of the many island nations most at risk from rising seas.

Europeans also pushed for a stronger document.

“It is difficult to come to a result here by midday (Tuesday),” German Foreign Minister Annalena Baerbock said. “This is not a problem for the European delegation. We have time and we are prepared to stay a little longer.“

Bangladesh climate envoy Saber Chowdhury said a revised text would be presented Tuesday morning that takes into account the comments from the many participants .

“It’ll be new. To what extent it’s improved remains to be seen,” he said shortly after discussions ended at around 2 a.m. on Tuesday.

Final decisions by COPs have to be by consensus. Activists said they feared that potential objections from major oil producers, such as Saudi Arabia, had watered down the text. The head of OPEC, the powerful oil cartel, was reported to have written to member countries last week urging them to block any language to phase out or phase down fossil fuels.

Saudi Arabia’s Noura Alissa said the deal “must work for all.”

“It must be relevant, it must make to sense to accelerate action for every single country in this room, not some over others,” she said.

Some developing nations resisted a fossil-fuel phaseout on the grounds that it was unfair for wealthy nations, after centuries of using and profiting from coal, oil and gas, to deny them the same.

That included Botswana, whose environment minister, Philda Nani Kereng, said her country is “still, you know, exploiting natural resources for economic development, for livelihood improvement, for job creation and so forth.”

It’s important that any agreement is “not going to sort of stop us from developing our people,” she said.

China and U.S., the world’s two biggest sources of planet-warming emissions, both spoke against the draft text.

Zhao Yingmin, China’s vice minister for Ecology and Environment, said at the meeting that “the draft fails to address the concerns of developing countries on some key issues” and in particular the idea that greenhouse gas emissions must peak by 2025.

United States climate envoy John Kerry said the language on fossil fuels in the text “does not meet the test” of keeping 1.5 alive.

“I, like most of you here, refuse to be part of a charade” of not phasing out fossil fuels, Kerry said. “This is a war for survival.”

Kerry’s remarks received a round of applause from the room. But he was confronted as he left by climate activists who called for more action, saying their future is at stake.

In the 21-page document, the words oil and natural gas did not appear, and the word coal appeared twice. It also had a single mention of carbon capture, a technology touted by some to reduce emissions although it’s untested at scale.

COP28 President Sultan al-Jaber told a plenary session on Monday that “the time to decide is now.”

“We must still close many gaps. We don’t have time to waste,” he said.

On that point, critics agreed.

“COP28 is now on the verge of complete failure,” former U.S. Vice President and climate activist Al Gore posted on X. “The world desperately needs to phase out fossil fuels as quickly as possible, but this obsequious draft reads as if OPEC dictated it word for word. … It is deeply offensive to all who have taken this process seriously.”

• Associated Press journalists Olivia Zhang, Malak Harb, Bassam Hatoum and David Keyton contributed to this report."
180,[District of Columbia] https://www.washingtontimes.com/news/world/,"In Hong Kong, ‘patriots-only’ local elections see record-low voter turnout",https://www.washingtontimes.com/news/2023/dec/11/in-hong-kong-patriots-only-local-elections-see-rec/,"Hong Kong saw a record-low voter turnout for Sunday’s ​closely watched District Council elections, after a process that saw only those with “patriotic” credentials allowed to​ run for office.

According to the Hong Kong elections website, voter turnout was ​just 27.5​%. That contrasts with a 71.2​% turnout in the last district elections in 2019, according to the Hong Kong Free Press, a Hong Kong-based ​activist news website.

​It was the first District Council elections held after the Beijing government passed a stringent new security law for the onetime British colony, an attempt to rein in Hong Kong’s boisterous tradition of local democracy and the enclave’s rising resistance to control from the ruling Communist Party. A ​new requirement that candidates secure endorsements from at least nine members of government-appointed committees before being allowed to join the race led to a clean-sweep for pro-Beijing candidates Sunday.

The low turnout came despite significant efforts​ by authorities — including carnivals and free concerts — to encourage voters to go to the polls. A glitch in the electronic voting systems also​ led to the polls being opened an hour later than had been planned.​ Six arrests were reported.

The district councils, ​whose jurisdiction includes local issues such as building projects and approving public facilities, are Hong Kong’s last major political bodies mostly chosen by the public.

​Watershed

Pro-democracy forces saw the turnout and the result as a watershed moment for Hong Kong. In 2019, ​the city was shaken by massive, disruptive and sometimes violent demonstrations opposing the extradition of ​local residents to face trials in ​mainland China​, seen as a direct challenge to Hong Kong’s long-independent local institutions.

The protests empowered pro-democracy groups and activists​, and that year’s District Council vote saw 17 out of 18 districts​ captured by pro-democracy candidates.

Beijing reacted. In 2020, the passage of a powerful “National Security Law” significantly chilled Hong Kong’s political climate. Changes to electoral districts and processes followed.

​Some 88 seats out of a total of 470 in the District Council were up for grabs in Sunday’s direct election, with ​4.3 million voters able to cast ballots. The number of directly elected council seats was a cut of 20​% from the 2019 election.

Electoral boundaries had also been redrawn. Those seats that are not occupied as a result of direct vote are chosen by the city’s ​Beijing-friendly chief executive and government committees. ​There were significant vacancies as well: A large number of district councilors who declined to take a new oath of allegiance resigned from their seats in 2021.

With all the newly filled seats occupied by pro-Beijing candidates, ​the central government pronounced itself satisfied with Sunday’s results.

A spokesperson for the Liaison Office of the Central People’s Government in the Hong Kong Special Administrative Region called ​the results “a fair, just, open and high-quality election with wide participation of the society,” the​ Chinese Communist Party-controlled People’s Daily reported.

The ​liaison ​office is the de facto representative of Beijing in Hong Kong, ​which, since handover ​from Britain to China in 1997, has been run as a Special Administrative Region, or SAR.

The spokesperson added that “this election has completely excluded anti-China rioters from the​ … governance system, effectively implemented the principle of ‘patriots administering Hong Kong,’ and opened a new chapter in district governance.”

Hong Kong SAR Chief Executive John Lee ​told the Xinhua News Agency that the new councilors will be “patriots administering Hong Kong​,” ensuring that the entire governance system complies with ​principle of “one country, two systems​.”

​But some said there was no way to sugarcoat the plunge in voter enthusiasm reflected in the low turnout numbers.

“The record low turnout must be hugely humiliating for the government and its allies given the unprecedented propaganda campaigns and ubiquitous mobilization,” Kenneth Chan, a professor at Hong Kong Baptist University’s government and international studies department, told The Associated Press.

​Party-centric ‘patriotism’

Chinese President Xi Jinping​ has embarked on a campaign to promote “patriotism​” across the land, with a law on ​patriotic ​education being enacted in October this year.

​But some academics see the push by the powerful Chinese leader as party-centric nationalism​ by another name, designed more to cement the regime’s hold on power than to teach ordinary Chinese about their country’s past.

At a time when China is expanding ​economically and militarily around the region and the world, a key aim of patriotic education has been to remind the Chinese of the humiliations their country suffered at the hands of colonial powers in the 19th and 20th centuries.​ Foremost among them was Britain, which won Hong Kong as a colony after victory in the ​one-sided First Opium War in 1842.

After the U.K.’s historic lease expired, it handed the colony — by then an Asian powerhouse that was home to vibrant financial, service and movie industries — back to China amid great fanfare in 1997.

​Hong Kong has since been ruled under the “One Country, Two Systems” principle that recognizes the differences between ​the city and the mainland. But the watershed year of 2019, and multiple events since, have cast doubts among many Hong Kongers and outsider observers about Beijing‘s commitment to the principle.

Mr. Lee was the only candidate approved by Beijing for Hong Kong’s chief executive position in 2022. A former policeman and security official, he greenlighted the arrest of scores of pro-democracy figures in 2021.

​The fallout from Sunday’s vote and the shrinking sphere for civil liberties in Hong Kong could have some aftershocks.

The events in Hong Kong ​are being closely followed in Taiwan. ​With relations with China dominating the campaign, the democratic island goes to the polls in January to vote for a new president.

• Andrew Salmon can be reached at asalmon@washingtontimes.com."
181,[District of Columbia] https://www.washingtontimes.com/news/world/,"Ship attacked off Yemen, private intelligence firms say, as Houthi rebel threats grow",https://www.washingtontimes.com/news/2023/dec/11/ship-attacked-off-yemen-private-intelligence-firms/,"DUBAI, United Arab Emirates — A ship off the coast of Yemen in the Red Sea has been attacked, private intelligence firms said Tuesday.

The attack on the vessel comes as threats have increased from Yemen‘s Houthi rebels on commercial shipping in the area over the Israel-Hamas war raging in the Gaza Strip. The Houthis did not immediately claim responsibility for the attack, though rebel military spokesperson Brig. Gen. Yahya Saree said an important announcement would be coming from them soon.

The private intelligence firms Ambrey and Dryad Global confirmed the attack happened near the crucial Bab el-Mandeb Strait separating East Africa from the Arabian Peninsula.

Dryad Global identified the vessel attacked as the Strinda, a Norwegian-owned-and-operated ship that had broadcast it had armed guards aboard as it went through the strait. The ship’s managers did not immediately respond to a request for comment early Tuesday. The vessel, an oil-and-chemical carrier, was coming from Malaysia and was bound for the Suez Canal.

The U.S. and British militaries did not immediately respond to requests for comment. However, the British military’s United Kingdom Maritime Trade Operations, which provides warnings to sailors in the Middle East, earlier reported a fire aboard an unidentified vessel off Mokha, Yemen, with all the crew aboard being safe.

The coordinates of that fire correspond to the last known location of the Strinda. It wasn’t immediately clear what kind of weapon was used in the attack.

The Iranian-backed Houthis have carried out a series of attacks on vessels in the Red Sea and also launched drones and missiles targeting Israel. In recent days, they have threatened to attack any vessel they believe is either going to or coming from Israel, though there was no immediate apparent link between the Strinda and Israel.

Analysts suggest the Houthis hope to shore up waning popular support after years of civil war in Yemen between it and Saudi-backed forces.

France and the U.S. have stopped short of saying their ships were targeted in rebel attacks, but have said Houthi drones have headed toward their ships and have been shot down in self-defense. Washington so far has declined to directly respond to the attacks, as has Israel, whose military continues to describe the ships as not having links to their country.

Global shipping has increasingly been targeted as the Israel-Hamas war threatens to become a wider regional conflict - even as a truce briefly halted fighting and Hamas exchanged hostages for Palestinian prisoners held by Israel. The collapse of the truce and the resumption of a punishing Israeli ground offensive and airstrikes on Gaza have raised the risk of more sea attacks.

In November, the Houthis seized a vehicle transport ship linked to Israel in the Red Sea off Yemen. The rebels still hold the vessel near the port city of Hodeida. Separately, a container ship owned by an Israeli billionaire came under attack by a suspected Iranian drone in the Indian Ocean.

A separate, tentative cease-fire between the Houthis and a Saudi-led coalition fighting on behalf of Yemen‘s exiled government has held for months despite that country’s long war. That’s raised concerns that any wider conflict in the sea - or a potential reprisal strike from Western forces - could reignite those tensions in the Arab world’s poorest nation.

In 2016, the U.S. launched Tomahawk cruise missiles that destroyed three coastal radar sites in Houthi-controlled territory to retaliate for missiles being fired at U.S. Navy ships at the time.

• Associated Press writer Samy Magdy in Cairo contributed to this report."
182,[District of Columbia] https://www.washingtontimes.com/news/world/,Former Hamas official turns on terror group’s current leadership,https://www.washingtontimes.com/news/2023/dec/11/former-hamas-official-turns-on-terror-groups-curre/,"The former head of communications for Hamas called the Palestinian terror group’s current leaders “crazy people,” saying their decision to launch the Oct. 7 ramage into southern Israel has set back life in the Gaza Strip for 200 years.

“They destroyed the Gaza Strip. There is no opportunity to live,” Yousef al-Mansi said during questioning by Israel‘s Shin Bet security agency.

As Israel continues its campaign to destroy Hamas, Mr. al-Mansi said Yahya Sinwar, the group’s current leader, has lost the support of those living in the Palestinian enclave. Israeli Defense Forces officials believe Sinwar was the mastermind behind the attack that resulted in the death of more than 1,200 people and about 240 others taken hostage.

“I have not seen anyone in the Gaza Strip who supports Sinwar. Nobody likes Sinwar,” Mr. al-Mansi told his Israeli interrogators, according to the Times of Israel. “There are people who, day and night, pray that God will free us from him.”

Israeli security officials released a 14-minute video of the interrogation that was conducted Sunday. They did not release further details about Mr. al-Mansi‘s detention, the Times of Israel reported.

“People in the Gaza Strip say that Sinwar and his group destroyed us. We must get rid of them,” Mr. al-Mansi said.

• Mike Glenn can be reached at mglenn@washingtontimes.com."
