,Local Site,Title,Link,Content(RAW)
46,[New York] https://nypost.com/news/,"US OKs $106M emergency tank ammunition sale to Israel, sidestepping congressional review",https://nypost.com/2023/12/09/news/us-oks-106m-emergency-tank-ammunition-sale-to-israel/,"The Biden administration approved an “emergency sale” Saturday to send nearly 14,000 rounds of tank ammunition to Israel as it ramps up its invasion of the Gaza Strip.

The State Department approved the massive offloading — worth more than $106 million — in a move that allowed it to circumvent Congress.

“The United States is committed to the security of Israel, and it is vital to U.S. national interests to assist Israel to develop and maintain a strong and ready self-defense capability. This proposed sale is consistent with those objectives,” the department said in a statement.

“Israel will use the enhanced capability as a deterrent to regional threats and to strengthen its homeland defense,” it added.

For the price of $106.5 million, Israel will receive 13,981 120 mm High Explosive Anti-Tank Multi-Purpose with Tracer tank cartridges as well as US support, engineering and logistics, all of which will come from Army inventory.

Congress was notified of the sale late Friday after Secretary of State Antony Blinken determined an “emergency exists” in the Middle Eastern war that would affect US national security interests.

The urgency allowed Biden officials to sell the weaponry without the standard congressional review required for foreign military sales.

Although unusual, the emergency sale is not unprecedented. In 2019, then-Secretary of State Mike Pompeo similarly sold $8.1 billion worth of weapons to Saudi Arabia, the United Arab Emirates and Jordan after it became clear that the Trump administration would have trouble overcoming lawmakers’ concerns about the Saudi- UAE-led war in Yemen.

Secretary of State Antony Blinken determined an “emergency exists” in the Middle Eastern war that would affect US national security interests. AP

The sale comes days after the Biden administration pleaded for Congress to approve a nearly $106 billion aid package for Ukraine, Israel and other national security needs.

A hefty portion of the funding would go toward military and economic assistance in Ukraine, saying Kyiv’s war effort to defend itself from Russia’s invasion may grind to a halt without it.

The administration has faced a difficult reception on Capitol Hill, where there is growing skepticism about the magnitude of assistance for Ukraine and where even Republicans supportive of the funding are insisting on US-Mexico border policy changes to halt the flow of migrants as a condition for the assistance.

Smoke rises following an Israeli airstrike on Gaza’s al-Shuja’ia district on Dec. 9, 2023. ATEF SAFADI/EPA-EFE/Shutterstock

The GOP-controlled House has passed a $14.3 billion standalone assistance package for Israel.

More than 1,200 Israelis were killed when Hamas launched its surprise attack in southern Israel on Oct. 7, and 97 Israel Defense Force soldiers have been killed in the fighting since.

With the war entering its third month, the death toll in Gaza stands at more than 17,400, according to the Hamas-controlled Health Ministry in the Gaza Strip.

With Post wires"
47,[New York] https://nypost.com/news/,Ukraine border blockade persists as Polish truckers remain steadfast,https://nypost.com/2023/12/09/news/ukraine-border-blockade-persists-russia-vote-plan-criticized/,"A month-long blockade by Polish truck drivers at the Ukrainian border is delaying deliveries of battlefront necessities — and there is no end in sight for the dispute.

Truckers started blocking roads to border crossings on Nov. 6, creating lines stretching nearly 20 miles and lasting weeks in freezing temperatures, and hindering the transport of pickup trucks, tourniquets, night vision equipment, drone parts and other materials and medical supplies.

The Polish drivers are protesting competition from Ukrainian counterparts, who they say are undercutting their business amid relaxed European Union transport rules.

“This means that the Russian army will have the ability to kill Ukrainian soldiers and terrorize civilians for several weeks longer,” said Oleksandr Zadorozhnyi, operational director of the KOLO foundation, which assists the Ukrainian army with technology and is unable to get materials through.

Protestors deny holding up aid, according to reports, and the head of a truckers’ association in western Poland said there is no light at the end of the tunnel as authorities are paying little attention.

3 Polish protesters argue that their livelihoods are at stake after the European Union relaxed some transport rules and Ukrainian truckers undercut their business. AP

3 Rescuers work at the site of a Ukranian apartment building damaged by a Russian missile strike on Dec. 8. via REUTERS

3 Ukraine has doubled down on efforts to erase all traces of Soviet influence following Russia’s invasion nearly two years ago. SERGEY DOLZHENKO/EPA-EFE/Shutterstock

As the war wages on, Ukrainian authorities are also fighting plans for voting to take place in illegally annexed territories in the planned Russian election in March. The balloting could keep Russian President Vladimir Putin in power until at least 2030.

Ukraine’s Foreign Ministry is calling on the international community to impose sanctions on those involved with the election.

Separately, Ukraine continued its effort to eliminate Russian influence on the homefront with its campaign to remove Soviet-era monuments. A statue of a Soviet field commander of the Russian Civil War was removed Saturday as “decommunization” efforts have been revamped ahead of the war’s two-year mark.

With Post wires"
48,[New York] https://nypost.com/news/,"UPenn President Liz Magill, board of trustees chair Scott Bok resign after donor revolt over disastrous antisemitism testimony",https://nypost.com/2023/12/09/news/upenn-president-liz-magill-resigns-after-disastrous-antisemitism-testimony/,"University of Pennsylvania President Liz Magill – under increasing pressure from both donors and the White House after her disastrous testimony before Congress this week on the school’s failure to protect Jewish students – and Scott L. Bok, chairman of its board of trustees, “voluntarily” resigned their posts Saturday in a massive Ivy League shakeup, the school announced.

“I write to share that President Liz Magill has voluntarily tendered her resignation as President of the University of Pennsylvania,” Bok wrote in a surprise “University Notification” sent to staffers Saturday.

“She will remain a tenured faculty member at Penn Carey Law,” Bok continued.

“On behalf of the entire Penn community, I want to thank President Magill for her service to the University as President and wish her well.

“We will be in touch in the coming days to share plans for interim leadership of Penn. President Magill has agreed to stay on until an interim president is appointed.

“President Magill shared the following statement, which I include here: ‘It has been my privilege to serve as President of this remarkable institution. It has been an honor to work with our faculty, students, staff, alumni, and community members to advance Penn’s vital missions.’”

Bok’s separate resignation statement was obtained by the Daily Pennsylvanian, the school’s student newspaper.

“Working with [Magill] was one of the great pleasures of my life,” he wrote. “Worn down by months of relentless external attacks, she was not herself last Tuesday.”

4 UPenn President Liz Magill has resigned. Getty Images

4 UPenn board of trustees chair Scott Bok has also resigned. REUTERS

4 Magill resigned under immense donor and political pressure. Robert Miller

Magill’s sudden departure came four days after her Tuesday appearance before the House Education Committee, when she and the presidents of Harvard and MIT were grilled by Rep. Elise Stefanik (R-NY) – who asked each of them whether calling for the genocide of Jews is considered to be “bullying and harassment” under their colleges’ codes of conduct.

“It is a context-dependent decision, Congresswoman,” Magill responded – sparking outrage among donors and others.A source close to situation told The Post that the mood was sad Saturday as 27 Penn trustees met for two hours without Magill’s or Bok’s knowledge and decided to recommend that she consider resignation.

Bok announced his resignation on the spot during a call with trustees, the source said – without giving any warning to vice chairman Julie Platt before hanging up.

Platt will serve as acting chair, and the executive committee will present a “plan forward” on Sunday.

Larry Jameson, dean of Penn’s medical school, was mentioned by some trustees as a possible interim president.

4 The University announced the news in a letter to the Penn community.

Stefanik issued a blistering response as news of Magill’s resignation broke.“One down. Two to go,” the congresswoman posted on X.

“This is only the very beginning of addressing the pervasive rot of antisemitism that has destroyed the most ‘prestigious’ higher education institutions in America,” Stefanik – a Harvard graduate – wrote.

Stay on top of news out of the Israel-Hamas war and the global surge in antisemitism with The Post’s Israel War Update, delivered right to your inbox every Monday, Wednesday and Friday.

“These universities can anticipate a robust and comprehensive Congressional investigation of all facets of their institutions negligent perpetration of antisemitism including administrative, faculty, funding, and overall leadership and governance,” she promised."
49,[New York] https://nypost.com/news/,"25-year-old Israeli hostage killed in Gaza, body used in Hamas propaganda video",https://nypost.com/2023/12/09/news/engineering-student-sahar-baruch-held-hostage-by-hamas-is-dead/,"A 25-year-old Israeli hostage died after being held for nearly two months by Hamas terrorists in Gaza, according to reports Saturday.

The body of Sahar Baruch, an electrical engineering student kidnapped by Hamas on Oct. 7 from his kibbutz in southern Israel was featured in a Hamas propaganda video released Friday.

Hamas claimed that he was killed in an Israeli Defense Forces operation to free hostages.

The IDF denied the claims, and said Baruch had been murdered by Hamas.

On Saturday, Baruch’s death was confirmed by members of Kibbutz Be’eri, where he lived with his family, and the Hostages and Missing Families Forum.

“It is with great sadness and a broken heart that we announce the murder of Sahar Baruch (25), who was kidnapped from his home by Hamas terrorists to Gaza on the Black Sabbath and murdered there,” said the community in a statement.

3 Engineering student held hostage in Gaza has been confirmed dead. the Hostages and Missing Families Forum

The Ben Gurion University student’s family are demanding the return of his remains in any future hostage release deal, according to the Jerusalem Post.

Baruch, whose brother Idan was murdered by Hamas during the Oct. 7 massacre, was considered missing for weeks, until his family received the message that he was being held captive by Hamas.

“Sahar was at home with his brother Idan at his mother’s house,” said an aunt in an interview with Israeli media Saturday. “They woke up in the morning, like the rest of us, from alerts and the explosions.They entered and closed themselves in the mamad [protected space] but couldn’t close the door,” so they closed it with a closet” She continued.

3 Sahar Baruch, who was looking forward to his year at Ben Gurion University before he was kidnapped by Hamas, was confirmed dead Saturday. karenievers/X

3 Sahar Baruch’s brother, Idan, was killed Oct. 7 by Hamas terrorists when they overwhelmed their home in Kibbutz Be’eri. Baruch survived, but was taken captive by the terrorist group, who paraded his remains in a propaganda video Friday, announcing his death in Gaza. AP

“When the fire started, three grenades were thrown into the mamad – Idan was hit and Sahar treated him for hours.”

The brothers decided to jump from the home when it began to burn, the aunt continued. “In the beginning, Idan jumped and probably near that he was shot and killed. Sahar stayed behind for a few more minutes to bring him the inhaler because Idan was asthmatic. For more than two weeks we did not know what happened to him, and then some information was received that he was not in Israeli territory.”

Stay on top of news out of the Israel-Hamas war and the global surge in antisemitism with The Post’s Israel War Update, delivered right to your inbox every Monday, Wednesday and Friday.

Just before the Hamas attack, Baruch was looking forward to starting the school year, and was planning to look for a place to live in Be’er Sheva, a city in the Negev Desert."
50,[New York] https://nypost.com/news/,George Soros funneled more than $50M to Iran-sympathizer groups linked to Robert Malley,https://nypost.com/2023/12/09/news/iran-apologists-linked-to-robert-malley-got-50m-from-soros/,"Far-left billionaire George Soros has funneled more than $50 million to a network of Iran-sympathizer groups whose members have gained significant sway within the Biden White House — pushing to defang US sanctions on Tehran while advocating for a renewed nuclear deal.

A Post examination of Soros’ Open Society Foundations records shows the progressive kingmaker has given a staggering $46.7 million since 2016 to the International Crisis Group, a lefty think tank tied to an alleged Iranian plot to manipulate US policy.

Robert Malley, the former US special envoy to Iran now under FBI investigation for his alleged mishandling of classified material, was the ICG’s president until he joined the Biden administration in 2021.

“Soros has continually funded organizations that act as apologists for the Iranian regime – downplaying their severe human rights abuses while working to advance Iranian propaganda,” Gabriel Noronha of the Polaris National Security think tank told The Post.

Soros cash funded the ICG’s formation in 1994, and the billionaire was a trustee for years before handing the seat to his son and ideological heir Alexander Soros, 38, in 2018.

7 Far-left billionaire George Soros has pumped millions into pro-Iran influence groups that “weaken America,” critics say. AFP via Getty Images

7 Robert Malley, now under FBI investigation for alleged mishandling of government secrets while serving as Biden’s Iran envoy, scored millions in aid from Soros when he headed the International Crisis Group think tank. AFP via Getty Images

7 Ali Vaez, a Malley protege at ICG and a member of the Iran Experts Initiative, scored White House meetings with top Biden national security officials. Getty Images

Three of Malley’s proteges were part of the Iran Experts Initiative, a covert network of Iranian-American academics established by Iran’s Foreign Ministry in 2014, according to Semafor.

Over the last decade, IEI participants have worked their way into Washington’s foreign policy establishment — while subtly persuading US policymakers to ease sanctions on Tehran and accede to its nuclear ambitions.

“If you were a regime running a game plan of how to subvert the United States’ political system from within, this would be it to a tee,” Noronha said.

Malley hired IEI participant Ariane Tabatabai as his top aide when Biden tapped him to lead the US team charged with negotiating a new nuclear deal with Tehran. Tabatabai then switched to a high-level job at the Pentagon with a top security clearance, where she remains, drawing Republican ire.

Ali Vaez, another IEI member and currently the director of Iran projects at ICG, reportedly sent some of his writings to Iranian officials for pre-publication review. Vaez has scored five White House meetings with Biden’s top national security officials, visitor logs show.

Malley hired Dina Esfandiary, a third IEI member, as a senior ICG advisor. In 2021, she and Vaez co-authored an essay cheering the election of Iran’s hardline president Ebrahim Raisi as “a real opportunity to make progress on the nuclear talks.”

Malley’s 2021 appointment coincided with the administration’s turn from former president Donald Trump’s “maximum pressure” sanctions on Iranian oil exports. Biden’s lax enforcement has reportedly earned the mullahs an estimated $95 billion.

7 Iran’s hard-line president Ebrahim Raisi was praised by IEI members Ali Vaez and Dina Esfandiary. POOL/AFP via Getty Images

7 The Iranian regime displayed its Sejjil missiles in Tehran in 2017 — part of its developing nuclear weapons program. AP

In February 2023, Vaez scored two lengthy one-on-one meetings with Brett McGurk, Biden’s coordinator for the Middle East and North Africa, while McGurk was secretly negotiating with his Iranian counterpart to restart the nuclear talks.

Soon after, the administration made a controversial deal to release $6 billion of frozen Iranian funds in exchange for five American hostages.

Start your day with all you need to know Morning Report delivers the latest news, videos, photos and more. Enter your email address Please provide a valid email address. By clicking above you agree to the Terms of Use and Privacy Policy. Thanks for signing up!

Never miss a story. Check out more newsletters

Meanwhile, Malley’s son, Blaise Malley, 25, works for an Iran-sympathizing think tank, the Quincy Institute for Responsible Statecraft, that has also basked in Soros’ largesse — even though founder Trita Parsi was found by a US court to have been credibly accused of acting as “an advocate for the regime” through his nonprofit National Iranian American Council after he brought a defamation suit charging this was false.

Since 2019, Soros has given Quincy — which says it advocates “restraint” in US foreign policy — $1.8 million, plus $100,000 to Parsi’s NIAC.

“NIAC and Quincy are the Russia Today of the Iranian Regime,” Iranian dissident Masih Alinejad wrote in 2022.

Soros’s cash has also indirectly flowed to Iran apologists via lefty groups like the Ploughshares Fund and the Rockefeller Brothers Fund.

In 2021, for example, when OSF gave Ploughshares $300,000, Ploughshares in turn showered $225,000 — $75,000 each — on the ICG, NIAC Action, and the Quincy Institute.

This year, Ploughshares awarded Vaez a direct grant for an unspecified amount.

OSF and Soros have funneled more than $15 million since 2016 to groups behind recent pro-Hamas protests in the US, The Post has reported.

7 Trita Parsi’s Quincy Institute and the National Iranian American Council also received Soros grants. Getty Images

7 Alex Soros (left) and father George have pumped millions into Iran apologist groups, critics say. via REUTERS

“We value the donations we receive from across the political spectrum and have always been transparent about that support on our website,” said Jessica Rosenblum of the Quincy Institute.

“These groups are committed to promoting both international and regional peace and security,” said an OSF spokesperson. “None has ever worked on behalf of the government of the Islamic Republic.”

“I don’t know what either Soros’s vision is regarding Iran,” Noronha said. “But the things they routinely fund are things that weaken America, both internally and externally.”"
51,[New York] https://nypost.com/news/,"Redneck Christmas Parade brings cheer, charity to Louisiana town",https://nypost.com/2023/12/09/news/redneck-christmas-parade-brings-cheer-charity-to-louisiana-town/,"Christmas came early for the “rednecks” in this Louisiana town.

The 17th annual Bawcomville Redneck Christmas Parade was held on Dec. 2 in the small town of 2,700 residents in West Monroe, Louisiana.

“This is part of our town — I don’t think there’s very many rules,” parade participant Zach Raybourn told CNN.

Floats that participated in the holiday revelry were decorated in redneck themes and included one with a man sitting on a toilet bowl and others filled with empty beer cans.

Some displayed signs with ‘country’ sayings like “Kiss ur cuzin” and “Crack is wak” scrawled upon them.

A tractor, trash truck, and multiple pickup trucks were also part of the festivities.

“We have Leroy the Redneck Reindeer,” reveler Bryan Baker told the outlet, gesturing to a stuffed deer head with a red nose on his float. “You can’t get anymore redneck than that.”

5 All proceeds from the event benefit local children during the Christmas season, according to the parade’s Facebook page. Tina Owens

Baker went on to explain how to define rednecks. “We’d rather be out in the woods, be out in the country — sit back on the porch, bonfire, cold beer,” he said.

Those who march toss items like toothbrushes, ramen noodles, beads, toilet paper, and candy into the crowd of spectators.

Shane Wooten, a local realtor, dressed as the Grinch and brought hundreds of packages of ramen noodles to throw from a La-Z-Boy he fastened to a motorized scooter.

The noodles are a nod to a joke about rednecks, that claims they eat dry noodles since they are cheaper than chips.

5 The Bawcomville Redneck Christmas Parade had floats decorated with redneck themes. Tina Owens

5 Local realtor Shane Wooten donned a Grinch costume and rode on a La-Z-Boy chair. Tina Owens

“It’s just not your typical Christmas parade. It’s something to laugh about,” Wooten told the outlet.

All proceeds from the event benefit local children during the Christmas season, according to the parade’s Facebook page.

“We have over 100 children and their families that we are trying to provide Christmas for this year! Everything stays right here in this community and truly does make a difference,” the post explained.

“I understand that most of us don’t have to worry about where our next meal will come from or where our children’s happiness will come from on Christmas morning, but that is not the case for a lot of families in our area.”

5 A tractor, trash truck, and multiple pickup trucks were also part of the festivities. CNN

More than 30% of residents in Bawcomville, which is close to 200 miles from Louisiana’s capital, Baton Rogue, live below the poverty line.

This is apparent on the parade route, which is lined with RVs and tents, where some residents live, abandoned stores, a pawn shop, and a few Dollar General stores.

Nonprofit workers Debi Mayo and Rachel Holmes from Bawcomville Hope, which provides hot meals to those in need there, were at the parade doing outreach.

5 “This is part of our town,” said parade participant Zach Raybourn. CNN

“People don’t realize this is kind of like a Third World country,” Holmes told the outlet. There were many homeless people in the area, living in abandoned mobile homes.“

“And in the woods,” Mayo added. “Makeshift tents. It’s a terrible situation we’re in. Even people with jobs are suffering because of the high price of the economy.”"
52,[New York] https://nypost.com/news/,Pro-Palestinian demonstrators protest near star-studded LA Biden fundraiser,https://nypost.com/2023/12/09/news/pro-palestine-demonstrators-protest-los-angeles-biden-fundraiser/,"A mob of pro-Palestinian demonstrators took to the streets near a star-studded Los Angeles fundraiser for President Biden, demanding the US cut aide to its closest ally in the region and chanting, “Come November we’ll remember.”

The Friday fundraiser was held at the stately home of former U.S. ambassador to Spain James Costos and designer Michael Smith, whose guests were a who’s who of Democratic power players in the state, including Steven Spielberg, Gov. Gavin Newsom, Los Angeles Mayor Karen Bass and former House Speaker Nancy Pelosi.

At nearby Holmby Park, where roughly 1,200-1,500 protesters chanted and jeered, parroting Hamas propaganda that Israel was committing “genocide” against Palestinians and denounced the Israel Defense Forces and the Los Angeles Police Department, the Los Angeles Times reported.

Some carried giant likenesses of Biden with devil horns, and signs which read “End all U.S. aid to Israel,” “America, don’t let your tax $ fund killing babies.”

President Biden was in Los Angeles for the fundraiser. AP

Police ultimately declared the event an unlawful assembly and cleared the protesters from the park.

Some cops later reported being hit with eggs and bottled water by the unruly crowd.

No arrests were reported.

Biden addressed his well-heeled audience for just 11 minutes.

Protesters accused Israel of committing “genocide” against Palestinians. ABC7

He did not discuss Gaza and instead talked about his potentially looming rematch with former President Trump.

“Literally, I believe, the future of American democracy is at stake,” Biden said, CBSNews reported. “The greatest threat Trump poses is to our democracy, because if we lost that, we lose everything. We will be one of those generations that can say, ‘We saved democracy.'”

A second fundraiser is scheduled for Biden in Los Angeles Saturday evening and he is expected to return to Washington D.C. on Sunday."
