,Title,Link,Content(RAW)
27,"Đà Nẵng 2023, một năm nhìn lại - Kỳ 1: Kinh tế tiếp tục phục hồi, …",https://www.danang.gov.vn/vi/web/guest//chinh-quyen/chi-tiet?id=56723&_c=3,"Quy mô nền kinh tế tăng thêm gần 10 ngàn tỷ so với năm 2022

Tình hình kinh tế - xã hội thành phố Đà Nẵng 2023 tiếp tục phục hồi, duy trì và tăng nhẹ trên nền tăng trưởng bức phá của năm 2022 (13,2%). Tổng sản phẩm xã hội trên địa bàn (GRDP) ước tăng 2,58% so với năm 2022, quy mô nền kinh tế thành phố năm 2023 (giá hiện hành) ước đạt hơn 134.000 tỷ đồng, quy mô tăng thêm gần 10.000 tỷ đồng so với năm 2022. Giá trị gia tăng khu vực dịch vụ ước tăng 4,1%; khu vực công nghiệp - xây dựng ước giảm 2,05%; khu vực nông - lâm nghiệp - thủy sản ước tăng 1,19%.

Thu ngân sách nhà nước năm 2023 ước đạt 20.598 tỷ đồng, bằng 87,8% dự toán HĐND thành phố giao và bằng 85,6% so với cùng kỳ năm 2022, Tổng chi ngân sách địa phương năm 2023 ước đạt 17.088 tỷ đồng, bằng 100,4% dự toán HĐND thành phố giao.



Lễ hội pháo hoa quốc tế Đà Nẵng 2023 đã thu hút hơn 942 ngàn lượt khách qua hơn một tháng tổ chức, tăng 29% so với dịp lễ hội pháo hoa năm 2019

Khu vực dịch vụ tiếp tục là điểm sáng, đóng góp tích cực vào tăng trưởng kinh tế chung của thành phố.

Đà Nẵng đã triển khai các giải pháp khôi phục phát triển thị trường khách du lịch quốc tế. Đến nay đã khôi phục được 19 đường bay quốc tế thường kỳ, 15 đường bay quốc tế thuê chuyến và 8 đường bay nội địa, đón 18 chuyến tàu biển với hơn 11.000 lượt khách.

Nhiều sự kiện quy mô quốc gia, quốc tế được tổ chức thành công. Đặc biệt, Lễ hội pháo hoa quốc tế Đà Nẵng 2023 thu hút hơn 942 ngàn lượt khách, tăng 29% so với lễ hội pháo hoa năm 2019. Tổng doanh thu dịch vụ lưu trú, lữ hành năm 2023 ước đạt 10,3 nghìn tỷ đồng, tăng 1,14 lần so với năm 2019.

Tổng doanh thu ngành thông tin và truyền thông năm 2023 ước đạt 17.598 tỷ đồng, tăng 8,1% so với năm 2022; kim ngạch xuất khẩu phần mềm ước đạt 147,8 triệu USD, tăng 12%. Hệ sinh thái khởi nghiệp đổi mới sáng tạo của thành phố đã hình thành và từng bước phát triển.

Về thu hút đầu tư, Đà Nẵng thực hiện cấp mới và điều chỉnh cho 40 dự án trong nước với tổng vốn đầu tư đăng ký là 46.698,5 tỷ đồng (cùng kỳ năm 2022 là 11.722,9 tỷ đồng), gấp hơn 4 lần về số vốn so với cùng kỳ và 181,006 triệu USD vốn đầu tư FDI (cùng kỳ 2022 thu hút 133,4 triệu USD).

Ước cả năm 2023, tổng vốn đầu tư trong nước đạt khoảng hơn 60.000 tỷ đồng, thu hút FDI đạt hơn 200 triệu USD. Trong đó, thành phố đã tích cực tháo gỡ vướng mắc cho các dự án đầu tư cũ với tổng số vốn tăng thêm trên 47.500 tỷ đồng. Dự kiến đến cuối năm tiếp tục tháo gỡ cho các dự án, tổng vốn đầu tư dự kiến tăng thêm khoảng 13.000 tỷ đồng.



Lãnh đạo Chính phủ và lãnh đạo thành phố trao Giấy chứng nhận đăng ký đầu tư, Quyết định chấp thuận chủ trương đầu tư cho các dự án tại Lễ công bố Quy hoạch thành phố Đà Nẵng thời kỳ 2021 - 2030, tầm nhìn đến năm 2050

Các công trình trọng điểm được tập trung chỉ đạo; đến cuối năm 2023, có 30/38 dự án hoàn thành, đưa vào sử dụng, 19/27 dự án khởi công mới theo cam kết, phấn đấu đến 31/01/2024, giải ngân 95% kế hoạch vốn đầu tư công.

Trong bức tranh tổng thể về kinh tế Đà Nẵng năm 2023, chúng ta cũng cần thẳng thắn nhìn nhận rằng vẫn còn nhiều tồn tại, hạn chế. Tăng trưởng kinh tế, sản xuất, kinh doanh gặp nhiều khó khăn do ảnh hưởng lớn của tình hình kinh tế thế giới, nhiều đơn hàng sản xuất bị cắt giảm dẫn tới tình trạng thu hẹp quy mô trong hoạt động công nghiệp chế biến chế tạo. Hoạt động xuất, nhập khẩu đối mặt với nhiều khó khăn, thách thức do suy giảm nhu cầu ở các thị trường quốc tế, một số chuỗi cung ứng bị gián đoạn, áp lực cạnh tranh từ các nước khu vực, Châu Á tăng.

Liên quan đến GRDP năm 2023 của Đà Nẵng, có một số chỉ số sụt giảm, như chỉ số khu vực công nghiệp - xây dựng ước giảm 2,05%, đã ảnh hưởng khá lớn đến mức tăng GRDP. Dù thành phố đã có những chính sách hỗ trợ, thu hút đầu tư, phát triển công nghiệp hỗ trợ, nhưng điều này không thể khắc phục ngay lập tức, đòi hỏi sự nỗ lực, đầu tư của doanh nghiệp và nhiều yếu tố khác có liên quan.

Thu ngân sách nhà nước năm 2023 không đạt kế hoạch chủ yếu do chịu ảnh hướng lớn từ những biến động phức tạp của tình hình kinh tế thế giới năm 2023. Cùng với đó, việc tiếp tục thực hiện các chính sách miễn, giảm, gia hạn thuế, phí của Trung ương để hỗ trợ người dân và doanh nghiệp phục hồi sản xuất kinh doanh đã tác động làm giảm thu nội địa cả năm 2023, ước giảm thu khoản 2.025 tỷ đồng.

Mặt khác, việc giải quyết, khắc phục các kết luận thanh tra, điều tra, bản án đến nay vẫn chưa đạt được như mong muốn. Nhiều dự án phải tạm dừng, gây lãng phí, ảnh hưởng không nhỏ đến hiệu quả lãnh đạo, chỉ đạo thực hiện nhiệm vụ phát triển kinh tế - xã hội và môi trường, tâm lý nhà đầu tư, ảnh hưởng khá nhiều đến tốc độ tăng trưởng kinh tế của thành phố trong năm 2023.

Năm 2023, mặc dù GRDP sụt giảm khá nhiều so với năm 2022, nhưng quy mô nền kinh tế Đà Nẵng ước đạt hơn 134.000 tỷ đồng, tăng gần 10 ngàn tỷ so với năm 2022 và cao hơn cùng kỳ năm 2019 gần 24 ngàn tỷ- trước thời điểm xảy ra đại dịch COVID-19.

Nhìn vào chỉ số tăng trưởng GRDP của các địa phương trên cả nước, có thể thấy rằng, có một số địa phương tuy chỉ số GRDP năm 2023 tăng rất cao nhưng quy mô nền kinh tế thấp hơn Đà Nẵng, GRDP năm 2023 của một số địa phương tăng trưởng âm nhưng quy mô nền kinh tế xấp xĩ, thậm chí cao hơn Đà Nẵng. Do vậy, đánh giá mức độ phát triển nền kinh tế của một tỉnh/thành chủ yếu dựa vào hai yếu tố là tăng trưởng GRDP và quy mô nền kinh tế địa phương.

Nhìn chung, kinh tế thành phố có sự phục hồi và thích ứng, gia tăng sức chống chịu trước các tác động bên ngoài. Sau đại dịch COVID-19, Đà Nẵng được ghi nhận là một trong số các địa phương có mức độ phục hồi kinh tế khá nhanh. Đến cuối năm 2022, một số ngành, lĩnh vực kinh tế thành phố cơ bản được khôi phục như tại thời điểm khi bắt đầu triển khai Nghị quyết 43-NQ/TW của Bộ Chính trị, tăng trưởng kinh tế có sự khởi sắc và bứt phá đạt 13,2% vào cuối năm 2022 trước khi chậm lại trong năm 2023 theo đà suy giảm chung của cả nước và thế giới.

Tính chung trong giai đoạn 2019-2023, GRDP thành phố ước tăng bình quân 3,48%/năm, trong đó giai đoạn 2021 - 2023 ước tăng bình quân 6,33%/năm, cao hơn mức bình quân cả nước. Đây là mức tăng khá trong bối cảnh thành phố vẫn còn nhiều khó khăn, thách thức chưa được tháo gỡ, xử lý triệt để.

Mở ra những cơ hội phát triển

Quy hoạch thành phố thời kỳ 2021-2030, tầm nhìn đến năm 2050 được Thủ tướng Chính phủ phê duyệt và công bố vào cuối tháng 11 vừa qua là cơ sở pháp lý quan trọng, vừa mở ra những cơ hội, không gian phát triển mới cho thành phố Đà Nẵng.

“Quy hoạch thành phố Đà Nẵng thời kỳ 2021 - 2030, tầm nhìn đến năm 2050 được Thủ tướng Chính phủ phê duyệt tại thời điểm này càng có ý nghĩa quan trọng để thành phố xây dựng kịch bản tăng trưởng phù hợp, xác định các chỉ tiêu, giải pháp trọng tâm để triển khai hiệu quả trong thời gian đến trên cơ sở khai thác tối đa mọi nguồn lực nội tại của địa phương, thu hút mạnh mẽ các nguồn lực bên ngoài, tạo động lực tăng trưởng mạnh mẽ hơn, bứt phá hơn để thành phố hoàn thành các mục tiêu phát triển kinh tế - xã hội trong giai đoạn mới”, Chủ tịch UBND thành phố Lê Trung Chinh bày tỏ.



Phó Thủ tướng Trần Hồng Hà và Bộ trưởng Bộ Kế hoạch và Đầu tư Nguyễn Chí Dũng trao quyết định của Thủ tướng Chính phủ về phê duyệt Quy hoạch thành phố Đà Nẵng thời kỳ 2021 - 2030, tầm nhìn đến năm 2050 cho lãnh đạo thành phố

Trong phương hướng phát triển các ngành, Quy hoạch đặt ra những vấn đề mang tầm nhìn quốc gia như: xây dựng Đà Nẵng trở thành trung tâm tài chính khu vực, xây dựng Đà Nẵng trở thành một trong những trung tâm công nghiệp công nghệ cao, công nghiệp hỗ trợ của cả nước với trọng tâm công nghệ vi điện tử, công nghệ chip và vi mạch bán dẫn... trở thành ngành công nghiệp chủ đạo.

Những bước đi mạnh mẽ, tăng tốc để kịp “chuyến tàu” tham gia chuỗi cung ứng vi mạch bán dẫn được Đà Nẵng triển khai để hướng đến mục tiêu đưa Đà Nẵng trở thành điểm đến đầu tư đầy hấp dẫn trong lĩnh vực vi mạch, bán dẫn tại Việt Nam.

Một hội thảo về nguồn nhân lực phục vụ ngành bán dẫn được Đà Nẵng tổ chức với sự tham gia của các doanh nhân, đại diện các trường đại học để đưa ra các ý kiến, đề xuất, gợi mở có tính định hướng quan trọng để thành phố triển khai các biện pháp, giải pháp cụ thể để phát triển nguồn nhân lực phục vụ ngành công nghiệp vi mạch bán dẫn. Giữa tháng 11 vừa qua, đoàn công tác của thành phố Đà Nẵng do Ủy viên Trung ương Đảng, Bí thư Thành ủy Đà Nẵng Nguyễn Văn Quảng làm Trưởng đoàn đã có những buổi tiếp xúc, làm việc với các Công ty, Tập đoàn hàng đầu của Hoa Kỳ trong lĩnh vực vi mạch, bán dẫn.

Tại Hoa Kỳ, UBND thành phố Đà Nẵng cùng với Công ty Synopsys trao bản ghi nhớ thể hiện cam kết chung, tạo cơ sở hợp tác chính thức, hỗ trợ thành phố phát triển nguồn nhân lực vi mạch ngành bán dẫn và mở rộng hợp tác ngành bán dẫn trong thời gian đến. Đây cũng là bước khởi đầu cho việc triển khai những chương trình, kế hoạch hợp tác sâu rộng, toàn diện, có hiệu quả.

Cùng với đó, lãnh đạo thành phố Đà Nẵng có các buổi gặp gỡ, làm việc với các công ty, tập đoàn hàng đầu trên lĩnh vực vi mạch bán dẫn như Qorvo, Marvell, Nvidia, tập đoàn Intel.



Trao Bản ghi nhớ hợp tác giữa UBND thành phố Đà Nẵng và Công ty Synopsys

Cũng trong khuôn khổ chuyến công tác, Đà Nẵng tổ chức hội thảo xúc tiến đầu tư với sự tham gia của các doanh nghiệp hoạt động trong lĩnh vực bán dẫn, ký kết ghi nhớ hợp tác xúc tiến, thu hút đầu tư từ Hoa Kỳ vào thành phố Đà Nẵng và hỗ trợ các doanh nghiệp Đà Nẵng tham gia vào chuỗi cung ứng giữa Ban Xúc tiến và hỗ trợ đầu tư với Công ty ITSJ-G - một doanh nghiệp của Hoa Kỳ hoạt động trong lĩnh vực thiết kế và sản xuất các linh kiện điện, điện tử, có nhiều năm kinh nghiệm tham gia trong chuỗi cung ứng công nghiệp bán dẫn.

Ngoài ra, thành phố Đà Nẵng đang khẩn trương làm việc, phối hợp chặt chẽ với các bộ, ngành Trung ương để sớm hoàn chỉnh, triển khai Đề án xây dựng khu phi thuế quan, Đề án trung tâm tài chính khu vực và quốc tế tại Việt Nam ...

Năm 2023 dần khép lại, với những quyết sách từ Trung ương, cùng với phát huy sức mạnh nội tại, Đà Nẵng sẽ tăng tốc hơn nữa để hiện thực hóa tầm nhìn quốc gia, mở ra thêm những hướng đi mới, cơ hội mới trong xây dựng và phát triển Đà Nẵng với một khát vọng phát triển mãnh liệt, vì cuộc sống hạnh phúc hơn của mỗi người dân.

HOÀNG PHAN"
