,Title,Link,Content(RAW)
0,DỰ KIẾN CHƯƠNG TRÌNH PHIÊN HỌP THỨ 28 CỦA UỶ BAN …,https://quochoi.vn/tintuc/Pages/tin-hoat-dong-cua-quoc-hoi.aspx?ItemID=83061,"DỰ KIẾN CHƯƠNG TRÌNH PHIÊN HỌP THỨ 28 CỦA UỶ BAN THƯỜNG VỤ QUỐC HỘI

Theo dự kiến, Phiên họp thứ 28 (tháng 12/2023) của Ủy ban Thường vụ Quốc hội sẽ diễn ra trong 3 ngày: 13 - 14 và 18/12/2023 tại Nhà Quốc hội. Chủ tịch Quốc hội Vương Đình Huệ tham dự, phát biểu khai mạc và cùng các Phó Chủ tịch Quốc hội thay phiên điều hành nội dung Phiên họp.

Trọng Quỳnh"
1,CHỦ NHIỆM UỶ BAN ĐỐI NGOẠI VŨ HẢI HÀ: MỞ RA CÁC …,https://quochoi.vn/tintuc/Pages/tin-hoat-dong-cua-quoc-hoi.aspx?ItemID=83060,"GÓC NHÌN: THÚC ĐẨY QUAN HỆ ĐỐI TÁC CHIẾN LƯỢC TĂNG CƯỜNG VIỆT NAM - THÁI LAN

Hội nghị cấp cao Quốc hội ba nước Campuchia - Lào - Việt Nam (CLV) lần thứ nhất. Ảnh: Doãn Tấn

Hội nghị cấp cao Quốc hội 3 nước CLV có ý nghĩa hết sức quan trọng trong thúc đẩy tình đoàn kết, hữu nghị và thúc đẩy hợp tác, phát triển giữa 3 nước, đặc biệt là kết nối 3 nền kinh tế Campuchia, Lào và Việt Nam; hoàn thiện cơ chế đầy đủ về hợp tác CLV trên cả 3 kênh Đảng, Quốc hội và Chính phủ nhằm thúc đẩy thực hiện các định hướng đã được người đứng đầu 3 đảng thống nhất và các cam kết mà 3 Thủ tướng Chính phủ đã đưa ra trong những cuộc họp trước đây.

Tại Hội nghị, Đoàn đại biểu Quốc hội 3 nước đã tập trung thảo luận các biện pháp nhằm thúc đẩy quan hệ chính trị đối ngoại giữa 3 nước ngày càng gắn bó chặt chẽ; hợp tác trong lĩnh vực quốc phòng, an ninh bảo đảm xây dựng hòa bình, ổn định, xây dựng biên giới hòa bình, hợp tác, phát triển, phòng, chống tội phạm xuyên quốc gia và tội phạm về môi trường, bảo đảm an ninh quốc gia cho mỗi nước...

Về kinh tế - xã hội, văn hóa, Hội nghị đã đề cập một cách toàn diện về kết nối nền kinh tế ba nước, tạo ra bước đột phá mới trong hợp tác kinh tế ba nước, đặc biệt là đối với những lĩnh vực mới như tăng trưởng xanh, năng lượng tái tạo, chuyển đổi số... Với những lĩnh vực mà Việt Nam có kinh nghiệm hơn, Đoàn đại biểu Quốc hội hai nước cũng mong muốn chúng ta tiếp tục chia sẻ kinh nghiệm về xây dựng chính sách, hoàn thiện thể chế để tăng cường hợp tác giữa ba nước.

Các lĩnh vực văn hóa, giáo dục và du lịch cũng được đề cập một cách sâu rộng, đặc biệt là các chương trình hợp tác du lịch như “ba quốc gia, một điểm đến” để cùng nhau khai thác tiềm năng du lịch của khu vực Tam giác phát triển cũng như của ba nước. Giao lưu văn hóa và giao lưu nhân dân cũng được Đoàn đại biểu Quốc hội 3 nước đề cập bởi khi chúng ta có sự hiểu biết lẫn nhau giữa các dân tộc, giữa người dân vùng biên giới 3 nước thì sẽ đóng góp vào sự phát triển của mỗi nước.



Chủ tịch Quốc hội Vương Đình Huệ ký Tuyên bố chung. Ảnh: Doãn Tấn

Hợp tác giáo dục, y tế cũng là một chủ đề rất được quan tâm, đặc biệt, phía Bạn cảm ơn Việt Nam trong suốt thời gian qua đã hỗ trợ cư dân vùng biên giới của hai nước được chăm sóc y tế ở Việt Nam và được hưởng chăm sóc y tế như người Việt Nam. Bạn cũng mong muốn có trung tâm y tế với công nghệ hiện đại để chăm sóc y tế chất lượng cao ở khu vực biên giới 3 nước.

Đoàn đại biểu Quốc hội 3 nước cũng bàn thảo nội dung hợp tác về năng lượng, kết nối hạ tầng cứng và hạ tầng mềm, Lào và Campuchia mong muốn kết nối vào hệ thống cao tốc và cảng biển của Việt Nam để thúc đẩy hợp tác kinh tế, các dịch vụ logistic để tăng cường xuất khẩu hàng hóa, chế biến nông sản, tăng cường xuất khẩu... nhất là trong điều kiện kinh tế toàn cầu khó khăn như hiện nay.

Với Tuyên bố chung Hội nghị đã được 3 Chủ tịch Quốc hội thông qua, chúng ta có cơ sở pháp lý để các Quốc hội, các cơ quan của Quốc hội 3 nước cùng nhau hợp tác, góp phần thúc đẩy quan hệ hợp tác chiến lược giữa ba nước CLV anh em. Việc triển khai thực hiện Tuyên bố chung Hội nghị là trách nhiệm của Quốc hội mỗi nước cũng như trách nhiệm của các cơ quan của Quốc hội, các bộ, ngành liên quan. Trong đó, các cơ quan của Quốc hội mỗi nước phải chủ động triển khai các cam kết tại Tuyên bố chung. Đặc biệt, Tuyên bố chung đã đề cập đến một cơ chế hợp tác mới là Nhóm nghị sĩ các nước CLV ở khu vực Tam giác phát triển. Việc thành lập được Nhóm Nghị sĩ này sẽ có vai trò rất quan trọng trong việc giám sát, rà soát, thúc đẩy việc thực hiện các cam kết của cả 3 bên liên quan đến khu vực Tam giác phát triển. Tôi tin rằng, các cam kết đã được nêu trong Tuyên bố Hội nghị sẽ được triển khai một cách rất tích cực trong thời gian tới.

Thành công của Hội nghị cấp cao Quốc hội 3 nước CLV có vai trò rất quan trọng của sự chuẩn bị tích cực, chỉ đạo từ sớm, từ xa của Quốc hội ba nước. Về phía Quốc hội Việt Nam, dưới sự chỉ đạo của Lãnh đạo Quốc hội, trực tiếp là Chủ tịch Quốc hội Vương Đình Huệ, chúng ta đã tích cực chuẩn bị cho Hội nghị ngay từ đầu năm. Các nội dung thảo luận, đóng góp của Đoàn Quốc hội Việt Nam tại Hội nghị đều đã được xây dựng trên cơ sở đề xuất của các bộ, ngành, các cơ quan liên quan, các Ủy ban của Quốc hội. Chúng tôi cũng chủ động phối hợp với phía Lào và Campuchia xây dựng dự thảo Tuyên bố chung. Những vấn đề hợp tác ba nước đều được đề cập trong Tuyên bố chung rất đầy đủ, toàn diện và các biện pháp cụ thể để Quốc hội các nước có thể triển khai một cách sâu rộng để thúc đẩy hợp tác ba bên.



Chủ tịch Quốc hội Vương Đình Huệ hội kiến Nhà Vua Thái Lan Maha Vajiralongkorn

Đối với chuyến thăm chính thức Thái Lan của Chủ tịch Quốc hội Vương Đình Huệ, đây là chuyến thăm đầu tiên của Lãnh đạo Đảng và Nhà nước ta sau khi bạn bầu cử thành công và có Quốc hội, Chính phủ mới. Chính giới Thái Lan rất quan tâm thúc đẩy quan hệ Đối tác chiến lược tăng cường giữa Việt Nam và Thái Lan, hướng tới nâng cấp quan hệ trong thời gian tới. Chuyến thăm đã thành công hết sức tốt đẹp. Phía bạn đánh giá rất cao chuyến thăm. Dư luận Thái Lan đưa tin đậm nét về chuyến thăm. Hai bên đã trao đổi rất sâu rộng về quan hệ hai nước trên các lĩnh vực về chính trị, đối ngoại, về kinh tế, thương mại, đầu tư cũng như hợp tác quốc phòng, an ninh, giao lưu nhân dân. Đặc biệt trong chuyến thăm này, đây cũng là lần đầu tiên Nhà vua Thái Lan tiếp một Chủ tịch Quốc hội nước ngoài, là ngoại lệ hết sức đặc biệt, thể hiện tình cảm, mối quan hệ gắn bó giữa hai nước.

Thái Lan là nước đầu tiên trong ASEAN mà Việt Nam thiết lập quan hệ Đối tác chiến lược. Sau 10 năm là Đối tác chiến lược, hợp tác giữa hai nước đã phát triển sâu rộng trên tất cả các lĩnh vực và còn rất nhiều tiềm năng. Do vậy, Việt Nam và Thái Lan đều mong muốn nâng cấp quan hệ lên Đối tác chiến lược toàn diện, là mức cao nhất trong quan hệ của Việt Nam với các nước. Nội hàm của quan hệ Đối tác chiến lược toàn diện giữa Việt Nam và Thái Lan cũng sẽ bàn trong thời gian tới. Tôi cho rằng, đây là một cơ hội rất tốt để chúng ta thúc đẩy quan hệ hai nước.



Chủ tịch Quốc hội Vương Đình Huệ chứng kiến Lễ ra mắt Phòng Thương mại Việt Nam - Thái Lan tại Thái Lan (VTCC)

Tại Bangkok, Chủ tịch Quốc hội đã chứng kiến Lễ ra mắt Phòng Thương mại Việt Nam - Thái Lan tại Thái Lan, đây là mô hình mà cộng đồng doanh nghiệp cũng mong muốn tới đây sẽ mở rộng thêm ở các quốc gia khác nhằm thúc đẩy quan hệ kinh tế, thương mại, đầu tư giữa Việt Nam và các nước. Chủ tịch Quốc hội cũng dự khai trương “Phố Việt Nam” đầu tiên trên thế giới được chính quyền một nước sở tại cùng với cộng đồng người Việt xây dựng tại Utdon Thani. Chủ tịch Quốc hội cũng đã tới thăm Trung tâm “Việt Nam học” - có lẽ cũng là Trung tâm đầu tiên về Việt Nam được thành lập một Đại học ở nước ngoài.

Cùng với các hoạt động về chính trị, đối ngoại, các cuộc làm việc với phía đối tác thì cuộc gặp gỡ với cộng đồng người Việt Nam toàn Thái Lan diễn ra ở Udon Thani cũng hết sức có ý nghĩa. Cộng đồng người Việt Nam ở Thái Lan đã sinh sống ở đây lâu đời và được chính quyền sở tại hết sức ủng hộ, có cuộc sống rất ổn định, hòa nhập tốt với cộng đồng và xã hội Thái Lan. Đây là nhân tố rất thuận lợi để thúc đẩy quan hệ hai nước trong thời gian tới. Các hoạt động của Chủ tịch Quốc hội với cộng đồng kiều bào ta tại Thái Lan đã góp phần thực hiện Kết luận của Bộ Chính trị về công tác người Việt Nam ở nước ngoài."
2,"TỔNG THƯ KÝ, CHỦ NHIỆM VĂN PHÒNG QUỐC HỘI BÙI VĂN …",https://quochoi.vn/tintuc/Pages/tin-hoat-dong-cua-quoc-hoi.aspx?ItemID=83059,"GÓC NHÌN: TĂNG CƯỜNG, CỦNG CỐ QUAN HỆ HỮU NGHỊ, ĐOÀN KẾT CHẶT CHẼ, HỢP TÁC TOÀN DIỆN

GÓC NHÌN: THÚC ĐẨY QUAN HỆ ĐỐI TÁC CHIẾN LƯỢC TĂNG CƯỜNG VIỆT NAM - THÁI LAN

Hội nghị cấp cao Quốc hội 3 nước Campuchia - Lào - Việt Nam lần đầu tiên được tổ chức. Việc hình thành cơ chế này có sự đóng góp quan trọng của Chủ tịch Quốc hội Vương Đình Huệ bởi từ thực tiễn hợp tác nghị viện 3 nước, Chủ tịch Quốc hội Vương Đình Huệ đã chủ động đề xuất với Chủ tịch Quốc hội Lào, Chủ tịch Quốc hội Campuchia về việc tổ chức Hội nghị cấp cao Quốc hội 3 nước để đồng bộ với các cơ chế hợp tác cấp cao 3 nước. Như Chủ tịch Quốc hội cũng đã nhiều lần nhấn mạnh tại Hội nghị vừa qua, Hội nghị đánh dấu sự hoàn thiện “ba đỉnh tam giác” của cơ chế hợp tác cấp cao CLV là Người đứng đầu ba Đảng, Thủ tướng ba nước và giờ là Chủ tịch ba Quốc hội, tạo thành “kiềng ba chân”: Chủ trương, đường lối của Đảng; thể chế hóa, xây dựng khung khổ pháp lý và giám sát của Quốc hội; thực thi của Chính phủ để 3 nước CLV ngày càng hợp tác chặt chẽ hơn.



Chủ tịch Quốc hội Vương Đình Huệ, Chủ tịch Quốc hội Lào Saysomphone Phomvihane và Chủ tịch Quốc hội Vương quốc Campuchia Samdech Khuon Sudary. Ảnh: Doãn Tấn

Tuyên bố chung Hội nghị được Chủ tịch Quốc hội Vương Đình Huệ, Chủ tịch Quốc hội Campuchia và Chủ tịch Quốc hội Lào thông qua có ý nghĩa hết sức quan trọng. Trên cơ sở đó, tới đây, Quốc hội 3 nước sẽ triển khai một loạt hoạt động hợp tác trên các lĩnh vực lập pháp, giám sát tối cao, quyết định các vấn đề quan trọng quốc gia, nhất là trao đổi kinh nghiệm về xây dựng, hoàn thiện thể chế và đẩy mạnh công tác giám sát việc thực thi để đánh giá xem việc đó được triển khai đến đâu, kết quả thế nào. Trong rất nhiều nội dung hợp tác thì nội dung về giám sát có ý nghĩa rất quan trọng để bảo đảm các hoạt động hợp tác 3 nước thực chất, hiệu quả, góp phần xây dựng phồn vinh, thịnh vượng cho cả 3 nước trên bán đảo Đông Dương.

Trong các cuộc hội đàm, hội kiến với Lãnh đạo Đảng, Nhà nước Lào, Chủ tịch Quốc hội luôn nhấn mạnh vấn đề hợp tác kinh tế ngày càng thực chất hơn, đột phá hơn giữa hai nước. Chủ tịch Quốc hội cũng đã gặp mặt cộng đồng doanh nghiệp Việt Nam tại Lào, kêu gọi các doanh nghiệp tăng cường hợp tác với Lào, vừa đóng góp cho sự phát triển của Lào, đồng thời cũng giúp doanh nghiệp có thêm dư địa hợp tác, phát triển trong khu vực. Trong khuôn khổ Hội nghị CLV, hợp tác kinh tế cũng được Quốc hội 3 nước tập trung bàn thảo. Tôi tin rằng, sau Hội nghị này, cùng với sự lãnh đạo của 3 đảng, sự hợp tác chặt chẽ của 3 Chính phủ và hợp tác của 3 Quốc hội thì hợp tác kinh tế 3 nước sẽ ngày càng được thúc đẩy, đánh dấu sự phát triển mới trong quan hệ 3 nước.



Chủ tịch Quốc hội Vương Đình Huệ, Tổng Bí thư và Chủ tịch nước Lào Thongloun Sisoulith, Chủ tịch Quốc hội Lào Saysomphone Phomvihane và Chủ tịch Quốc hội Vương quốc Campuchia Samdech Khuon Sudary với đại biểu. Ảnh: Doãn Tấn

Đối với chuyến thăm chính thức Thái Lan, đây là lần đầu tiên, Nhà vua và Hoàng hậu Thái Lan tiếp Chủ tịch Quốc hội Vương Đình Huệ, khẳng định sự coi trọng, đánh giá rất cao của Nhà vua và Lãnh đạo Thái Lan đối với Việt Nam, quan hệ Thái Lan - Việt Nam và với Chủ tịch Quốc hội Vương Đình Huệ.

Thời gian qua, Quốc hội Việt Nam và Quốc hội Thái Lan đã triển khai nhiều hoạt động hợp tác thiết thực. Tuy nhiên, việc Chủ tịch Quốc hội Vương Đình Huệ và Chủ tịch Quốc hội Thái Lan ký Bản ghi nhớ hợp tác giữa Quốc hội Việt Nam và Hạ viện Thái Lan trong khuôn khổ chuyến thăm chính thức Thái Lan có ý nghĩa hết sức quan trọng, là khuôn khổ để hai cơ quan lập pháp tiếp tục triển khai các hoạt động hợp tác một cách đầy đủ, toàn diện và bài bản hơn. Tới đây, trên cơ sở Bản ghi nhớ hợp tác này, chúng tôi sẽ tích cực tham mưu để Quốc hội, Ủy ban Thường vụ Quốc hội và các cơ quan của Quốc hội triển khai các hoạt động hợp tác cụ thể để đẩy mạnh hơn nữa quan hệ Việt Nam - Thái Lan.



Chủ tịch Quốc hội Vương Đình Huệ và Chủ tịch Quốc hội, Chủ tịch Hạ viện Thái Lan Wan Muhamad Noor Matha ký và trao đổi Bản ghi nhớ hợp tác giữa Quốc hội Việt Nam và Hạ viện Thái Lan. Ảnh: Doãn Tấn

Như khẳng định của Chủ tịch Quốc hội Vương Đình Huệ, Việt Nam và Thái Lan là hai quốc gia có trách nhiệm và vai trò quan trọng trong ASEAN, thúc đẩy hợp tác thực chất hơn, thực sự là một Cộng đồng chung ASEAN, hướng tới phồn vinh chung của ASEAN nhưng đồng thời cũng khẳng định vị thế của ASEAN trên thế giới. Trở thành một khối chung sẽ tạo nên sức mạnh để chúng ta tham gia hiệu quả vào các cơ chế hợp tác đa phương, từ đó đóng góp cho hòa bình, thịnh vượng và sự phát triển bền vững không chỉ cho ASEAN mà còn cho thế giới. Do đó, việc Quốc hội Việt Nam và Quốc hội Thái Lan ký kết hợp tác để cụ thể hoá và triển khai thực chất hơn, hiệu quả hơn các hoạt động hợp tác trong lĩnh vực lập pháp, giám sát tối cao, quyết định các vấn đề quan trọng quốc gia và đặc biệt là giám sát việc Chính phủ triển khai thực hiện các thoả thuận hợp tác là mốc son mới trong quan hệ hợp tác giữa Nghị viện hai nước."
