,Title,Link,Content(RAW)
63,Giải mã sức hút của “Tiếng nói Xanh” - Sân chơi dành cho học …,https://cadn.com.vn/giai-ma-suc-hut-cua-tieng-noi-xanh-san-choi-danh-cho-hoc-sinh-thpt-voi-giai-thuong-ky-luc-post287771.html,"Cuộc thi hùng biện - tranh biện “Tiếng nói Xanh” do Quỹ Vì tương lai xanh (Tập đoàn Vingroup) tổ chức đang “gây bão” trong giới trẻ toàn quốc. Sức hút của cuộc thi không đơn thuần đến từ giải thưởng kỷ lục, tổng giá trị lên tới 18,5 tỷ đồng.

Tiến sĩ Lê Thái Hà, Giám đốc Điều hành Quỹ Vì tương lai xanh

TS. Lê Thái Hà, Giám đốc Điều hành Quỹ Vì tương lai xanh, chia sẻ về lý do khiến “Tiếng nói Xanh” được đánh giá là cuộc thi “không thể bỏ lỡ”, đồng thời “bật mí” những bí kíp giúp các thí sinh chinh phục giải thưởng lớn nhất từ trước đến nay.

- “Tiếng nói Xanh” là một cuộc thi rất mới, lần đầu tiên được Quỹ Vì Tương lai xanh tổ chức dành cho các bạn học sinh THPT. Sau hơn 1 tháng phát động, bà đánh giá như thế nào về sức hút của cuộc thi này?

- Tiến sĩ Lê Thái Hà: Chúng tôi vô cùng bất ngờ và hạnh phúc trước sự đón nhận nồng nhiệt từ các thầy cô và học sinh từ khắp mọi miền Tổ quốc.

Trong vòng chỉ 3 tuần đầu, chúng tôi đã tổ chức thành công roadshow tại 10 trường THPT uy tín từ Bắc vào Nam lan tỏa đến hàng chục nghìn học sinh. Sự năng động và tinh thần ham học hỏi của các em thật sự là nguồn cảm hứng bất tận.

Không chỉ dừng lại ở đó, chúng tôi còn mở rộng quy mô, gửi thông tin về cuộc thi đến hàng trăm trường trên toàn quốc. Rất nhiều thầy cô đã bày tỏ sự ủng hộ và quyết tâm của Ban tổ chức, một điều không thường thấy trong các cuộc thi dành cho học sinh THPT. Sự hỗ trợ từ Ban Giám hiệu và các thầy cô tại các trường là nguồn động viên lớn lao đối với chúng tôi.

Tiến sĩ Lê Thái Hà chụp ảnh cùng các bạn học sinh trường THPT Ân Thi, Hưng Yên

- Tham gia cuộc thi “Tiếng nói Xanh”, các học sinh sẽ được những lợi ích gì, thưa bà?

Là một cuộc thi hùng biện - tranh biện, “Tiếng nói Xanh” trước tiên sẽ giúp các em học sinh nâng cao kỹ năng giao tiếp trước đám đông, tự tin lên tiếng để bảo vệ quan điểm của mình. Các em sẽ được thể hiện bản lĩnh, năng lực tư duy, phát huy khả năng sáng tạo trong việc đối diện và giải quyết những thách thức môi trường hiện nay.

Đặc biệt, ở các vòng thi sâu hơn, các em còn có cơ hội học hỏi từ Hội đồng Chuyên môn, gồm các giáo sư và chuyên gia hàng đầu trong nước và quốc tế trong các lĩnh vực xanh và tranh biện - hùng biện. Đây chính là cơ hội quý báu để các em được mở rộng kiến thức, nâng cao kỹ năng để phát triển bản thân.

Một yếu tố nữa mà tôi nghĩ cũng không kém phần quan trọng, đó là tổng giá trị giải thưởng lên tới 18,5 tỷ đồng. Đây có lẽ là mức giải thưởng kỷ lục đối với một sân chơi trí tuệ dành cho học sinh tại Việt Nam. (cười)

- Vậy làm thế nào để các thí sinh có thể chinh phục được giải thưởng “khủng” đó?

- Tiến sĩ Lê Thái Hà: Đầu tiên, kiến thức về môi trường là yếu tố quan trọng nhất. Các em cần phải nắm vững nguyên nhân, hậu quả của biến đổi khí hậu và tầm quan trọng của việc bảo tồn đa dạng sinh học. Tiếp theo, sáng tạo và đổi mới là chìa khóa để phát triển các giải pháp hiệu quả.

Kỹ năng giao tiếp và lãnh đạo cũng rất quan trọng. Để thay đổi ý thức cộng đồng, thế hệ trẻ cần biết cách truyền đạt thông điệp rõ ràng và thuyết phục, lãnh đạo mọi người xung quanh cùng hành động. Kỹ năng hợp tác và mở rộng mạng lưới liên kết cũng giúp thế hệ trẻ mở rộng tầm ảnh hưởng. Để đạt được mục tiêu chung, các bạn cần phải làm việc chặt chẽ với các đối tác ở nhiều cấp độ khác nhau, từ cá nhân tới tổ chức.

Cuối cùng, kỹ năng phân tích và đánh giá sẽ giúp thế hệ trẻ đưa ra các quyết định quan trọng. Các bạn cần biết cách sàng lọc và phân tích thông tin từ nhiều nguồn khác nhau, như dữ liệu khoa học hoặc báo cáo, để có cái nhìn sâu rộng về thực trạng môi trường, từ đó xác định hướng hành động hiệu quả nhất.

Hàng nghìn học sinh trường THPT Chuyên Lê Hồng Phong (TP.HCM) hào hứng với cuộc thi Tiếng nói Xanh

- Bà kỳ vọng cuộc thi sẽ tác động như thế nào đến thế hệ trẻ nói riêng và toàn xã hội nói chung?

- Tiến sĩ Lê Thái Hà: Trong bối cảnh thế giới hội nhập ngày nay, thế hệ trẻ được tiếp xúc với vô vàn nguồn thông tin và tài nguyên kiến thức. Cuộc thi “Tiếng nói Xanh” không chỉ là một sân chơi trí tuệ, mà còn là cơ hội để thế hệ trẻ tự tin đứng lên bày tỏ quan điểm của mình. Từ những ý kiến, quan điểm và giải pháp xuất sắc, chúng ta sẽ có cơ hội lan tỏa tinh thần và nâng cao nhận thức cộng đồng về bảo vệ môi trường.

Chúng tôi tin tưởng rằng cuộc thi sẽ trở thành nguồn cảm hứng cho những giải pháp môi trường sáng tạo và khả thi, đồng thời tạo động lực cho thế hệ trẻ tiếp tục nghiên cứu, đổi mới và áp dụng những ý tưởng đó.

Không chỉ bằng lời nói, chúng tôi mong được nhìn thấy sự quyết tâm của thế hệ trẻ từ trong hành động ngày từ ngày hôm nay cùng chung tay bảo vệ môi trường. Bởi suy cho cùng, một tương lai xanh và một thế giới tốt đẹp hơn chính là trái ngọt mà các bạn sẽ được hưởng sau này từ những hạt giống được gieo trồng hôm nay.

- Ngoài Cuộc thi Tiếng nói Xanh, Quỹ Vì Tương lai xanh có đang triển khai những hoạt động tương tự để thực hiện chiến lược và cam kết của mình đối với việc phát triển bền vững?

- Tiến sĩ Lê Thái Hà: Cuộc thi Tiếng nói Xanh, nằm trong chương trình hành động về Giáo dục Xanh, chỉ là một trong chuỗi hoạt động dài hơi mà Quỹ Vì Tương lai xanh đã, đang và sẽ triển khai. Đây là một trong 10 chương trình hành động trọng điểm trên phạm vi toàn quốc mà quỹ đã phát động, bao gồm: Di chuyển xanh, Năng lượng xanh, Văn phòng xanh, Tiêu dùng xanh, Môi trường xanh, Vườn đô thị xanh, Du lịch xanh, Giáo dục xanh, Y tế xanh và Thể thao xanh.

Điều này rất phù hợp với hướng đi của tập đoàn Vingroup - không chỉ là một tập đoàn kinh tế tư nhân hàng đầu, mà còn tiên phong trong cấc hoạt động cộng đồng xã hội, xây dựng một tương lai bền vững thông qua giáo dục, đổi mới sáng tạo.

Đặc biệt, việc tập trung vào giới trẻ, những người sẽ trở thành nhà lãnh đạo của ngày mai, cho thấy Vingroup đang xây dựng một cầu nối giữa hiện tại và tương lai với hy vọng rằng những người trẻ sẽ mang những giá trị về phát triển bền vững vào trong quyết định và hành động của họ trong tương lai.

- Xin cảm ơn bà!"
65,Đà Nẵng xác định 13 vị trí đặt Trạm kiểm tra tải trọng xe lưu động,https://cadn.com.vn/da-nang-xac-dinh-13-vi-tri-dat-tram-kiem-tra-tai-trong-xe-luu-dong-post287739.html,"Lực lượng Thanh tra Sở GTVT TP Đà Nẵng kiểm tra tải trọng một phương tiện lưu thông trên QL1A qua địa bàn.

Việc đặt 13 Trạm kiểm tra tải trọng xe lưu động trên đường bộ trên địa bàn TP nhằm phát hiện và xử lý nghiêm các hành vi phạm chở hàng quá khổ, quá tải trọng cho phép của các phương tiện khi tham gia giao thông, góp phần đảm bảo trật tự an toàn giao thông, ngăn ngừa tai nạn giao thông và bảo vệ kết cấu hạ tầng giao thông đường bộ trên địa bàn TP.

Các trạm kiểm tra tải trọng xe lưu động này có các chức năng như: kiểm soát tải trọng xe lưu thông trên các tuyến quốc lộ và đường bộ trên địa bàn TP có dấu hiệu vi phạm chở hàng quá khổ, quá tải trọng; yêu cầu lái xe đưa xe vi phạm vào nơi quy định để kiểm tra tải trọng và khổ giới hạn; kiểm tra điều kiện kinh doanh vận tải và người điều khiển phương tiện (đăng ký, đăng kiểm, bảo hiểm, giấy phép lái xe, phù hiệu và thiết bị giám sát hành trình, các điều kiện đảm bảo an toàn kỹ thuật xe…); kiểm tra giấy phép lưu hành xe quá tải trọng, xe quá khổ giới hạn, xe vận chuyển hàng siêu trường, siêu trọng trên đường bộ theo quy định; lập biên bản vi phạm hành chính và ra quyết định xử phạt theo thẩm quyền đối với các hành vi vi phạm hành chính trong lĩnh vực giao thông đường bộ được phát hiện qua kiểm tra, trường hợp vượt quá thẩm quyền thì chuyển hồ sơ vụ việc đến cấp có thẩm quyền để xem xét, xử lý…

PHÚ NAM"
72,Khởi công xây dựng trụ sở Công an 5 xã biên giới huyện Tây Giang,https://cadn.com.vn/khoi-cong-xay-dung-tru-so-cong-an-5-xa-bien-gioi-huyen-tay-giang-post287738.html,"Cuối tuần qua, huyện Tây Giang (tỉnh Quảng Nam) đã tổ chức khởi công xây dựng trụ sở Công an 5 xã biên giới tại các xã Bhalêê, Lăng, TrHy, ChƠm và Ga ri. Đây là 5/6 xã biên giới đặc biệt khó khăn được Bộ Công an hỗ trợ 1 phần kinh phí để đầu tư xây dựng. Tổng mức đầu tư xây dựng trụ sở Công an 5 xã khoảng 23,5 tỷ đồng, trong đó Bộ Công an hỗ trợ 1,5 tỷ đồng/1 trụ sở, còn lại là nguồn kinh phí từ ngân sách của tỉnh Quảng Nam và huyện Tây Giang.

Các đại biểu thực hiện nghi thức khởi công xây dựng trụ sở Công an 5 xã biên giới Tây Giang.

Quy mô đầu tư trụ sở các xã biên giới gồm 1 nhà làm việc, ăn, ở doanh trại 2 tầng, diện tích xây dựng gần 230m2, được xây dựng kiên cố, đảm bảo theo yêu cầu thiết kế do Sở xây dựng ban hành. Công trình sau khi hoàn thành, đưa vào sử dụng sẽ đảm bảo cơ sở vật chất, phục vụ nhu cầu làm việc của cán bộ chiến sĩ Công an xã.

Là một huyện miền núi, biên giới xa xôi của tỉnh Quảng Nam với điều kiện kinh tế còn nhiều khó khăn, huyện Tây Giang đã cân đối nguồn lực, sớm đầu tư xây dựng các trụ sở Công an các xã trên địa bàn là sự quan tâm lớn của huyện Tây Giang đối với lực lượng Công an. Đây sẽ là động lực để lực lượng Công an tiếp tục nỗ lực đảm bảo tốt ANTT tại cơ sở, nhất là khu vực biên giới.

Lê Vương"
73,"Điều chỉnh phương án đấu giá đất dự án Tổ hợp thể thao, giải trí …",https://cadn.com.vn/dieu-chinh-phuong-an-dau-gia-dat-du-an-to-hop-the-thao-giai-tri-va-thuong-mai-hoa-xuan-post287751.html,"Khu vực sẽ triển khai dự án Tổ hợp thể thao giải trí và thương mại Hòa Xuân.

Theo đó, tổng mức đầu tư dự án không bao gồm tiền sử dụng đất dự kiến xác định là hơn 5.491 tỷ đồng. Người tham gia đấu giá đất thực hiện dự án phải có vốn chủ sở hữu không thấp hơn 15% tổng mức đầu tư dự kiến (hơn 823 tỷ đồng). Ngoài ra, người tham gia đấu giá quyền sử dụng đất cam kết không lâm vào tình trạng phá sản hoặc đang trong quá trình giải thể; không bị cơ quan nhà nước có thẩm quyền kết luận về tình hình tài chính không lành mạnh; không nằm trong thời gian bị xử lý vi phạm theo quy định của pháp luật (kể cả trường hợp sử dụng năng lực của công ty mẹ).

HẢI QUỲNH"
75,Gần 1.400 VĐV tham gia giải chạy Half marathon-Nghi Xuân 2023,https://cadn.com.vn/gan-1400-vdv-tham-gia-giai-chay-half-marathon-nghi-xuan-2023-post287768.html,"Các vận động viên về đích.

Đây là giải chạy chuyên nghiệp lần đầu tiên diễn ra trên địa bàn tỉnh Hà Tĩnh, thu hút gần 1.400 VĐV, trong đó có sự góp mặt của các VĐV đã từng đạt huy chương vàng châu Á, huy chương vàng Sea games và các vận động viên nước ngoài đến từ 5 quốc gia như Albania, Australia, Cuba, Ấn Độ, Lào.

VĐV tranh tài ở 3 cự ly 21km, 10km và 5km, chạy qua các điểm du lịch, di sản văn hóa nổi tiếng của huyện Nghi Xuân. Kết thúc giải, 20 VĐV xuất sắc đã được Ban Tổ chức trao các giải Nhất, Nhì, Ba ở 3 nội dung.

H.Q"
77,Sập bẫy “tình một đêm” mất tiền tỷ,https://cadn.com.vn/sap-bay-tinh-mot-dem-mat-tien-ty-post287731.html,"Ngày 10-12, Phòng An ninh mạng và phòng chống tội phạm sử dụng công nghệ cao (Phòng ANM), Công an TP Đà Nẵng cho biết đã tiếp nhận tin báo của các nạn nhân bị lừa đảo số tiền hàng tỷ đồng vì sập bẫy lừa “làm nhiệm vụ tình một đêm”.

Cụ thể, đầu tháng 12-2023, Phòng ANM đã tiếp nhận tin báo của ông N.M (trú Quảng Ninh) về việc khoảng cuối tháng 11/2023, có 1 tài khoản Telegram tên “CSKH – Trần Phương Uyên” kết nối với ông M. tự giới thiệu là quản lý của một doanh nghiệp kinh doanh dịch vụ Bar, Karaoke nổi tiếng tại Đà Nẵng và mời gọi ông M. tham gia hệ thống thành viên để được hưởng các ưu đãi mại dâm như “Xem không giới hạn các video người thật số lượng lớn”, “Đặt lịch cùng thành phố online 24/24h”, “Giảm giá 30% cho lần đầu” “Chat xxx, cùng bé, call video thỏa thuận”,…. Ngoài ra, đối tượng còn cam kết, nếu là thành viên VIP thì khi đi đến các cơ sở của doanh nghiệp này tại Đà Nẵng đều được giảm giá 50% hóa đơn.

Đối tượng dẫn dụ lừa đảo chiếm đoạt của ông M. hơn 3 tỷ đồng

Khi ông M. đồng ý, đối tượng nhanh chóng hướng dẫn ông truy cập vào trang website https://www.xxxclub.vip để đăng ký tài khoản với phí tham gia là 123.000 đồng. Sau khi đăng ký thành công, ông M. tiếp tục được mời vào nhóm Telegram dành riêng cho “VIP” để làm nhiệm vụ nhận hoa hồng. Đối với các nhiệm vụ đầu tiên, đối tượng hướng dẫn ông M. nạp vào số tiền nhỏ rồi tham gia bình chọn “gái gọi”, sau khi thành công, đối tượng chuyển lại vào tài khoản của ông M. số tiền nạp vào kèm theo 30% hoa hồng. Tuy nhiên, đối với các nhiệm vụ tiếp theo thì số tiền phải nạp vào ngày càng lớn, các đối tượng liên tục lấy lý do là ông M. làm sai nhiệm vụ nên bị treo tiền trên hệ thống, nếu muốn lấy lại tiền thì phải tiếp tục nạp thêm tiền vào. Đến khi không còn khả năng chi trả, ông M. mới phát hiện mình bị lừa. Tổng số tiền ông M. bị lừa là hơn 3 tỷ đồng.

Cũng với thủ đoạn tương tự, ông V.N (trú Hà Nội) đã bị các đối tượng lừa đảo hơn 1 tỷ đồng vào cuối tháng 11-2023 và ông N. đã trình báo Phòng ANM.

Thẻ hẹn hò online đối tượng cấp cho nạn nhân sau khi đăng ký, nạp tiền.

Theo phòng ANM, việc các đối tượng sử dụng tên, hình ảnh, logo các nhà hàng, khách sạn, vũ trường có thật trên địa bàn Đà Nẵng để lừa đảo đã ảnh hưởng nghiêm trọng đến môi trường du lịch thành phố. Ngoài ra, với thủ đoạn lừa đảo, dẫn dụ tinh vi, nhiều nạn nhân đã mắc bẫy, vì thế Phòng ANM khuyến cáo người dân nên cảnh giác trước các ứng dụng hẹn hò online đang phổ biến, khi gặp trường hợp tương tự báo ngay cơ quan Công an gần nhất để có biện pháp xử lý.

HẢI QUỲNH"
78,"Đà Nẵng thu hồi tài sản các vụ án kinh tế, tham nhũng rất thấp",https://cadn.com.vn/da-nang-thu-hoi-tai-san-cac-vu-an-kinh-te-tham-nhung-rat-thap-post287730.html,"Ông Thu cho biết, kết quả thi hành án năm 2023 (tính từ 1/10/2022 đến 30/9/2023) đạt thấp, số tiền có điều kiện thi hành hơn 9,1 ngàn tỷ đồng nhưng chỉ thi hành xong hơn 2,1 ngàn tỷ đồng, đạt tỷ lệ hơn 23,3%. Trong đó, số tiền có điều kiện thi hành tại 80 vụ liên quan đến án kinh tế, tham nhũng hơn 4.381 tỷ đồng, nhưng chỉ thu hồi được hơn 473 tỷ đồng, đạt hơn 10,8%.

Vụ Phạm Công Danh- Công ty THHH Tập đoàn Thiên Thanh có giá trị phải thi hành hơn 3.946 tỷ đồng hiện nay còn nhiều vướng mắc trong quá trình xử lý tài sản Khu phức hợp sân vận động Chi Lăng

Cục trưởng Thi hành án dân sự Đà Nẵng cho biết, số tiền phải thi hành trong các vụ án kinh tế, tham nhũng giá trị lớn, khó thi hành, dẫn đến việc tổ chức thi hành án thu hồi tiền, tài sản cho nhà nước gặp nhiều khó khăn, ảnh hưởng trực tiếp đến kết quả thi hành án dân sự. Có bản án hơn 100 đơn yêu cầu thi hành án, có tài sản đảm bảo là bất động sản nhưng bán đấu giá chưa có người mua (vụ Nguyễn Thị Bích Thuận, Hồ Thị Cẩm Uyên lừa đảo chiếm đoạt tài sản hơn 100 người số tiền phải thi hành án gần 95 tỷ đồng). Ngoài ra, khi kê biên tài sản của người phải thi hành án, một số trường hợp đã được cơ quan nhà nước có thẩm quyền cấp giấy chứng nhận quyền sử dụng đất nhưng diện tích đất trên giấy chứng nhận khác với thực tế hoặc không xác định được vị trí, diện tích thửa đất trên thực địa, dẫn tới kéo dài thời gian tổ chức thi hành. Thậm chí, việc thi hành án đối với tài sản được bản án tuyên kê biên hoặc tài sản thế chấp là phương tiện giao thông, mác móc công trình, nhưng đến giao đoạn thi hành án không xác định được tài sản đang ở đâu nên thi hành không có kết quả.

Ông Thu liệt kê một số vụ có giá trị lớn, khó thi hành. Nổi bật như các bản án của tòa liên quan đến Phan Văn Anh Vũ và nhiều người, liên đới bồi thường thiệt hại cho UBND TP Đà Nẵng để sung quỹ nhà nước số tiền hơn 4.192 tỷ đồng và lãi chậm thi hành án. Vụ Phạm Công Danh-Công ty THHH Tập đoàn Thiên Thanh có giá trị phải thi hành hơn 3.946 tỷ đồng hiện nay còn nhiều vướng mắc trong quá trình xử lý tài sản Khu phức hợp sân vận động Chi Lăng. Vụ Cty Đầu tư và phát triển Hàn Quốc (KIDCO) phải trả cho Ngân hàng TMCP Đông Nam số tiền hơn 769 tỷ đồng và lãi chậm thi hành. Vụ Cty TNHH thương mại và dịch vụ lắp máy Miền Nam phải trả cho Ngân hàng NN và PTNT số tiền hơn 385 tỷ đồng theo quyết định của TAND quận Hải Châu.

Công an đọc lệnh bắt Nguyễn Thị Bích Thuận (trái, áo đen)

Sở dĩ kết quả thi hành án đạt thấp, theo ông Thu do số tiền phải thi hành lớn nhưng tài sản chưa được xử lý do vướng mắc về cơ sở pháp lý (vụ Phạm Công Danh xử lý SVĐ Chi Lăng, vụ Trần Văn Minh và đồng phạm phải xử lý 28 tài sản là bất động sản). Bên cạnh đó, nhân sự giảm, khối lượng công việc ngày càng nhiều và phức tạp, nhất là tổ chức thi hành các vụ án kinh tế, tham nhũng gặp nhiều khó khăn, áp lực; nhiều đương sự lợi dụng quyền khiếu nại, tố cáo để cố tình kéo dài thời gian tổ chức thi hành án.

HẢI QUỲNH"
79,"Muốn đấu giá đất dự án Tổ hợp thể thao, giải trí và thương mại …",https://cadn.com.vn/muon-dau-gia-dat-du-an-to-hop-the-thao-giai-tri-va-thuong-mai-hoa-xuan-phai-co-von-so-huu-tren-823-ty-dong-post287729.html,"UBND TP Đà Nẵng vừa điều chỉnh phương án đấu giá quyền sử dụng đất dự án Tổ hợp thể thao, giải trí và thương mại Hòa Xuân tại phường Hòa Xuân, quận Cẩm Lệ. Theo đó, tổng mức đầu tư dự án không bao gồm tiền sử dụng đất dự kiến xác định là hơn 5.491 tỷ đồng. Người tham gia đấu giá đất thực hiện dự án phải có vốn chủ sở hữu không thấp hơn 15% tổng mức đầu tư dự kiến (hơn 823 tỷ đồng).

Ngoài ra, người tham gia đấu giá quyền sử dụng đất cam kết không lâm vào tình trạng phá sản hoặc đang trong quá trình giải thể; không bị cơ quan nhà nước có thẩm quyền kết luận về tình hình tài chính không lành mạnh; không nằm trong thời gian bị xử lý vi phạm theo qui định của pháp luật (kể cả trường hợp sử dụng năng lực của công ty mẹ).

Trước đó, cuối tháng 7-2023, UBND TP Đà Nẵng đã phê duyệt phương án đấu giá đất để triển khai dự án Tổ hợp thể thao, giải trí và thương mại Hòa Xuân rộng gần 35ha trên địa bàn phường Hòa Xuân, quận Cẩm Lệ. Dự án có tổng mức đầu tư dự kiến khoảng 5,5 ngàn tỷ đồng, bao gồm khu thể thao điện tử là 0,35 ha, trường đua Gokart rộng hơn 2 ha, khu khách sạn rộng hơn 2,6 ha, sân tập thể thao và làng văn hóa rộng gần 9,6 ha, khu công cộng, dịch vụ đô thị hơn 10 ha, còn lại đất giao thông, vỉa hè.

Sau khi đơn vị trúng đấu giá khu đất sẽ phải triển khai dự án trong khoảng thời gian 6 năm kể từ ngày công nhận kết quả đấu giá. Với thời hạn sử dụng đất 50 năm, tiền thuê đất trả 1 lần, Đà Nẵng dự kiến sẽ có nguồn thu khoảng 1,4 ngàn tỷ đồng.

HẢI QUỲNH"
