,Title,Link,Content(RAW)
95,Xây dựng lòng tin chiến lược giữa hai Đảng – nền tảng vững chắc cho quan hệ Việt-Trung,https://baochinhphu.vn/xay-dung-long-tin-chien-luoc-giua-hai-dang-nen-tang-vung-chac-cho-quan-he-viet-trung-10223120915421713.htm,"chính phủ nước cộng hòa xã hội chủ nghĩa việt nam
Báo Điện tử Chính phủ
Tổng Bí thư Nguyễn Phú Trọng hội đàm với Tổng Bí thư, Chủ tịch nước Trung Quốc Tập Cận Bình trong chuyến thăm chính thức Trung Quốc tháng 11/2022
Trước thềm chuyến thăm Việt Nam của Tổng Bí thư, Chủ tịch nước Trung Quốc Tập Cận Bình, ông Nguyễn Vinh Quang, Cố vấn cao cấp Trung tâm Nghiên cứu chiến lược và Phát triển quan hệ quốc tế; Phó Chủ tịch Hội Hữu nghị Việt -Trung; nguyên Vụ trưởng Vụ Trung Quốc Đông Bắc Á, Ban Đối ngoại Trung ương chia sẻ những đánh giá của ông về lòng tin chiến lược giữa hai Đảng, hai nước và những kỳ vọng về chuyến thăm
Nhìn lại lịch sử quan hệ song phương, ông Nguyễn Vinh Quang đánh giá, kể từ khi hai nước bình thường hóa quan hệ năm 1991, quan hệ Việt Nam-Trung Quốc bắt đầu có những bước phát triển đi lên, nhưng chưa ổn định.
Đến năm 1999, Việt Nam đề ra chủ trương phát triển ổn định quan hệ hai nước, từ đó hai bên đưa ra phương châm chỉ đạo “16 chữ”. Hai bên cũng nhận thấy cần nâng cấp quan hệ song phương lên mức cao hơn, vì thế đến năm 2008, hai nước chính thức thiết lập khuôn khổ đối tác hợp tác chiến lược toàn diện Việt Nam-Trung Quốc.
Việc duy trì tiếp xúc cấp cao là điểm nhấn của quan hệ đối tác hợp tác chiến lược toàn diện Việt-Trung trong suốt 15 năm qua. Tầm vóc chiến lược của quan hệ Việt-Trung được thể hiện qua các chuyến thăm của lãnh đạo cấp cao hai Đảng, hai nước, trong đó đáng chú ý là hoạt động giao lưu, trao đổi kinh nghiệm giữa hai Đảng qua nhiều kênh, diễn đàn, hội thảo lý luận được tổ chức hằng năm…
Việt Nam và Trung Quốc đều là nước XHCN do Đảng Cộng sản lãnh đạo, cùng trải qua thời kỳ chuyển đổi, trong đó ở Việt Nam là thời kỳ đổi mới, còn với Trung Quốc là cải cách mở cửa, nên việc trao đổi lẫn nhau giữa hai bên là rất cần thiết cho quá trình này. Hai bên thường xuyên có sự giao lưu về mặt lý luận và học hỏi kinh nghiệm phát triển.
Về chiến lược, hai bên đều kiên trì con đường đi lên CNXH. Đây cũng là điểm nhấn quan trọng trong quan hệ hợp tác giữa hai Đảng, vừa là ý chí của hai Đảng cũng là nguyện vọng của nhân dân hai nước. Đồng chí Tập Cận Bình và các lãnh đạo cấp cao Trung Quốc nhiều lần khẳng định phát triển quan hệ tốt đẹp với Việt Nam là sự lựa chọn ưu tiên của Trung Quốc.
Lòng tin chiến lược giữa hai nước được thể hiện qua sự lựa chọn đường lối chính sách của hai Đảng, hai nước. Đồng chí Tập Cận Bình rất coi trọng sự lãnh đạo của Đảng Cộng sản trong chiến lược phát triển của Trung Quốc.
Phía Trung Quốc đánh giá cao uy tín và vai trò lãnh đạo của Đảng Cộng sản Việt Nam trong việc thực hiện thành công đường lối đổi mới. Có thể thấy nhiều điểm tương đồng trong công tác xây dựng Đảng giữa Việt Nam và Trung Quốc, trong đó điển hình là công tác phòng chống tham nhũng, làm trong sạch Đảng của Trung Quốc được thực hiện rất hiệu quả và Việt Nam cũng thực hiện rất tốt công tác này những năm gần đây.
Ông Nguyễn Vinh Quang: Lý luận về CNXH và con đường đi lên CNXH của Việt Nam được Trung Quốc rất quan tâm, rất hấp dẫn những người cộng sản Trung Quốc, trong đó có đồng chí Tập Cận Bình
Đặc biệt, lý luận về chủ nghĩa xã hội (CNXH) và con đường đi lên CNXH của Việt Nam được Trung Quốc rất quan tâm, rất hấp dẫn những người cộng sản Trung Quốc trong đó có đồng chí Tổng Bí thư Tập Cận Bình.
Có thể khẳng định lòng tin chiến lược giữa hai nước chính là lòng tin giữa hai Đảng. Đó cũng là lý do đồng chí Tổng Bí thư Tập Cận Bình quyết tâm sang thăm Việt Nam vào những ngày cuối năm, một chuyến thăm rất nhiều kỳ vọng.
Việt Nam coi trọng Trung Quốc là một nước lớn do Đảng Cộng sản lãnh đạo, có tốc độ phát triển nhanh. Trung Quốc cũng nhìn nhận Việt Nam là nước có tốc độ phát triển nhanh hàng đầu và có sự ổn định về chính trị, xã hội nhất trong khu vực. Hai bên đều rất coi trọng nhau, đều mong muốn nâng tầm quan hệ lên một mức cao hơn.
Trong tổng thể 3 kênh ngoại giao Đảng, Nhà nước và ngoại giao nhân dân, trên thế giới không có nước nào có quan hệ ngoại giao kênh Đảng và giao lưu nhân dân có từ lâu đời và sâu đậm như hai nước Việt Nam và Trung Quốc.
Trong đó, quan hệ giữa hai Đảng trên thực tế đã có lịch sử 100 năm, từ khi Đảng Cộng sản Việt Nam chưa ra đời thì Chủ tịch Hồ Chí Minh đã có mối quan hệ với những người cộng sản Trung Quốc. Hợp tác giữa hai Đảng định hướng cho quan hệ giữa hai nước.
Ngoại giao nhân dân cũng đóng vai trò vô cùng quan trọng trong quan hệ Việt Nam – Trung Quốc, là sợi chỉ đỏ xuyên suốt, là nền tảng để xây dựng mối quan hệ hữu nghị giữa hai quốc gia. Dưới sự lãnh đạo của hai Đảng, hoạt động giao lưu nhân dân được diễn ra với nhiều hình thức phong phú, sáng tạo.
Theo ông Nguyễn Vinh Quang, hiện tại là thời điểm rất thuận lợi cho việc thúc đẩy và củng cố quan hệ Việt-Trung. Chuyến thăm Trung Quốc cuối năm 2022 của Tổng Bí thư Nguyễn Phú Trọng được tiếp nối bằng một loạt các chuyến thăm của lãnh đạo cấp cao hai nước như chuyến thăm Trung Quốc của Ủy viên Bộ Chính trị, Trường trực Ban Bí thư Trương Thị Mai, chuyến thăm của Thủ tướng Phạm Minh Chính, Chủ tịch nước Võ Văn Thưởng dự Diễn đàn Vành đai và Con đường và nhiều lãnh đạo các bộ ngành Trung ương thăm Trung Quốc.
Phía lãnh đạo cấp cao Trung Quốc cũng có các chuyến thăm Việt Nam, gần đây nhất là Ủy viên Bộ Chính trị, Chủ nhiệm Văn phòng Ủy ban công tác đối ngoại Trung ương Đảng Cộng sản Trung Quốc, Bộ trưởng Ngoại giao Trung Quốc Vương Nghị đến Việt Nam tổ chức Phiên họp lần thứ 15 Ủy ban chỉ đạo hợp tác song phương Việt Nam - Trung Quốc.
Qua những chuyến thăm và tiếp xúc cấp cao có thể thấy quan hệ hai nước trong lĩnh vực chính trị, ngoại giao đang phát triển tốt đẹp. Cùng với đó, hợp tác về kinh tế thương mại, đầu tư, du lịch cũng rất sôi động, đặc biệt từ khi Trung Quốc mở cửa trở lại sau đại dịch.
Hai bên trở thành thị trường quan trọng của nhau, Việt Nam là đối tác thương mại lớn nhất của Trung Quốc trong các nước ASEAN. Điều rất đáng mừng là chênh lệch cán cân thương mại giữa Việt Nam-Trung Quốc đang dần được thu hẹp.
Có thể nói chuyến thăm Việt Nam sắp tới của đồng chí Tổng Bí thư, Chủ tịch nước Trung Quốc Tập Cận Bình diễn ra trong bối cảnh quan hệ hai nước đang phát triển tốt đẹp.
Đây là lần thứ 3 đồng chí Tập Cận Bình sang thăm Việt Nam trên cương vị Tổng Bí thư, Chủ tịch nước Trung Quốc, số lượng chuyến thăm nhiều nhất của một Tổng Bí thư, Chủ tịch nước Trung Quốc kể từ khi hai nước bình thường hóa quan hệ đến nay, cho thấy phía Trung Quốc và cá nhân đồng chí Tập Cận Bình rất coi trọng quan hệ với Việt Nam.
Việt Nam rất coi trọng chuyến thăm lần này của đồng chí Tổng Bí thư, Chủ tịch nước Trung Quốc Tập Cận Bình, kỳ vọng chuyến thăm sẽ thúc đẩy quan hệ Việt-Trung lên tầm cao mới.
Ông Nguyễn Vinh Quang bày tỏ hy vọng hai bên sẽ bàn thảo những vấn đề quan trọng như kết nối chiến lược phát triển giữa Việt Nam-Trung Quốc, vốn đang là xu hướng mới trên thế giới cũng như ở khu vực châu Á-Thái Bình Dương.
Việc kết nối chiến lược phát triển giữa Việt Nam và Trung Quốc sẽ được lãnh đạo cấp cao nhất của hai nước láng giềng, với nhiều điểm tương đồng, thảo luận cụ thể hơn qua chuyến thăm lần này, ông Quang chia sẻ.
Ngoài ra, đầu tư của Trung Quốc vào các dự án lớn và chất lượng cao của Việt Nam cũng đang rất có tiềm năng. Hai bên có thể thúc đẩy hợp tác đầu tư cùng có lợi vào các lĩnh vực Việt Nam có nhu cầu và Trung Quốc có thế mạnh như phát triển cơ sở hạ tầng, phát triển xanh... để nâng cao chất lượng hợp tác kinh tế, thương mại, đầu tư giữa hai nước.
Hồng Nguyên-Tuấn Dũng



                        © BÁO ĐIỆN TỬ CỦA CHÍNH PHỦ NƯỚC CỘNG HÒA XÃ HỘI CHỦ NGHĨA VIỆT NAM
                    
Tổng Biên tập: Nguyễn Hồng Sâm
Giấy phép số: 137/GP-BTTTT, cấp ngày 21/04/2014.
Trụ sở: 16 Lê Hồng Phong - Ba Đình - Hà Nội;
Điện thoại: Văn phòng: 080.43162;

                        Fax: 080.48924; Email: thongtinchinhphu@chinhphu.vn.
                    

                Bản quyền thuộc Báo điện tử Chính phủ - Cổng Thông tin điện tử Chính phủ.
            

                Ghi rõ nguồn ""Cổng Thông tin điện tử Chính phủ"", ""Báo điện tử Chính phủ"" hoặc ""www.chinhphu.vn"" khi phát hành lại thông tin từ các nguồn này.
            "
96,Phê chuẩn Chủ tịch UBND tỉnh Quảng Ninh,https://baochinhphu.vn/phe-chuan-chu-tich-ubnd-tinh-quang-ninh-102231209172757789.htm,"Chủ tịch UBND tỉnh Quảng Ninh Cao Tường Huy

Trước đó, sáng 7/12, Kỳ họp thứ 16, HĐND tỉnh Quảng Ninh khóa XIV đã bầu Chủ tịch UBND tỉnh Quảng Ninh, nhiệm kỳ 2021-2026.

Kết quả 100% đại biểu triệu tập có mặt tại kỳ họp đồng ý bầu đồng chí Cao Tường Huy, Phó Bí thư Tỉnh ủy, Quyền Chủ tịch UBND tỉnh giữ chức vụ Chủ tịch UBND tỉnh nhiệm kỳ 2021-2026.

Đồng chí Cao Tường Huy sinh năm 1973, quê quán tại xã Giao Tiến, huyện Giao Thủy, tỉnh Nam Định; trình độ chuyên môn: Đại học ngành Xây dựng, đại học ngành Quản trị doanh nghiệp, Thạc sĩ Kinh tế học; Cao cấp lý luận chính trị.

Đồng chí Cao Tường Huy là cán bộ được đào tạo cơ bản, trưởng thành từ cơ sở, đã kinh qua nhiều vị trí công tác quan trọng ở cấp tỉnh và cấp huyện như: Trưởng phòng Quy hoạch - Xây dựng, Văn phòng UBND tỉnh Quảng Ninh; Phó Chánh và Chánh văn phòng UBND tỉnh; Bí thư Huyện ủy Bình Liêu; Ủy viên Ban Thường vụ Tỉnh ủy, Trưởng Ban Tuyên giáo Tỉnh ủy; Trưởng Ban Kinh tế Ngân sách HĐND tỉnh; Phó Bí thư Ban cán sự Đảng UBND tỉnh, Phó Chủ tịch UBND tỉnh."
97,"Ngành ngoại khoa Việt Nam sánh ngang các nước trên thế giới, đưa robot, trí tuệ nhân tạo vào phẫu thuật",https://moh.gov.vn:443/tin-noi-bat/-/asset_publisher/3Yst7YhbkA5j/content/nganh-ngoai-khoa-viet-nam-sanh-ngang-cac-nuoc-tren-the-gioi-ua-robot-tri-tue-nhan-tao-vao-phau-thuat?inheritRedirect=false&redirect=https%3A%2F%2Fmoh.gov.vn%3A443%2Ftin-noi-bat%3Fp_p_id%3D101_INSTANCE_3Yst7YhbkA5j%26p_p_lifecycle%3D0%26p_p_state%3Dnormal%26p_p_mode%3Dview%26p_p_col_id%3Drow-0-column-2%26p_p_col_count%3D1,"Đó là khẳng định của GS.TS Trần Văn Thuấn - Thứ trưởng Bộ Y tế trong phát biểu chào mừng Hội nghị khoa học ngoại khoa và phẫu thuật nội soi toàn quốc năm 2023 và Lễ Đón nhận Huân chương lao động hạng Ba của Hội Ngoại khoa và Phẫu thuật nội soi Việt Nam diễn ra tại Bình Định cuối tuần này. Lãnh đạo Bộ Y tế nhấn mạnh: Huân chương lao động hạng Ba do Chủ tịch nước trao tặng cho Hội dịp này là mốc son có ý nghĩa quan trọng ghi nhận những cố gắng, hy sinh và phấn đấu của tất cả các hội viên qua quá trình lịch sử hơn 60 năm qua, sự nỗ lực của nhiều thế hệ lãnh đạo Hội đã dày công xây dựng và phát triển Hội, góp phần đưa ngành ngoại khoa Việt Nam sánh ngang với các nước trên thế giới.  GS.TS Trần Văn Thuấn - Thứ trưởng Bộ Y tế phát biểu chào mừng Hội nghị khoa học ngoại khoa và phẫu thuật nội soi toàn quốc năm 2023 và Lễ Đón nhận Huân chương lao động hạng Ba của Hội Ngoại khoa và Phẫu thuật nội soi Việt Nam. Theo Thứ trưởng Trần Văn Thuấn, phần thưởng cao quý của Đảng và Nhà nước đã tiếp thêm sức mạnh và động lực cho Hội tiếp tục vượt qua mọi khó khăn thử thách; vững bước trong việc thực hiện đổi mới trong xu hướng hội nhập quốc tế. Thứ trưởng Trần Văn Thuấn khẳng định, trong suốt chiều dài lịch sử dựng nước và giữ nước của dân tộc Việt Nam, ngành y tế nói chung và ngoại khoa nói riêng đã có những đóng góp to lớn cho sự nghiệp Cách mạng và bảo vệ sức khỏe nhân dân.  Các thầy ngoại khoa đã tham gia cứu chữa thương bệnh binh trong hai cuộc kháng chiến chống Pháp và chống đế quốc Mỹ, tiêu biểu như các chiến dịch Biên giới 1952, chiến dịch Điện Biên Phủ 1954, tham gia vào cuộc kháng chiến chống Mỹ cứu nước ở Miền Nam và chống chiến tranh phá hoại của Mỹ ở Miền Bắc, điển hình là các phòng mổ dưới hầm của các bệnh viện ở Hà Nội đặc biệt là Bệnh viện Việt Đức đã hoạt động 24 giờ/24 giờ trong chiến dịch Điện Biên Phủ trên không cuối năm 1972. ""Sự ra đời của Hội Ngoại khoa Việt Nam vào năm 1962 đã đặt nền móng vững chắc cho sự phát triển của nền y học nước nhà. Hội cũng là nơi gắn bó và sản sinh nhiều phẫu thuật viên tài hoa"" - Thứ trưởng Trần Văn Thuấn nói.  Hội ngoại khoa và phẫu thuật nội soi Việt Nam vinh dự được nhận Huân chương Lao động hạng Ba. Thứ trưởng cho biết, Hội đã tham gia tư vấn, xây dựng 198 quy trình kỹ thuật phẫu thuật phẫu nội soi, góp phần quan trọng trong việc triển khai có hiệu quả phẫu thuật nội soi tới tất cả các bệnh viện tỉnh, thành, ngành và nhiều bệnh viện tuyến huyện, góp phần đưa phẫu thuật nội soi từ một ""phẫu thuật quý tộc"" đến phục vụ số đông nhân dân, một thành tựu mà không phải quốc gia nào cũng thực hiện được. Hội đã tổ chức đào tạo, bồi dưỡng nâng cao trình độ chuyên môn cho hội viên; tư vấn, kiến nghị với cơ quan nhà nước có thẩm quyền quản lý các công trình nghiên cứu trong lĩnh vực ngoại khoa và phẫu thuật nội soi và chịu trách nhiệm về đề xuất, kiến nghị của Hội... Theo GS.TS Trần Bình Giang, Chủ tịch Hội Ngoại khoa và Phẫu thuật nội soi Việt Nam, trải qua hơn 60 năm hình thành và phát triển, ngành ngoại khoa Việt Nam đã không ngừng phát triển, nhiều kỹ thuật từ đơn giản đến phức tạp, từ phẫu thuật chung đến các kỹ thuật chuyên khoa sâu đã đưa ngành ngoại khoa phát triển dần tiếp cận với trình độ của nền y học tiên tiến trên thế giới… Việc phát triển phẫu thuật nội soi là một minh chứng của sự tiếp thu và nhanh chóng hội nhập với nền y học kỹ thuật cao trên thế giới và trở thành những nước có ngành phẫu thuật nội soi phát triển. Sự ra đời của Hội Ngoại khoa và Phẫu thuật nội soi Việt Nam thể hiện sự tập hợp của các nhà ngoại khoa Việt Nam trong lĩnh vực mới này, nhanh chóng ngành phẫu thuật nội soi hòa vào các chuyên ngành của ngoại khoa. Đến nay, tất cả các chuyên khoa từ phẫu thuật sọ não, lồng ngực, tim mạch, tiết niệu, cột sống… chứ không chỉ là phẫu thuật tiêu hóa. Hầu hết các bệnh viện trong cả nước thực hiện các kỹ thuật cơ bản, góp phần cơ bản cứu chữa người bệnh, nhiều trung tâm lớn phát triển các kỹ thuật chuyên sâu như phẫu thuật vi phẫu thần kinh, tim hở…  GS.TS Trần Bình Giang, Chủ tịch Hội ngoại khoa và Phẫu thuật nội soi Việt Nam. Hội nghị khoa học ngoại khoa và phẫu thuật nội soi toàn quốc năm 2023 có 32 phiên diễn ra tại 8 hội trường với hơn 350 bài báo cáo khoa học chất lượng của các nhà nghiên cứu, các bác sĩ, điều dưỡng và kỹ thuật viên trong đó có 30 bài được báo cáo bằng tiếng Anh. Đồng thời có sự tham gia của gần 100 Chủ tọa là các Giáo sư, Phó Giáo sư, Tiến sĩ đầu ngành và các báo cáo viên thuộc nhiều chuyên ngành như tiêu hóa, tiết niệu, chấn thương chỉnh hình, tim mạch - lồng ngực, sản, nhi, điều dưỡng… Đặc biệt, tại phiên báo cáo tổng quan có 3 chủ đề: tiến bộ trong phẫu thuật ung thư thực quản; phẫu thuật robot hiện tại và triển vọng và tối ưu hóa ứng dụng cụ phẫu thuật. Trình bày tham luận tại Hội nghị, PGS.TS Trần Vĩnh Hưng, Giám đốc Bệnh viện Bình Dân cho biết ứng dụng phẫu thuật robot có rất nhiều triển vọng phát triển tại Việt Nam. Để ứng dụng phẫu thuật bằng robot thì quan trọng nhất là nguồn nhân lực chất lượng cao, cùng với đó cần giao lưu, hội nhập quốc tế để tăng khả năng cũng như có điều kiện học hỏi, chia sẻ kinh nghiệp và chuyển giao công nghệ. Các phương tiện chẩn đoán, tầm soát ở giai đoạn đầu của bệnh, cơ sở vật chất các bệnh viện phải đạt chuẩn xứng tầm, thêm các thiết bị chuyên sâu… Theo PGS.TS Trần Vĩnh Hưng, triển khai phẫu thuật robot có nhiều ưu thế, mang lại lợi ích thiết thực cho người bệnh; góp phần nghiên cứu khoa học cũng như đào tạo kỹ thuật viên robot trong nước và trong khu vực; ứng dụng công nghệ 4.0, trí tuệ nhân tạo góp phần vào sự phát triển của ngành ngoại khoa hiện nay... Nguồn: suckhoedoisong.vn"
98,Thừa Thiên Huế tổ chức “Tuần lễ du lịch chăm sóc...(11/12/2023),https://vietnamtourism.gov.vn/post/53678,"Theo lãnh đạo Sở Du lịch Thừa Thiên Huế cho biết, điểm nhấn của “Tuần lễ Du lịch chăm sóc sức khoẻ - Wellness Tourism Weekend” là các hoạt động giới thiệu sản phẩm gắn với sức khỏe như: ẩm thực dinh dưỡng, thiền và trà; dịch vụ spa và thăm khám, tư vấn sức khỏe theo hình thức truyền thống và hiện đại (miễn phí cho du khách và nhân dân đến tham quan); triển lãm các sản phẩm chăm sóc sức khoẻ được diễn ra xuyên suốt từ chiều ngày 15 đến hết ngày 17/12 dành cho người dân, khách du lịch trong và ngoài nước. Ngoài ra, còn có hoạt động cho đoàn Famtrip khảo sát, trải nghiệm sản phẩm du lịch kết hợp chữa bệnh dành cho các đoàn lữ hành trong và ngoài tỉnh. Trong khuôn khổ chương trình sẽ có hoạt động giới thiệu, quảng diễn  về phương pháp sơ thiền và yoga, buổi Talkshow về thực dưỡng - giới thiệu bữa ăn dinh dưỡng khoẻ mạnh tăng miễn dịch, Talkshow và quảng diễn về Nghệ thuật thưởng trà của người dân Huế, Talkshow “Đông y và chữa bệnh bằng phương pháp Cung đình” do các nghệ nhân, chuyên gia trong ngành phụ trách. Chương trình “Tuần lễ Du lịch chăm sóc sức khoẻ - Wellness Tourism Weekend” được tổ chức nhằm xây dựng và quảng bá thương hiệu du lịch chăm sóc sức khỏe ở Huế với các giá trị thực tiễn và sản phẩm chăm sóc khác biệt, độc đáo, có chất lượng, có sức cạnh tranh trong nước, khu vực và quốc tế; khẳng định Thừa Thiên Huế là điểm đến hấp dẫn dựa trên các giá trị thương hiệu chính như du lịch văn hóa di sản, du lịch đầm phá, du lịch ẩm thực, du lịch sinh thái… gắn với sản phẩm du lịch độc đáo mới - du lịch chăm sóc sức khỏe (du lịch nghỉ dưỡng và chữa bệnh). Bên cạnh đó, chương trình giúp du khách có cơ hội trải nghiệm về sự đa dạng của sản phẩm du lịch chăm sóc sức khỏe tại Huế, qua đó góp phần kéo dài thời gian lưu trú, tăng mức chi tiêu cũng như thu hút du khách quay trở lại địa phương với nhiều trải nghiệm khác biệt. “Tuần lễ Du lịch chăm sóc sức khoẻ - Wellness Tourism Weekend” cũng là cơ hội tốt cho các doanh nghiệp dịch vụ du lịch giới thiệu sản phẩm cũng như liên kết các thành phần kinh tế cùng tham gia tạo ra sản phẩm du lịch đặc biệt chăm sóc sức khỏe cho tỉnh Thừa Thiên Huế; đưa du lịch chăm sóc sức khỏe ở Huế lên một tầm cao mới, quy mô, chuyên nghiệp và hiệu quả hơn. Để hưởng ứng ""Tuần lễ Du lịch chăm sóc sức khoẻ - Wellness Tourism Weekend"", một số doanh nghiệp trên địa bàn tỉnh Thừa Thiên Huế kinh doanh các sản phẩm chăm sóc sức khoẻ sẽ có chương trình khuyến mãi đặc biệt áp dụng trong dịp này và kéo dài đến hết tháng 12. Chương trình “Tuần lễ Du lịch chăm sóc sức khoẻ - Wellness Tourism Weekend” hứa hẹn mang đến những giá trị thiết thực giúp người dân và khách du lịch nâng cao nhận thức về việc bảo vệ sức khỏe của bản thân"
